aid,title,author,image_url,published_date,article_url,category,raw_text,text,is_manipulated
33_19_03_2025,Alpint: Splittes av denne «mystiske» detaljen,Martine Sørhus,https://gfx.nrk.no/WPdGLTZia8IVN4o08cjXOgAy9xZz1XJYVX2MmCyNuxcQ.jpg,2025-03-18 07:36:39,https://www.nrk.no/sport/alpint_-splittes-av-denne-_mystiske_-detaljen_-_-burde-vaert-forbudt-1.17217930,Sports,"Saken oppsummert
En karbonstøtte for støvler skaper debatt i alpinmiljøet. Noen mener den gir urettferdige fordeler, mens andre ser den som nødvendig støtte for skadede utøvere.
Østerrikes alpinsjef mener støtten burde forbys, mens Norges sportssjef mener den ikke har en bevist effekt.
Den internasjonale skiforbundet (Fis) undersøker nå bruk og effekt av skinnen.
Det er også bekymringer omkring sikkerheten. Enkelte hevder skinne kan øke skadeomfanget ved et fall.
– Det burde absolutt vært forbudt.
Det sa Østerrikes alpinsjef Herbert Mandl til avisen Krone Zeitung om utstyrsdetaljen som det siste året har blitt en snakkis i alpinmiljøet.
Men det er ikke alle enige i.
– Dette er typisk ryktebørs, sier Claus Ryste til NRK. Han er sportssjef for alpint i Norges Skiforbund.
– Og at det skal være så jævlig bra for å kjøre så mye fortere, det er jeg svært skeptisk til. Det skal de jaggu få bevise før jeg tror noe på det, slår Ryste fast.
SKADET: Cyprien Sarrazin bruker de omtalte karbonskinnene, men er for tiden skadet etter et fall i Bormio. Foto: Reuters
– Vi er litt bjellesauer
Detaljen det er snakk om sitter i støvelen. Men den er ikke en «nyhet» i miljøet. I mange år har den blitt brukt av utøvere som trenger ekstra støtte etter en skade.
– Det er en skinne som du tar rundt leggen først, enten bare foran eller rundt hele leggen, det varierer litt. Den har vi hatt i veldig mange år, for folk som har knekt foten, hatt beinhinnebetennelse eller vondt i beinet, har brukt den for å forme foten, sier Ryste – og utdyper:
– Det er for å kunne stå tidligere på ski. Den fordeler trykket mer utover leggen. Helt inn mot leggen, en tynn, tynn greie, fortsetter sportssjefen.
SKEPTISK: Ryste er skeptisk til den vanvittige effekten av karbonskinnen. Foto: Martine Sørhus / NRK
Det er derimot hvem som bruker den som har endret seg. Italienske Christof Innerhofer er en av dem som bruker skinnene og er positiv til bruken.
– Det gir meg sikkerhet. Jeg føler meg mye mer komfortabel og den gir meg stabilitet i støvelen. Det er ikke noe mer aggressivt, jeg har ikke endret noe i støvelen, sier han til Kronen Zeitung.
Spesielt etter at ryktene gikk om at både Cyprien Sarrazin og Marco Odermatt brukte ulike varianter av skinnen, har flere har begynt å bruke skinnene i troen om at man skal kunne kjøre mer aggressivt. Det tror ikke Ryste noe på.
– (Cyprien) Sarrazin, da han begynte å kjøre fort, så begynte han å bruke sånne på begge beina, sier Ryste.
– Og så er vi jo helt idioter i dette systemet, unnskyld uttrykket ... Vi er litt sånn bjellesauer. Så det er veldig mange som har begynt med det. At dette er «the shit» for å kjøre fort.
Les også Blei kasta 300 meter ned fjellside: – Ingen veit korleis vi overlevde
– Et spørsmål om liv og død
Meningene var mange da Cyprien Sarrazin falt i Bormio og skadet seg stygt. Blant annet fikk han en blødning i hodet. Flere spekulerte om karbonskinnene han hadde rundt leggen kunne være en utløser for at fallet ble enda verre.
Den tidligere alpinisten Josef Ferstl mener skinnene gjør at man kan kjøre mer aggressivt og direkte, og at franskmannen ble skutt ut som en katapult på grunn av disse skinnene.
– Hvis han faller med den, er det ikke bare en kneskade, men noe mye mer alvorlig på grunn av de høyere fallkreftene. Dette er et spørsmål om rullestol eller til og med liv og død, hevdet tyske Ferstl overfor Sport Bild.
Foto: Alessandro Trovati / Alessandro Trovati / AP / NTB
Men Norges alpinsjef tror ikke på den enorme effekten som mange andre mener den gir.
– Det internasjonale skiforbundet (FIS) er veldig opptatt av at det blir mer aggressivt av det. Og det er ikke helt bevist, nei. Det er mye rykter, mye greier. Nå driver de med undersøkelser i et laboratorium i Tyskland, på vegne av FIS. Vi krangla mye om det på FIS' vårmøte, fra ulike perspektiver, sier Ryste.
Norske Adrian Smiseth Sejersted har selv testet ut den mye omtalte detaljen, uten å bli overbevist.
– Jeg har kjørt et par turer med den. Jeg synes ikke det var noe å skryte hjem om. Jeg bruker ikke den selv. Jeg kjører med ski og sko, sier Sejersted og ler.
– Det er veldig interessant at det blir tatt opp. Jeg ser på det som en veldig liten detalj på en skosetup. Det er ganske mange ting som kommer før det av viktige ting, mener han.
Vil ikke ta forhastede avgjørelser basert på «klager»
For debatten er blitt såpass stor og meningene så delte, at FIS nå har tatt tak i problematikken. Han forteller at debatten startet i fjor, og at det allerede har vært diskusjoner på komiténivå i det internasjonale forbundet.
– Det er noe vi etterforsker for å se hva slags innvirkning det har. Det sender kraften fra beinet på en mye annerledes måte enn uten. Vi må se at det er rettferdig, sånn at vi har like konkurransevilkår for alle utøverne, og også sikkerhetsaspektet, sier FIS-president Johan Eliasch til NRK.
Han forteller at tilbakemeldingene fra de ulike nasjonale forbundene har vært veldig blandet når det gjelder karbonskinnen.
– Noen har presset kraftig mot ethvert forbud mot det, mens andre sier det må forbys fordi det ikke er rettferdig for alle utøvere, sier Eliasch.
UNDERSØKES: FIS-presidenten sier de er på saken. Foto: JOHANN GRODER / AFP / NTB
– Det startet for å hjelpe skadede utøvere, og igjen, vi må være faktabaserte og ikke ta forhastede avgjørelser bare fordi folk klager.
For Ryste handler saken om å holde det så enkelt som mulig for sporten. Han mener det heller er viktig å vanne løypene mindre og få ned farten.
– Hvis du gjør det obligatorisk, så må du ha noen som sjekker. Det kan ikke bli en sport der det er 40 stykker i mål som skal sjekke alt mulig rart, vi må gjøre det litt enklere, sier Ryste.
– Folk som har knekt foten må jo få bruke det, vi kan ikke bare forby det? Hva skal de gjøre da? Da er jo de på skadelista for evig tid. Det er et produkt som har vært veldig nyttig for ski-industrien lenge.
null
Spiller nå
«Skiklubben» fikk Birkebeinerrennet sin hederspris 01:15
Neste
Full krangel etter målgang 00:57
Nika Prevc setter verdensrekord i Vikersund – Hoppet 236 meter 01:00
Tar solarium for å prestere: – Funket i hoppuka 00:55
Vis flere",Error generating text.,no
37_19_03_2025,– Er dette aprilsnarr?,TV 2 AS,https://www.cdn.tv2.no/images?imageId=17560741&x=0&y=37.09&cropw=100&croph=35.83&panox=0&panoy=37.09&panow=100&panoh=35.83&width=1200&height=630,2025-03-18 17:00:40,https://www.tv2.no/nyheter/forbruker/er-dette-aprilsnarr/17554056,Mat og drikke,"– Jeg har aldri opplevd lignende, sier Mohammed Basefer (37) til TV 2 hjelper deg.
37-åringen skulle overraske kona med film og takeaway.
Men da han åpnet takeaway-esken, fikk han seg litt av et syn:
– Er dette aprilsnarr?
Sjokksyn
Klokken var rundt 22:00 mandag kveld 10. mars.
37-åringen fra Oslo hadde nettopp bestilt tre kyllingburgere fra Kylling & Pizza Kalbakken i Oslo, til seg selv og kona.
Maten kostet 438 kroner og skulle leveres med Wolt.
– Det skulle ta mellom 25 og 35 minutter, men vi ventet vel i nærmere 70 minutter før vi fikk maten, forteller han.
– Vi åpnet esken og tittet på maten. Min første tanke var bare: «Dette så ikke delikat ut».
– Fengselsmat
Det første han la merke til var at han syns det fulgte lite pommes frites til.
– De var også kalde, men greit nok det.
– Så tok jeg en bit av burgeren og det føltes som at jeg ikke beit på kjøtt.
Han fjernet brødet på toppen for en nærmere titt.
– Synet var en uppercut. Maten så ut som fengselsmat.
– «Hva er dette?», spurte jeg kona som var like sjokkert.
Han tittet en ekstra gang på reklamebildet av burgerne for å sammenligne.
– Det er faktisk stikk motsatt av virkeligheten.
– Jeg har selv jobbet med burgere og har aldri sett en så trist burger i hele mitt liv.
REKLAMEN: Hva restauranten reklamerer for på Wolt vs. hva Basefer og kona fikk levert. Foto: Skjermdump / Wolt / privat
– Aprilsnarr?
Raskt tok 37-åringen kontakt med både Wolt og Kylling & Pizza Kalbakken.
Sistnevnte fikk ikke Basefer tak i, siden restauranten hadde rukket å stenge.
– Jeg sendte derfor et bilde av maten til Wolt og bare «er dette aprilsnarr?»
Wolt skrev at de skulle svare Basefer innen 48 timer.
– Så vi spiste derfor opp maten med bitterhet i kjeften, sier han.
– Jeg hadde jo tross alt brukt penger på dette.
La ut på Instagram
Etter at burgeren var fortært, la 37-åringen ut et bilde av maten på Instagram sin historiefunksjon.
– Jeg tagget restauranten og la på hashtagen «BurgerGate».
Dagen etter svarte restauranten på storyen:
– De nektet for at det var de som hadde laget denne maten, skyldte på Wolt-sjåføren, spurte hvilken avdeling jeg hadde bestilt fra og ba meg slette Instagram-storyen.
Basefer svarte at maten var bestilt fra Kylling & Pizza Kalbakken og la ved kvittering på ordren.
– Jeg påpekte at det var fra dem og at bildet de reklamerer med er HELT annerledes enn faktisk produkt, sier han irritert.
Og mer irritert skal han bli.
Ble blokkert
– Restauranten har nå blokkert meg på Instagram, sier han og fortsetter:
– Ja, jeg var frustrert, men ikke nok til at jeg fortjener å bli blokken!
– En fair løsning hadde vært at de sa «beklager, sånn skal ikke burgeren være». Isteden har de tatt helt avstand fra at det er de som har laget burgerne slik.
Omsider får 37-åringen også svar fra Wolt:
– De skriver at restauranten mener maten ikke så sånn ut da de leverte den ut, men sier også at ingen fra Wolt har tatt på maten.
– Så skrev de at restauranten ikke ville kompensere for noe.
Han spurte derfor rett ut: «Syns Wolt dette er innafor?»
Til svar fikk han at de ikke kan si noe på kvaliteten på maten, da det er restauranten som står ansvarlig for det.
– Wolt peker på restauranten og restauranten peker på sjåføren til Wolt.
– Jeg derimot satt igjen med mat som ikke engang hunder får, avslutter han.
Forbrukerrådet: – Bør få pengene tilbake
Juridisk seniorrådgiver i Forbrukerrådet, Thomas Iversen, sier at til tross for at Wolt og restauranten virker uenige om hva som har skjedd, så er en ting sikkert:
– Burgeren ser ikke ut som den skal.
– Her bør kunden få pengene sine tilbake. Fra et kundeserviceperspektiv, ville nok også en beklagelse vært strategisk.
Videre sier Iversen at en reklame ikke skal gi et villedende bilde av produktet som blir solgt.
Selv om det i denne saken er restauranten som er ansvarlig, sier han at dersom maten både var kald og ikke i tråd med det som var avtalt, kan forbrukeren velge hvem han retter kravet mot.
– Jeg regner med at Wolt kan sende kravet videre til restauranten dersom ansvaret ligger der, avslutter han.
Wolt svarer: – Det beklager vi
Kommunikasjonssjef i Wolt Norge, Christian Kamhaug, sier til TV 2 hjelper deg at de har undersøkt saken og besluttet å gi kunden full refusjon i dette tilfellet.
– Maten hans kom altfor sent og den var kald. Her har vi ikke levert som vi skulle, og det beklager vi.
– Dette er vårt ansvar, og det tar vi.
Kamhaug presiserer at kunden alltid skal kunne kontakte Wolt om det er noe de er misfornøyd med.
– Her kunne vi ha løst det bedre i første omgang, og håper at kunden vil gi oss en ny sjanse neste gang han er sulten på noe godt, avslutter han.
Restauranten svarer: – Veldig rart
TV 2 hjelper deg kontakter sjefen ved Kylling & Pizza, Kamarathas Banusha, for en forklaring.
– Mr. Mohammed bestilte en «3 Mini Burger Deal», som er en miniburger, en porsjon pommes frites og drikke for 109 kroner per meny.
– Vi har hatt denne kombinasjonsmenyen i flere måneder, og dette er første gang vi har hatt denne typen problemer.
Han forklarer at det hele startet da de ble tagget i Instagram-storyen.
– Vi fikk en melding på Instagram med et innlegg fra Mr. Mohammed med bilde av burgerne.
– Jeg syntes det var veldig rart, så jeg svarte han fordi jeg ikke trodde det kom fra oss.
Han legger til at de nylig har stengt en avdeling i Strømmen og trodde maten kom derifra.
– Det fordi den ikke så ut som burgeren vi lager i det hele tatt. Vi har mer pommes frites enn det og legger alltid to kyllingfileter i burgerne våre.
– Jeg spurte derfor om ordrenummer og ja – maten ble bestilt fra oss, innrømmer han.
Peker på Wolt
Men hva har skjedd, fra ordren ble lagt inn – til maten ble levert?
– Jeg har spurt personen som jobbet den dagen om en forklaring.
– Hun fortalte meg at sjåføren til Wolt var veldig sint fordi hun fortalte ham at hun ikke kom til å gi ham maten, hvis han ikke hadde en oppvarmet pose.
– Så han gikk tilbake til bilen sin for å hente posen, og var veldig sint, så hun tror han hadde noe med det å gjøre.
Banusha hevder at det har hendt flere ganger at noen varer eller drikke mangler etter å ha blitt hentet.
– Og vanligvis refunderer vi kundene.
Kommunikasjonssjef i Wolt Norge, sier at de er klar over at det var noen uoverensstemmelser mellom budet og restauranten, men ønsker ikke å gå i detalj på det.
Banusha sier til TV 2 hjelper deg at han ikke har en forklaring på hvorfor kunden fikk de burgerne han fikk:
– Men en ting er jeg sikker på og det er at burgerne våre ikke ser slik ut.
Innrømmer blokkering: – Jeg måtte
Videre sier Banusha at han prøvde å løse saken direkte med kunden:
– Jeg fortalte Mr. Mohammed at vi kunne levere den samme maten på nytt, på vår bekostning, av vår sjåfør – men vi fikk ikke noe svar fra han.
– Isteden fortsatte han å poste hån, så jeg måtte blokkere han. Vi kan ikke snakke med noen som ikke vil, avslutter han.
Basefer sier han oppfattet det motsatt, at restauranten dagen etter ba han returnere burgerne.
Han legger til at han ikke tror han hadde fått pengene uten hjelp.
– Takk, avslutter han.",Error generating text.,no
18_19_03_2025,Riksrevisjonen tordner mot strømpolitikken,Journalist,https://premium.vgc.no/v2/images/758e71eb-0c06-4813-b616-510758966cbb?fit=crop&format=auto&h=1365&w=2048&s=c5f2dbe03874a39f2de0e466a4e25ae74ae1e178,2025-03-18 09:32:27,https://www.aftenposten.no/norge/i/LMgxLx/riksrevisjonen-tordner-mot-stroempolitikken-fullbooket,Politikk,"Riksrevisjonen kaller en rekke forhold rundt strømnettet i Norge kritikkverdig og mener Energidepartementet må trappe opp tiltak for å sikre kapasitet.
neste
NTB-Kenneth Kandolf Haug og Anne Marjatta Gøystdal
– Mange steder er strømnettet fullbooket. Det er rett og slett ikke plass til alle som trenger strøm, kan koble seg på. Og der det ikke er fullt, blir det snart fullt, sa riksrevisor Karl Eirik Schjøtt-Pedersen under presentasjonen tirsdag.
I rapporten trekkes det særlig fram at det mangler kapasitet i strømnettet i store deler av landet, at Energidepartementet ikke har tatt grep for å sikre nok kapasitet, og at den samlede reguleringen ikke bidrar til at investeringer blir gjort i tide.
«Kritikkverdig» er nest sterkeste grad av kritikk som Riksrevisjonen opererer med.
«Sprengt» fra Sognefjorden og nordover
Riksrevisjonen trekker fram at fra Sognefjorden og nordover er det ikke nok nettkapasitet til at kunder kan reservere ny kapasitet til større forbruk. Mange steder på Sør- og Vestlandet vurderer Statnett den tilgjengelige kapasiteten nærmere, det er altså uklart hvor mye kapasitet det er igjen.
Riksrevisoren peker på at nye bedrifter kan risikere å vente opptil 15 år på nettkapasitet. Også dagens regulering og kontroll får kritikk, fordi det ikke klarer å sikre rask nok utbygging og effektiv utnyttelse av strømnettet.
På spørsmål fra kontroll- og konstitusjonskomiteens leder Peter Frølich (H) sier riksrevisoren at det ikke er tallfestet hvor stort det økonomiske tapet er, men at det er betydelig.
Videre peker han på at det kan handle om sikkerhetspolitikk. Om man skal bygge ut forsvarskapasitet i Finnmark, kan det trengs mer kapasitet i strømnettet enn det som finnes i dag.
Restaurantmetafor
Schjøtt-Pedersen beskriver hvordan myndighetene har lagt for lite vekt på målene som Stortinget har satt om nettkapasitet.
– Mye nettkapasitet er reservert av kunder som ikke bruker strømmen engang!
Schjøtt-Pedersen sammenlignet det med ikke å bli sluppet inn på en restaurant der det er ledige bord, fordi disse bordene er reservert av kunder som ikke møter opp.
Riksrevisjonen peker på at Statnett og nettselskapene ikke har tilstrekkelige insentiver eller krav til å utnytte nettet effektivt, og det tar for lang tid å gjennomføre tiltak i strømnettet.
Flere anbefalinger
Energidepartementet får også direkte kritikk for at man ikke har gjort endringer i sitt rammeverk overfor Statnett og NVE. Det kommer også en rekke anbefalinger til både Energidepartementet og andre myndigheter.
Riksrevisjonen anbefaler at de gjør grep for å sørge for at nettutviklingen skjer med utgangspunkt i prognoser og planer for fremtiden, og at investeringer gjøres i tide.
– Det er en utfordring at selve systemet ikke er rigget for å være i forkant, sier Schjøtt-Pedersen.
Samtidig anerkjenner Riksrevisjonen at det er mange, dels motstridende, hensyn som spiller inn når man planlegger strømnettet.
På spørsmål fra Aps Frode Jacobsen om slike interessekonflikter, særlig når det gjelder samiske områder, svarte Schjøtt-Pedersen at det er viktig å gjøre avveininger, men at det ikke må gå på bekostning av at man ikke får tatt en beslutning.
– Har forsømt arvesølvet
Flere politiske partier slutter seg til Riksrevisjonens hudfletting av Energidepartementet og andre myndigheter.
– Vi skal erstatte all fossil energi med fornybar. Det burde vært åpenbart at dette fører til økt forbruk av fornybar strøm. Likevel hadde ikke Statnett planlagt for det. Dette føles som nok et eksempel på at Norge ikke har tatt inn over seg at vi står midt i en enorm omstilling av samfunnet, sier SV-nestleder Lars Haltbrekken.
– Vi har forsømt arvesølvet vårt ved å ikke ivareta strømnettet som er så viktig for å sikre folk og industri hele landet rimelig, fornybar energi, sier Rødts Seher Aydar.
Fremskrittspartiet peker på sin side på dagens regjering.
– Frp mener regjeringen og Aasland med sine storstilte klimamål og aktive næringspolitikk har en stor del av skylden. Regjeringen fører en politikk som legger opp til vesentlig større belastning av strømnettet og planlegger samtidig å sende regningen til skattebetalerne, sier Marius Arion Nilsen (Frp).
Vil frigi kapasitet
MDGs Ingrid Liland mener regjeringen må frigi kapasitet som er reservert av olje- og gassnæringen.
– Riksrevisjonens rapport viser det MDG har sagt lenge: Kraften må brukes smartere. Vi har ikke råd til å sløse den bort på å grønnvaske oljebransjen, mens batterifabrikker og annen industri ikke får strøm.
– Riksrevisjonens rapport viser at mens EU har satt seg ambisiøse mål og jobbet målrettet for å sikre nok kraft og raskere utbygging, har norske myndigheter vært altfor passive. Energimyndighetene har fått for svake styringssignaler, og vi ligger langt bak i tempo. Norge kan ikke fortsette å somle mens behovet for mer kraft bare øker, sier Venstres Grunde Almeland.",Error generating text.,yes
22_19_03_2025,SSB venter to rente­kutt i år og tre i 2026,Marianne Stensland,https://vcdn.polarismedia.no/3133b258-eb45-4bc0-af41-49ab339aebee?fit=crop&h=630&q=80&tight=true&w=1200,2025-03-18 07:50:05,https://www.fvn.no/nyheter/okonomi/i/73gGnw/ssb-venter-to-rentekutt-i-aar-og-tre-i-2026,Politikk,"Statistisk sentralbyrå (SSB) har lagt frem ferske prognoser for norsk økonomi tirsdag morgen.
– Økt usikkerhet og
Til sammenligning ventet SSB
I motsatt ende har venter Nordea Markets at det verken blir rentekutt i år eller neste år.
Seniorstrateg Sara Midtgaard sier at det viktigste økonomene er uenige om er den nøytrale renten. Det vil si en styringsrente som er forenlig med å få inflasjonen tilbake til to prosent, en ledighet på to prosent, og en økonomisk vekst som ligger på trend.
- Vi tror det rentenivået ikke er så langt unna dagens nivå, men så tror nok SSB at det rentenivået er lavere enn det igjen, sier hun.
Sara Midtgaard
Senior makro- og valutastrateg i Nordea Markets
Venter «klar vekst» i økonomien
På tross av økte handelsbarrierer internasjonalt, venter SSB en «klar vekst» i norsk økonomi fremover.
Det forklares med økt kjøpekraft for husholdningene, økt satsing på forsvar og mer boligbygging.
SSB har tatt utgangspunkt i at handelsrestriksjoner vil vedvare hele prognoseperiode (ut 2028). Det påpekes at hvor mye den norske økonomien vil påvirkes av den politiske kursendringen i USA, avhenger av intensiteten i handelskonfliktene og deres varighet.
– Handelskonflikter vil svekke den samlede verdiskapingen i verden, men vil likevel ikke hindre klar vekst i norsk økonomi. Oppgangen er imidlertid betinget av at Norge ikke blir direkte berørt av tiltak som EU innfører som en reaksjon på USAs tolløkninger, sier von Brasch.
Lavere renter og økt satsing på forsvar
Prognosene legger til grunn at høy inntektsvekst og lavere renter vil stimulere husholdningenes konsum. I tillegg venter SSB fortsatt vekst i offentlig konsum og investeringer, der en stor del av investeringene er knyttet til satsing på forsvar.
– En mer fragmentert verdenshandel svekker den samlede verdiskapingen, men konsekvensene innenfor vår prognosehorisont er trolig begrensede. Selv om vi har nedjustert anslaget for
BNP Fastlands-Norge
med drøyt én prosent samlet over årene 2025 til 2027, venter vi en oppgang i norsk økonomi, sier von Brasch.
I fjor endte norsk konsumprisindeks (
KPI
) med en oppgang på 3,1 prosent.
SSB tror inflasjonen vil bli liggende noe over Norges Banks mål om en prisvekst rundt to prosent, og forklarer dette med markant lønnsvekst, kronesvekkelse og økt prisvekst internasjonalt.
Svak internasjonal vekst
Samtidig som SSB spår norsk vekst, er de mer lunkne i forhåpningene for internasjonal økonomi. Det skyldes blant annet at Trump-administrasjonens politikk skaper usikkerhet rundt fremtidige rammebetingelser.
– Stadige endringer i rammebetingelsene vanskeliggjør langsiktig planlegging og skaper særlig usikkerhet for investeringer og handel mellom land. Veksten internasjonalt ventes å bli svak de neste årene, sier forsker Roger Hammersland.
Roger Hammersland
Forsker i SSB
Den eksportvektede BNP-veksten hos Norges handelspartnere ventes nå å ligge på rundt 1,5 prosent i 2025 og 2026. Denne har ligget på knappe 2 prosent siden 2005, ifølge SSB.
Midtgaard sier at økonomer skiller seg fra hverandre ved synet på europeisk økonomi. Hun tror at den nylig lanserte pakken tilsvarende 800 milliarder euro på infrastruktur og forsvar i EU vil kunne stimulere aktiviteten, eller dempe nedsiden.
- Nedsiden og risikoen i europeisk økonomi er mindre ettersom den enorme pakken på infrastruktur og forsvar skal gjennomføres. Den kan dempe noe av nedsiderisikoen for europeisk økonomi og norsk økonomi. Vi tror flere land vil følge etter og bruke mer på forsvar, sier hun.",Error generating text.,yes
