aid,title,author,image_url,published_date,article_url,category,raw_text,text,is_manipulated
4_19_03_2025,Til venstre står mannen som styrer russisk Svalbard-politikk. Er han en trussel mot Norge?,Gunnar Thorenfeldt,https://premium.vgc.no/v2/images/5153da3a-10e5-440a-9f60-5a23a5881f88?fit=crop&format=auto&h=1365&w=2048&s=b673f0234463e9f30e4f8c2db26a166ff1cbd942,2025-03-18 21:28:42,https://www.aftenposten.no/verden/i/yEnyAA/til-venstre-staar-mannen-som-styrer-russisk-svalbard-politikk-er-han-en-trussel-mot-norge,Politikk,"Hva vil Russland med Svalbard?
«Fulltrefferen i sysselmannsgården drepte 22 og såret flere. Med uhyggelig treffsikkerhet ble neste bombe droppet på sykehuset. Deretter fikk Huset med kafé og kinosal en treffer. Voldsomme flammer slo opp fra den gamle murbygningen. Napalm?».
For 47 år siden var det slik forfatter Jon Michelet så for seg angrepet på Svalbard.
Da var det Sovjetunionen han mente ville true den norske øygruppen. I forordet til boken «Angrepet på Longyearbyen» skrev Michelet:
«Den er ment som en advarsel. Advarselen retter seg i første rekke til supermakten Sovjet som konkret planlegger et slikt angrep. Men boken er også en advarsel til norske myndigheter som velger å overse disse planene, å stikke nebbet i sanden når russerne provoserer og truer».
Mener Norge bryter traktaten
Lenge sluttet nordmenn å være redde for russere på Svalbard. Forholdet mellom den norske byen Longyearbyen og den russiske byen Barentsburg ble mer og mer normalt. Mange trodde forholdet bare ville bli varmere.
Men så kom krigen i Ukraina. Truslene fra Russland ble hardere og hardere. Nå er flere redde for krig i Norge igjen. Og Svalbard blir på nytt nevnt som stedet hvor krigen kan begynne.
«Svalbard kan potensielt være det neste målet», sa professor Katarzyna Zysk til TV2. Fredag gjentok Russland anklagene om at Norge militariserer Svalbard, og benytter øygruppen til militære formål. For tredje gang på et halvt år anklages Norge for å bryte Svalbardtraktaten. Statsminister Jonas Gahr Støre (Ap) avviser Russlands påstander.
«Spenningen mellom Nato og Russland har aktualisert Svalbards militærstrategiske verdi for Moskva», slo etterretningstjenestene fast i trusselvurderingen Fokus 2025.
– Hybrid operasjon
På begynnelsen av 80-tallet fryktet Norge bomber og napalm. I dag ser ekspertene for seg et angrep på Svalbard helt annerledes.
– Det man kan se for seg, er en hybrid operasjon, at Russland skaper en nødssituasjon på Svalbard, som gjør at de kan si at de må stille opp med russiske nødetater for å beskytte russiske borgere og interesser, sa professor Kari Aga Myklebost ved Norges arktiske universitet til Aftenposten for to uker siden.
Men da Aftenposten skrev om Russland hybride krigføring desember 2024 reagerte Den russiske ambassaden i Oslo skarpt. De mener det er Vesten som bedriver hybrid krigføring mot dem.
– Anklager om at Russland driver «hybridkrigføring» er absurde. Selv etter sabotasjen av gassrørledningene «Nord Stream», da russisk undervannsinfrastruktur ble sprengt, fortsetter noen å «måle andre med samme mål som seg selv», skrev ambassaden på deres Facebook side.
Hva er det russerne selv sier?
Mektig direktør
Aftenposten har gått gjennom materialet Russland selv har produsert det siste året om deres planer for Svalbard.
Det er spesielt to russere som bestemmer mye om Russlands politikk overfor Svalbard.
Den ene er Ildar Neverov (45). Han er direktør for det statlige russiske gruveselskapet Arktikugol («Arktisk kull» red.anm.). Et russisk statseid kullselskap som opererer i Barentsburg på Svalbard. Der bor det cirka 500 personer.
Aftenposten har kontaktet Neverov og Arktikugol. De har varslet at de kommer til å svare, men at de vil understreke at de ikke kommer til å svare på spørsmål som «gjelder politiske hendelser eller kommersielle aktviteter hos Artikugol».
Det russiske gruveselskapet eier og driver de fire traktaeiendommene på Svalbard:
Pyramiden.
Bartentsburg.
Grumantbyen.
Bohemanflya.
For tiden pågår det en spektakulær rettstvist om Bohemanflya, hvor tidligere Yukos-aksjonærer har fått medhold ved en norsk tingrett å sikret et utlegg på hele 57 milliarder på eiendommen, ifølge DN.
Dette er et krav som er rettet mot den russiske staten fra tidligere aksjonærer i selskapet til Mikhail Khodorkovskij, som var Russlands rikeste mann før han ble arrestert av Vladimir Putin.
– I en orkan
Neverov har flere ganger markert seg, blant annet ved å sette opp et fem ganger tre meter stort sovjetisk flagg ved Pyramiden og ved å sette opp et syv meter høyt russisk-ortodoks kors i Barentsburg.
Men han har også vært en person som flere ganger har talt varmt om samarbeidet med Norge på Svalbard. Og hvordan den spesielle situasjonen på Svalbard gjør det mulig for Russland å omgå sanksjoner mot landet.
Under en paneldiskusjon høsten 2023 fortalte Neverov hvordan de hadde kommet seg gjennom «en orkan» av sanksjoner på Svalbard. Under paneldiskusjonen, som hadde tittelen «sanksjoner som mulighet for utvikling», sa Neverov at de klarte å endre strategi etter tre måneder med sanksjoner.
– Nå er Svalbard det eneste stedet i vesten hvor vi kan betale med russiske rubler som om vi er i Murmansk, fortalte Neverov.
Da Arktikugol skulle presentere sin nye strategi for Svalbard under en konferanse i St. Petersburg september 2024 var det under tittelen «Svalbard – en oase for internasjonalt samarbeid».
I en videopresentasjon av russiske virksomheter på Svalbard viste de frem et bilde av Longyearbyen og Barentsburg med tittelen: «Et nabolag mellom to land».
Vil ha med Sør-Afrika og Brasil
Møtet var en del av Russlands «Østlige økonomiske forum», som ble avholdt i byen Vladivostok. Under konferansen dominerte delegater fra BRICS-landene, som inkludert Russland, blant annet består av Kina, India, Sør-Afrika, Indonesia og Brasil.
Og det var ingen tvil om at dette også er strategien for Russland. Under konferansen ble det presentert planer for et omfattende forskningssamarbeid mellom Brasil, India, Sør-Afrika og Kina på de russiske bosetningene på Svalbard.
Under paneldiskusjonen viste de blant annet frem en rekke plansjer, som viser hvorfor Brics-landene bør satse på Svalbard. Der blir nettopp forskning, klima og turisme presentert som store muligheter for landene.
Under møtet viste Neverov hvordan de nå har fått tillatelse til å fly direkte fra Moskva til Longyearbyen, hvordan Svalbard fortsatt er uregulert, og at det er store muligheter for å investere i området. Da han ble spurt om den russiske turisten Andrej Jakunin, som ble arrestert for å ha fløyet en drone på Svalbard, spøkte han:
– Men ingen har sagt noe om å fly en drone under vann. Det er jo en interessant mulighet.
«Den arktiske tsaren».
Bak konferansen som Neverov deltok på, står en av Russlands mektigste menn.
Det er visestatsminister Juri Trutnev (69), som er ansvarlig minister for departementet for Østen og Arktis.
Han er blitt kalt for «Den arktiske tsaren» og har kontroll over mesteparten av pengene som går til Arktis, ifølge Carnegie Politika.
I tillegg er han leder for «Regjeringskommisjonen for å sikre russisk tilstedeværelse på Svalbard».
Ved det siste møtet i kommisjonen, februar 2024, kom han med en sterk advarsel mot norske myndigheter. Barents Observer skrev om dette møtet først.
Russisk blod på Svalbard
«Ingen av rettighetene og fordelene som er oppnådd av Russland på Svalbard kan reduseres eller krenkes. Vi vil ikke bevege oss et eneste skritt bakover», sa Trutnev under åpningen av møtet, før han nevnte krigen i Ukraina.
«I dag taper våre krigere blod for vårt lands suverenitet og vår rett til å snakke det russiske språket», sa Trutnev før han viste til at situasjonen på Svalbard var sammenlignbar.
«Arbeidet vårt her er også en kamp for vår suverenitet, og en kamp for rettighetene til Russland og russerne», sa visestatsministeren.
Under et møte med de ni visestatsministerne for Russland mandag 10. mars ble Svalbard igjen nevnt. Da ble det nevnt at Russland skulle øke bevilgningene for geologiske undersøkelser under vann, «spesielt for å drive forskning på vanskelig tilgjengelige territorier som er en del av Russlands spesialinteressesoner».
De russiske «spesialinteressesonene» er ifølge Russland: «Arktis», «Antarktis», «Verdenshavet» og «Svalbard».
Toppmøte om Arktis
Neste uke er Trutnev og Russland president, Vladimir Putin, initiativtagere til enda en større konferanse om Arktiks og nordområdene. Både Trutnev og Arktikgul-direktør Neverov kommer til å delta på konferansen, som vil bli holdt i Murmansk 26. til 27. mars. 3600 deltagere fra 52 land skal delta, ifølge konferansen.
Konferansen heter «Arktis: Dialogens territorium». Hovedemner er blant annet «Den nordlige sjøruten» og «utvikling av sentrale bosetninger».
På konferansen hjemmeside så er konferansen presentert med et stort bilde av Russlands president Vladimir Putin, og med et helt nytt sitat fra presidenten:
«Alt som skjer i nord er av spesiell interesse og verdi for oss. Og det er allerede før man vurderer utbyggingen av Den nordlige sjøruten. Samlet sett ligger fremtiden vår i dette området (...) I de kommende tiårene vil Russlands vekst komme fra Arktis og nord. Dette er helt tydelig å se».
Aftenposten har kontaktet presseansvarlig for konferansen, men vi har så langt ikke fått svar.
I 2019 deltok Norges statsminister Erna Solberg på konferansen. Da var tonen mellom Norge og Russland langt mer hjertelig.
Denne gangen er det ingen nordmenn som er satt opp som deltagere på konferansen.",Error generating text.,yes
9_19_03_2025,Ekspertar svarar på kva Israels nye angrep på Hamas i Gaza kan bety,Espen Alnes,https://gfx.nrk.no/rfGI_R7Nxs1n7H4NMLq3uQWaAtTu5O0aT8XTcuptp8hA.jpg,2025-03-18 16:01:40,https://www.nrk.no/urix/ekspertar-svarar-pa-kva-israels-nye-angrep-pa-hamas-i-gaza-kan-bety-1.17344584,"Politics, Crime","Saka samanfatta
• Over 400 menneske er drepne i israelske luftangrep på Gaza natt til tysdag.
• Israel hevdar angrepa kjem som svar på at Hamas har nekta å sette fri israelske gislar.
• Midtausten-ekspert Jørgen Jensehaugen meiner våpenkvileavtalen mellom Israel og Hamas er broten, og at Israel forbereder seg på å sende bakkestyrkar til Gaza.
• Forskar i Forsvaret Hanne Eggen Røislien trur angrepet er det første av fleire framover, men er usikker på om det vil utvikle seg til ein fullskala krig.
• Begge ekspertane tvilar på at partane vil kjem seg til neste fase av våpenkvileavtalen.
• Jensehaugen fryktar at USAs støtte til Israel kan føre til ein langvarig krig.
Oppsummeringa er laga av ei KI-teneste frå OpenAI. Innhaldet er kvalitetssikra av NRKs journalistar før publisering.
Over 400 menneske blei drepne i israelske luftangrep natt til tysdag. Hamas seier dette er eit einsidig brot på avtalen om våpenkvile.
Israel seier at angrepa kjem fordi Hamas fleire gongar har motsett seg å sette fri israelske gissel.
– Israel vil frå no av bruke auka militærmakt mot Hamas, skriv israelske styresmakter i ei pressemelding.
Kvifor skjer dette no?
Våpenkvileavtalen som Israel og Hamas blei einige om i januar, var delt inn i tre fasar. Ifølge tidsplanen skulle vi no ha vore godt inne i fase to. Men dit har vi ikkje kome, seier Midtausten-ekspert og seniorforskar ved Prio, Jørgen Jensehaugen.
– Det har lenge vore klart at det er lite sannsynleg at ein skulle klare å komme til fase to. Dei siste par vekene har det vore ei slags opptrapping mot at våpenkvila skulle ta slutt, seier han.
Seniorforskar Jørgen Jensehaugen ved Prio. Foto: ISMAIL BURAK AKKAN / NRK
Han seier at Israel blant anna har blokkert naudhjelp som skulle inn i Gaza, og at dette er ei varsla katastrofe. Dei siste vekene har det også vore fleire meldingar om menneske som er drepne i israelske luftangrep i Gaza.
Forskar og rådgjevar i Forsvaret, Hanne Eggen Røislien, åtvara tidlegare i mars om at krigen kunne blusse opp att. Ho seier at mistilliten er stor mellom partane.
– Israel har vore redde for at Hamas skulle bruke våpenkvila til å bygge seg opp igjen. Det er ein stor mistillit. Israelarane og palestinarane stoler ikkje på kvarandre, og er engstelege for a dei skal bruke våpenkvila til å angripe kvarandre igjen.
Ein lastebil med naudhjelp køyrer gjennom Rafah tysdag. Dette er ein av få bilar som har fått køyre over grensa til Gaza dei siste vekene. Foto: EYAD BABA / AFP / NTB
Blir det full krig igjen?
Røislien trur angrepet natt til tysdag er det første av fleire angrep som kjem framover. Men ho er usikker på om det blir like omfattande krig som det var før våpenkvila starta.
– At IDF kjem til å fortsette å utføre denne typen angrep ei god stund til, er ikkje overraskande. Men ein storskala bakkeinvasjon som vi såg frå november 2023, er noko heilt anna. Det er mindre truleg, fordi det krev ein annan type mannskap.
Forskar i Forsvaret Hanne Eggen Røislien Foto: Aurora Ytreberg Meløe / NRK
Men Jensehaugen meiner våpenkvila no er over, og trur Israel no gjer seg klare til å gå inn med bakkestyrkar i Gaza igjen.
– Evakueringsordren dei har kome med no, tyder på at dei har tenkt å gå inn med styrkar igjen. Og då er vi tilbake i Gaza-krigen igjen.
Mange palestinarar har flykta frå heimane sine etter at Israel sende ut ein ordre om evakuering tysdag. Foto: Abd Elhkeem Khaled / Reuters / NTB
Er våpenkvileavtalen død?
Israel melde i helga at dei hadde sendt ein delegasjon til Egypt for å blant anna drøfte vidare frigjeving av israelske gissel på Gazastripa.
Hamas seier tysdag til AFP at dei har møter med meklarar for å vurdere situasjonen og dempe aggresjonen.
Men angrepa mot Gaza viser at situasjonen er fastlåst, seier Røislien.
– Dette er slik denne konflikten kjem til å sjå ut i ganske lang tid. Fordi det er så låg tillit, kjem partane til å halde fram på denne måten.
Jensehaugen tvilar også på at partane vil komme seg vidare til neste fase med det første.
– Prosessen som var i gang stranda eigentleg på steg ein. Israel gjorde det tydeleg at dei ønskte å forlenge fase ein, og ikkje ei opptrapping til fase to. Så vi var eigentleg veldig langt unna å kome til den neste fasen.
Er dette starten ein langvarig krig?
Fleire land har fordømt det israelske angrepet natt til tysdag, og seier at dei er uroa for situasjonen i regionen, skriv The Guardian.
Også familiane til dei israelske gislane som framleis er i Gaza, har fordømt angrepet.
Familiane til gislane som framleis er i Gaza demonstrerer utanfor nasjonalforsamlinga i Israel. Foto: Mahmoud Illean / AP / NTB
Men Israel har fått støtte frå USA. President Donald Trump har blant anna lova at «helvete skal bryte laus» om Hamas ikkje set fri gissel.
Han har også kome med forslag om at USA tek over Gazastripa for å lage det han har kalla «Midtaustens riviera». For å få til det, vil han tvangsflytte palestinarar.
Kan USA bare ta over Gaza?
Siden slutten av 2. verdenskrig i 1945, har det vært forbudt å overta andres territorium med makt. Dette er en av bærebjelkene i folkeretten.
Den eneste måten USA kan ta kontroll over Gaza på, er om myndighetene i området går med på det.
Israel kan ikke gi Gaza til USA, slik Trump påstår. Den internasjonale domstolen (ICJ) har slått fast at Israel okkuperer Gaza, og at denne okkupasjonen er ulovlig.
Å forflytte sivilbefolkningen i et okkupert område er også ulovlig, ifølge folkeretten.
Trump trenger altså samtykke fra palestinske myndigheter, og palestinerne, dersom han skal kunne ta kontroll over Gaza.
Jensehaugen fryktar dette er starten på ein langvarig krig, og meiner utsegnene til Trump er med å legitimere israelsk flytting av palestinarar.
– Det betyr at dei verste elementa i israelsk politikk får støtte frå Det kvite hus. Og det gjer det veldig alvorleg.
Røislien har likevel eit lite håp om at det internasjonale samfunnet skal reagere på det som no skjer.
– Verda ser kva som skjer, og kan ikkje godta at det blussar opp igjen, og det kanskje i storskala. Eg trur vi kjem til å sjå eit internasjonalt samfunn som grip inn igjen, seier ho.",Error generating text.,no
3_19_03_2025,Politikere prioriterer uavhengige podkaster: – En unik anledning til å snakke ut,Heather Ørbeck Eliassen,https://gfx.nrk.no/5pcmpSAbxRBa-7I_GINToA4R8uLgVkt_iZ-nepbHI-1Q.png,2025-03-19 04:58:52,https://www.nrk.no/kultur/politikere-prioriterer-uavhengige-podkaster_-_-en-unik-anledning-til-a-snakke-ut-1.17251948,Politics,"– Så populær som podkastene har blitt, vil jeg ikke bli overrasket om noen erklærer at de har påvirket velgerne – og dermed valgresultatet, sier Henrik G. Bastiansen.
Han er medieforsker og har fulgt utviklingen fra den første podkasten i Norge ble lansert i 2005. Han forteller at podkastformatet har gått fra å være ren underholdning til å få større påvirkningskrav i politiske valg.
– Ethvert parti som skal ut i valgkamp må jo tenkte på hvordan de skal nå ut til velgerne, sier Tina Bru (H).
– Når det er så mange som får med seg hva som blir sagt i podkaster og de når ut til så mange, så må vi også vurdere om vi skal være til stede der, sier nestleder i Høyre, Tina Bru.
38-åringen sier hun er tilhenger av podkastformatet, men understreker at hun ikke bare er positiv.
– Man ser at noen podkaster aktivt bidrar til mer polarisering eller gir et feil bilde av hvordan ting henger sammen.
– Noen ganger handler deltakelsen om at vi er gjester i podkaster for å få korrigert et inntrykk av noe, legger hun til.
I tillegg til å delta i andres podkaster, har Høyre også sin egen podkast. «Stortingsrestauranten» har rundt 6.000 nedlastinger per episode.
Tina Bru (H) er tilhenger av podkastformatet. Foto: Heather Ørbeck Eliassen / NRK
Ikke alene
Men nestlederen i Høyre er ikke alene om å stille opp i podkaster. Rødt-politiker Mímir Kristjánsson prioriterer det høyt, spesielt uavhengige podkaster.
Mímir Kristjánsson har blant annet deltatt i Norges største uavhengige podkast. Foto: Heather Ørbeck Eliassen / NRK
– Jeg tror det er viktig å være med i uavhengige podkaster. En ting er at mange hører på, men en annen ting er at du får en helt unik anledning til å snakke ut som du ikke får i de gamle medieformatene, sier Rødt-politiker Mímir Kristjánsson.
Kristjánsson har gjestet i «Wolfgang Wee Uncut», som er Norges største uavhengige podkast. En podkast med godt over 100.000 ukentlige nedlastinger.
Podtoppen som viser de mest lyttende podkastene i Norge. Wolfgang Wee sin podkast har nærmere 130.000 nedlastinger. Foto: Wolfgang Wee
– Snakke fritt kan man jo gjøre overalt, men å høre interessante folk snakke lenge og uavbrutt synes jeg var en mangelvare i norsk offentlighet. Så mitt eget prosjekt handler mye mer om ideer, erfaring og kunnskap enn ytringsfrihet, sier Wolfgang Wee til NRK.
Podkasten er ikke knyttet til et politisk parti, men i en tidligere undersøkelse kom det frem at podkasten har en stor andel lyttere fra høyresiden.
Mímir Kristjánsson også sin egen podkast sammen med samfunnsdebattant Magnus Marsdal. Den regnes som en venstreorientert podkast og heter rett og slett «Mimir & Marsdal» og har ifølge Podtoppen i underkant av 30 000 lyttere. De prater rett og slett om politikk og alt annet som måtte interessere dem.
Samfunnsdebattant Magnus Marsdal sammen med Mímir Kristjánsson, politiker i Rødt. Foto: Heather Ørbeck Eliassen / NRK
En del av ytringsfriheten
Mange norske partier og enkeltpolitikere har i dag egne podkaster. Heller ingen av disse er underlagt redaktørstyrte medier.
– Det blir stadig flere store uavhengige podkaster, hvor man ikke behøver å ta hensyn til balanse, slik allmennkringkasterne må gjøre, sier han. Uavhengige produsenter kan gjøre hva de vil, sier han.
Henrik G. Bastiansen er medieforsker ved Høgskolen i Volda. Han har skrevet en rekke bøker om medienes utvikling. Foto: Heather Ørbeck Eliassen / NRK
Han understreker likevel at dette er en del av ytringsfriheten i Norge og man har lov til å fylle den med de stemmer og perspektiver de vil.
– Kan få betydning for hvordan folk stemmer
Hvordan dette vil arte seg i Norge vil vi trolig få se for første gang under valgkampen til høsten, mener medieforsker Henrik G. Bastiansen.
– Når podkaster har sterke profiler, uavhengig om de er høyre- eller venstreorienterte, så leter gjerne lytteren etter ting som bekrefter deres synspunkter. På den måten kan podkastene forsterke den overbevisningen de allerede har innenfor politikken, sier han.
– Dersom det kommer polariserte podkaster med mange lyttere, så kan det få betydning for hvordan folk stemmer, legger forskeren til.
Akkurat det skjedde under Presidentvalget i USA høsten 2024. Mange mente at Donald Trump sin opptreden i verdens mest populære podkast «The Joe Rogan Experience» (og det at Kamala Harris ikke stilte som gjest i samme podkast) kan ha påvirket det amerikanske valgresultatet.
Audun Lysbakken lanserer ny podkast på fredag. Foto: Frode Fjerdingstad / NRK
Her hjemme lanserer politiker og tidligere leder i SV, Audun Lysbakken sin egen podkast denne uken.
– Jeg opplever at folk har et stort behov for å forstå hva som skjer, for å se sammenhengene i det tilsynelatende kaoset. Jeg deler den følelsen, og podkasten er et forsøk på å hjelpe både meg selv og lytterne til å forstå, sier Lysbakken.",Error generating text.,no
