aid,title,author,image_url,published_date,article_url,category,raw_text,text,is_manipulated
25_09_04_2025,Norge har inngått ny avtale med Ukraina,Bjørn Haugan,https://akamai.vgc.no/v2/images/c22c656a-ca8c-461f-a35d-a82da3d11f14?format=auto&w=1080&s=773af44bc0aa5e0f1ba15f450e4527233ddd1c60,2025-04-08 12:58:08,https://www.vg.no/nyheter/i/wgQv2o/norge-signerer-ny-frihandelsavtale-med-ukraina,"Business, Economics","Næringsminister Cecilie Myrseth har undertegnet frihandelsavtale med Ukraina.
Nå
I dag signerte Norge og de tre andre EFTA-statene Island, Liechtenstein og Sveits en ny og modernisert frihandelsavtale med Ukraina i Kyiv.
– Dette er en viktig milepæl. Avtalen er et viktig bidrag til å styrke Ukrainas integrering i det europeiske markedet, og vil bidra til å øke Ukrainas motstandskraft, økonomiske utvikling og vekst, sier næringsminister Cecilie Myrseth.
Frihandelsavtalen ble undertegnet av Ukrainas første visestatsminister og økonomiminister Yuliia Svyrydenko, Norges næringsminister Cecilie Myrseth, Islands minister for kultur, innovasjon og høyere utdanning Logi Einarsson, ambassadør Frank J. Büchel fra Liechtenstein og Forbundsrådsdelegat Jacque Gerber fra Sveits.
– Hva skiller den nye moderniserte frihandelsavtalen fra den tidligere?
– Noe av det viktigste er at den har stort fokus på små- og mellomstore bedrifter, som vil gjøre det lettere med e-handel og digitalisering som de er gode på i Ukraina, som gjør at det skapes nye bedrifter i Ukraina, sier Myrseth på telefonen til VG.
– Hva er andre oppsider for Ukraina?
– Det er ekstremt viktig for Ukraina å få økonomien opp å gå og få bedrifter til å fungere. Avtalen vil bidra til det.
Hun legger til at null toll mellom oss og Ukraina er viktig å synliggjøre:
– I disse tider, hvor vi ser at vi ikke kan ta frihandel for gitt, er det viktig å vise verden at vi signerer en frihandelsavtale.
– Kan den svekke norsk landbruk?
– Nei, denne avtalen er god også for Norge, så ingen skal være bekymret for norsk landbruk eller andre sektorer knyttet til denne avtalen.
– Pådriver
Handelen mellom Ukraina og EFTA-landene utgjorde i 2024 1319 millioner euro, hvor eksport til Ukraina er større enn deres eksport til EFTA-landene.
– Vi skal være pådriver for å styrke Ukrainas økonomi. Det er bra også for Norge, sier Myrseth.
Den moderniserte frihandelsavtalen omfatter nye kapitler om digital handel, små og mellomstore bedrifter, og handel og bærekraftig utvikling, samt reviderte bestemmelser om handel med varer, veterinære- og plantesanitæretiltak, handelstilrettelegging, offentlige anskaffelser, teknisk samarbeid, beskyttelse av åndsverk og tvisteløsning.
Avtalen har også bedret markedsadgangen for varer inkludert for en rekke landbruksvarer.
– Dette vil styrke handelsrelasjonene og gi bedre markedsadgang for bedrifter på begge sider, fremholder næringsministeren.
Detaljer om handelen med Ukraina:
Den bilaterale varehandelen mellom EFTA og Ukraina nådde nesten 1319 millioner euro i
2024. Med en gjennomsnittlig vekstrate de siste fem årene på 4,9 % for import og 9,3 % for eksport, har handelsoverskuddet i EFTA-statenes favør fortsatt å øke.
Hovedimporten til EFTA-statene var fett og oljer (37 millioner euro), edelstener og metaller (26 millioner euro), vevde klær eller klestilbehør (22 millioner euro), møbler, madrasser og lignende møbler (20 millioner euro), og drikkevarer og brennevin (20 millioner euro).
Hovedeksporten til Ukraina var fisk og krepsdyr (229 millioner euro), farmasøytiske produkter (143 millioner euro), våpen og ammunisjon (77 millioner euro), kjøretøy (77 millioner euro) og elektriske maskiner (44 millioner euro).
Vis mer
– Uvurderlig
– Støtten som Ukraina har mottatt fra EFTA-statene er uvurderlig. Vi er sikre på at denne moderniserte frihandelsavtalen vil gi konkrete fordeler for Ukraina og EFTA-statene ved å skape betingelser for enda større samarbeid, åpne opp nye muligheter for bedrifter og bidra til økt levestandard for våre folk i disse utfordrende tider, sier Yuliia Svyrydenko, Ukrainas første visestatsminister og økonomiminister.
– I disse tider er det viktig at vi jobber for en regelbasert og åpen verdenshandel, og et godt på tvers av Europa. Denne frihandelsavtalen skaper nye muligheter for næringslivet både i Ukraina og i de fire EFTA-landene, sier Myrseth.
– Sats i Ukraina
Myrseth er i Kyiv sammen med norsk næringsliv for å styrke handelssamarbeidet og legge til rette for økt støtte fra private.
– Norsk næringsliv er ivrige etter å bidra til gjenoppbyggingen av Ukraina både nå, men også når Russlands ulovlige krig er over. Den nye avtalen er et tydelig signal til næringslivet om å satse i Ukraina, og vi skal jobbe videre for å styrke de økonomiske båndene mellom våre to land, sier Myrseth.
Direktør i Næringslivets Hovedorganisasjon, Idar Kreutzer, er en del av den norske delegasjonen i Ukraina.
– Det er veldig viktig for Norge å få etablert gode forbindelser i Ukraina. Behovene i Ukraina er store og norsk næringsliv har mye å bidra med.
– Energisektoren er åpenbar, sier han.
– Vi bidrar med fornybar energi. Scatec er tredje største produsenten av fornybar energi i Ukraina i dag. Bergen Engines har inngått store kontrakter om levering av generatorer, som kan produserer elektrisitet.
– Det er også stort behov for boliger og for infrastruktur hvor Norge har teknologi og gode løsninger, sier han.",Error generating text.,no
3_09_04_2025,Trump signerer presidentordre for å øke kullproduksjon,Lytt til saken,https://akamai.vgc.no/v2/images/d6c942ea-a980-421a-8d2d-d16de171aa04?format=auto&w=1080&s=aefe7ba1afefc1b74622d55fab29a4bf925dc907,2025-04-08 20:48:07,https://www.vg.no/nyheter/i/kwOmm6/trump-signerer-presidentorder-for-aa-oeke-kullproduksjon,"Politics, Business, Economics","– Vi vil raskt fremskynde tildelingen av lisenser for kullutvinning på føderal grunn, sier presidenten.
Nå
– Vi avslutter Joe Bidens krig mot det vakre, rene kullet én gang for alle. Vi skal få gruvearbeiderne tilbake i jobb.
Det er beskjeden fra USAs 47. president, Donald Trump.
Bak han står energi- og kullgruvearbeidere fremstilt i The East Room – et festlokale – i Det hvite hus.
Ifølge Trump går administrasjonen hans inn for fjerne reguleringer mot kullindustrien i landet.
I praksis betyr det at kullproduksjonen vil øke – i strid med mangeårig politikk om å dramatisk senke utvinningen av kull.
Noe av det første Trump gjorde som president, var å trekke USA ut av Parisavtalen – igjen.
– Vi vil raskt fremskynde tildelingen av lisenser for kullutvinning på føderal grunn. Vi skal forenkle tillatelsesprosessene, avslutte myndighetenes forutinntatthet mot kull, og vi skal ta i bruk de omfattende fullmaktene i forsvarsproduksjonsloven, lover Trump.
– Verdien av uutnyttet kull i landet vårt er hundre ganger større enn verdien av alt gullet i Fort Knox, og vi skal frigjøre dette potensialet og gjøre Amerika rikt og mektig igjen, sier Trump.
– I henhold til denne ordren gir jeg også energiminister Chris Wright beskjed om å bruke milliarder av føderale dollar til å investere i neste generasjon kullteknologi.
Vil redde kullkraftverk
Ifølge Det amerikanske energidepartementet (EIA) har kullproduksjonen i USA falt til under halvparten av toppnivået i 2008.
Kullkraftverk står nå for mindre enn 20 prosent av USAs elektrisitetsproduksjon, ned fra 50 prosent ved årtusenskiftet, skriver EIA.
Trumps nye presidentordrer vil blant annet forsøke å redde kullkraftverk som ellers ville blitt stengt, opplyser kilder til Reuters.
Miljøvernere raser
Miljøorganisasjoner er sterkt kritiske til Trumps nye kullsatsing.
– Kullkraftverk er gamle og skitne, ikke-konkurransedyktige og upålitelige, sier Kit Kennedy, direktør for kraftforsyning i Natural Resources Defense Council.
– Trump-administrasjonen sitter fast i fortiden og prøver å få strømkundene til å betale mer for gårsdagens energi. I stedet burde de gjøre alt de kan for å bygge fremtidens strømnett, sier Kennedy til Reuters.
Kull slipper ut mer av klimagassen karbondioksid enn noe annet fossilt brensel når det brennes. Det avgir også forurensning som er knyttet til lunge- og hjertesykdommer.
Aksjekurser skjøt i været
Aksjekursene til amerikanske kullprodusenter som Peabody og Core Natural Resources steg begge med rundt 9 prosent etter at nyheten ble kjent.
– Ordrene vil tydelig prioritere hvordan vi på en ansvarlig måte kan holde lyset på, anerkjenne den enorme strategiske verdien av amerikansk kullutvinning og omfavne de økonomiske mulighetene som kommer fra amerikansk energirikdom.
Det sier Rich Nolan, president og administrerende direktør i National Mining Association, til Reuters.
Trumps nye forsøk på å redde kullindustrien kommer i en tid der USAs strømbehov øker for første gang på to tiår. Energikrevende datasentre for kunstig intelligens, elbiler og kryptovalutaer øker forbruket.
Eksisterende kullkraftverk i USA leverer strøm til nettet bare rundt 40 prosent av tiden. Tilhengere mener dette tallet kan økes gjennom deregulering og andre tiltak.
Ordrene som Trump skal signere tirsdag vil også be energiminister Chris Wright om å vurdere om kull som brukes i stålproduksjon er et «kritisk mineral», opplyser en høytstående tjenestemann i Det hvite hus til Reuters.
I tillegg vil ordrene be innenriksminister Doug Burgum om å erkjenne slutten på et moratorium som stanset nye kullutvinningskontrakter på føderalt land, og prioritere slik utleie.
Ifølge EIA forventes USAs kullproduksjon å fortsette å falle fra anslåtte 512 millioner tonn i 2024 til 483 millioner tonn i 2025 og 467 millioner tonn i 2026, på grunn av fortsatt konkurranse med naturgass og fornybar energi i kraftsektoren.
Tidligere forsøk mislyktes
Dette er ikke første gang Trump forsøker å redde kullindustrien.
I sin første presidentperiode ba han daværende energiminister Rick Perry om å instruere det føderale FERC til å subsidiere kullkraftverk for deres bidrag til å gjøre strømnettet mer pålitelig og robust.
FERC avviste imidlertid planen i 2018, med begrunnelsen at slike subsidier kanskje ikke ville være rettferdige.
– Dokumentasjonen viser ikke at et slikt utfall ville være rettferdig og rimelig, skrev FERC i sin kjennelse.",Error generating text.,no
33_09_04_2025,Debatten om «frifødsel» har sporet av,Kaveh Rashidi,https://premium.vgc.no/v2/images/a0d35e43-2e04-43a9-b081-3afee40319a9?fit=crop&format=auto&h=852&w=1622&s=5d1aac1d3cd58e0aee673e4569d52cca7c1c3289,2025-04-08 06:58:31,https://www.aftenposten.no/meninger/debatt/i/3MOp8P/debatten-om-frifoedsel-har-sporet-av,Kultur og samfunn,"Vi må tilbake til kjernen: Hvordan hindrer vi at barn dør fordi foreldre velger å føde uten helsepersonell?
Jeg skrev i VG at planlagte uassisterte hjemmefødsler burde forbys. Dagen etter satt jeg på Dagsnytt 18 og måtte forsvare at sykehus er tryggere enn stuegulvet, og ble møtt med historier om voldtekt under fødsel på norske fødestuer.
Siden har podkaster, kronikker og utallige innlegg på sosiale medier handlet om denne ene kvinnens utsagn om overgrep. Typisk for vår tid: Enten man debatterer kvinnehelse, kjønn eller kosthold, ender vi fort i ytterpunktene, og fakta forsvinner i støy.
Overgrep er et viktig tema, men vi trenger ikke å debattere hvorvidt kvinner blir voldtatt av jordmødre i Norge.
Forbud og straff
Heldigvis har det vært mange gode tilsvar, som har ført til at jeg har endret mening. Jeg synes ikke lenger at forbud og straff er gode ideer.
I VG-kronikken lot jeg meg rive med av sterke følelser ved tanken på at uskyldige barn dør. Men jeg innser nå at et forbud antagelig ikke vil virke. Historien viser at sterke overbevisninger ikke lar seg kneble av lovtekst. Et forbud kan til og med gjøre skade. Derfor burde man starte med en utredning av hvorvidt nye lover kan føre til mer skade enn nytte.
I tillegg er frifødsler bare et symptom på den virkelige lidelsen: En voksende mistro til helsepersonells kunnskap og metoder.
Flere skriver at kvinner velger frifødsler fordi det offentlige fødetilbudet er for dårlig. Ida Aalen viser til forskning: Flertallet av disse kvinnene ville valgt å ha jordmor hjemme med seg, om det fantes et offentlig tilbud.
Ja, så burde vi kanskje ha et tilbud om hjemmejordmor til enkelte kvinner. Akkurat som vi gir planlagte keisersnitt til kvinner som trenger det.
Men uansett hvor mange jordmødre, fødeavdelinger og ressurser vi setter inn, er det et annet, voksende problem som må anerkjennes og bekjempes: en fremvekst av en kultur der subjektive følelser trumfer objektiv kunnskap. Der erfaringer fra Youtube og Instagram er viktigere enn studier fra forskere og fagfolk. Og i dette tilfellet: Der «det naturlige» forgudes, og helsepersonell fremstilles som fiender.
Avhengige av tillit
Vi kan ikke bare forbedre fødselsomsorgen, vi må også utfordre en virkelighetsforståelse som er på avveie hos enkelte.
I flere år har jordmødre og fødselsleger advart mot en økende trend der gravide kvinner motsetter seg nødvendige undersøkelser basert på råd fra sosiale medier. Vår plikt som helsepersonell er å gi tilpasset hjelp, med samtykke, og ivareta kvinners ønsker og behov. Men da er vi helt avhengige av tilliten til pasientene.
I motsetning til andre antivitenskapelige livsstilstrender kan frifødsel få dødelige konsekvenser
Å føde hjemme uten assistanse er for noen blitt et hellig ritual. Akkurat som mange andre helsetrender som vokser frem i alternative miljøer. I motsetning til andre antivitenskapelige livsstilstrender kan frifødsel få dødelige konsekvenser.
Ikke alle som velger frifødsel, gjør det for å markere avstand til systemet. For noen handler det om trygghet, kontroll – og ønsket om å eie fødselsopplevelsen. Men dette er ting jordmødre er opptatt av å tilby, også på sykehusene.
Jordmødre og leger ønsker å la fødsler gå så naturlig som mulig. Vi vet at overbehandling er farlig. Vi ønsker at fødselsopplevelsen skal være optimal. Men vi trenger at kvinnene tror på oss. Så lenge vi ikke spiller på lag, er det barna som betaler prisen.
Frifødsel er ikke bare et personlig valg
Noen hevder at frifødsel er et lite problem, og at vi heller bør fokusere på andre sider av fødsels- og barselhelse. Men vi må kunne kjempe for flere saker på én gang. Direktøren i Statens helsetilsyn, Sjur Lehmann, sier til NRK at «vi er kjent med tilfeller av uassistert hjemmefødsel hvor det har endt svært dårlig». Og kanskje enda mer alvorlig: «Vi har ingen oversikt over alle frifødsler.»
Fravær av statistikk betyr ikke fravær av et problem – men fravær av kontroll.
Andre skriver at et lovforbud som overstyrer kvinnens kroppslige autonomi, er uetisk. Jeg mener det er mer uetisk å utsette barn for livsfare.
Frihetsfrarøvelse for voksne, til fordel for barnets beste, finnes allerede i loven. For eksempel i Helsepersonellovens paragraf 10-3, som åpner for å tvangsinnlegge gravide med rusproblemer frem til fødsel. Det er forferdelig, men også nødvendig.
Fravær av statistikk betyr ikke fravær av et problem – men fravær av kontroll
Andre beskriver at uassisterte fødsler også skjer ved uhell, og at loven ikke skal straffe uskyldige.
«Det skjedde altså 290 uplanlagte fødsler utenfor sykehuset dette året», skriver Synnøve Vereide Trampe i sin kommentar i Aftenposten. Men det har aldri vært mitt forslag å lage en lov som treffer så bredt. Hvis loven rammer uskyldige, skal den selvsagt ikke innføres.
Kanskje finnes det en juridisk mellomløsning, for eksempel en meldeplikt for dem som fatter mistanke om planlagt frifødsel. Slik kan hjelpeapparatet gripe inn før fødselen og finne et kompromiss med dem som vurderer frifødsel.
Det optimale hadde vært om kunnskapen økte i befolkningen. Men vi lever i feilinformasjonens tidsalder, så det blir for enkelt å vente på at alle skal «bli smarte nok» til å stole på helsemyndighetenes kunnskap.
Forståelse for det uforståelige
Frifødsel rommer mange historier, håp og sårbarheter. Det er viktig å lytte til dem som er blitt traumatisert av sykehuset, har overdreven tro på egen fødekraft, eller opplever at fødeavdelingene ikke tilpasser fødslene etter deres behov.
Men disse årsakene er ikke tilstrekkelige til å velge frifødsel og frarøve barn livsnødvendig helsehjelp. Vi må møte kvinners ønsker med forståelse, men ikke berettige dem.
Et barns rett til liv må alltid veie tyngre enn en voksens rett til å føde på egne premisser
Jeg har ikke fasiten, men lovendringer kan være en del av løsningen. Når barns liv står på spill, er det ikke radikalt å vurdere lovverk – det er ansvarlig. Å avvise lovens potensial er like naivt som mitt opprinnelige forslag om forbud.
I et liberale samfunn skal vi ha mest mulig valgfrihet. Men frihet har grenser. Et barns rett til liv må alltid veie tyngre enn en voksens rett til å føde på egne premisser. Ingen løsning bør presses gjennom med makt, men ingen problemer løses ved å lukke øynene heller.",Error generating text.,no
22_09_04_2025,Matias Faldbakkens forslag blir nasjonalt minnested etter 22. juli-terroren,NTB-Kenneth Kandolf Haug,https://www.dagsavisen.no/resizer/v2/QDX7Z4AQ3D4NAOIHO5U6QINQIQ.jpg?smart=true&auth=bf66766eec550c6b24882b01b55084ebbac902ab1857b3fa527a13a8bf298b99&width=1200&height=630,2025-04-08 09:08:59,https://www.dagsavisen.no/nyheter/innenriks/2025/04/08/matias-faldbakkens-forslag-blir-nasjonalt-minnested-etter-22-juli-terroren,Politikk,"Det kunngjorde juryleder Marianne Borgen under et arrangement i Kunstnernes Hus i Oslo.
Faldbakken får nå ansvaret for å lage det nasjonale minnestedet i regjeringskvartalet. I «En opprettholdelse» skal han gjenoppføre den store flytterammen i stål som ble bygget for å skjære ned og flytte Picasso-verket «Fiskerne» fra den revne Y-blokka over til den nye A-blokka.
– Matias Faldbakkens vinnerforslag beskrives som en torgskulptur, som blir stående på bygulvet som et monument. Skulpturen skal bli et samlingspunkt for besøkende og danne et nytt byrom, en stor og åpen plass med rom for seremonier og minnehandlinger, skriver KORO i en
pressemelding
.
Minnested etter 22. juli
I Matias Faldbakkens forslag «En opprettholdelse» fylles flytterammen til Pablo Picasso-verket «Fiskerne» med en monumental mosaikk i stein. Motivet i mosaikken er hentet fra Utøya og Tyrifjorden, en tegning av en liten vadefugl og noen strå og kvister som speiler seg i vannet. Det skal være et kunstverk til de omkomne. Bildet er en grafisk illustrasjon.
(Stefan Faldbakken / KORO/ Handout / Handout/NTB)
Les også: Peggy Hessen Følsvik:
– Sykelønna er politikk
(+)
Tre finalister
I Faldbakkens versjon fylles flytterammen med mosaikk i stein, der motivet er hentet fra Utøya og Tyrifjorden. Dermed fungerer de to elementene som en bro mellom regjeringskvartalet og Utøya.
Faldbakkens verk «En opprettholdelse» var en av tre finalister i konkurransen. De to andre var verket «En minnelund for 22. juli» av Henning Sunde, Hanne Tyrmi og Rainer Stange, samt et forslag fra Raqs Media Collective.
KORO skal nå sammen med kunstneren utvikle forprosjektet, detaljplanlegge og forberede etableringen av minnestedet på Johan Nygaardsvolds plass i samarbeid med Statsbygg. Minnestedet skal etter planen stå ferdig i 2026, skriver Digitaliserings- og forvaltningsdepartementet i en
pressemelding
.
Les også:
– Nå må vi diskutere om vi bør ha norske atomvåpen
– Verdig vinner
– «En opprettholdelse» er et sterkt og modig svar på 22. juli og gir en fysisk manifestasjon av demokratiets sårbarhet og styrke. Riggen og mosaikken gir til sammen sterke referanser til de to terroråstedene: regjeringskvartalet og Utøya, sier Borgen.
– Jeg er glad for at juryen i dag har utpekt en verdig vinner til å utforme det nasjonale minnestedet etter 22. juli i regjeringskvartalet. Minnestedet blir et sted for å minnes de som ble drept i terrorangrepet, den lidelsen som ble påført de etterlatte, de overlevende og alle som ble berørt. Det blir et viktig symbol på at demokratiet vårt besto selv den mest alvorlige trusselen, sier digitaliserings- og forvaltningsminister Karianne Tung (Ap).
Les også:
Massiv norsk motstand mot Trumps politikk: – Skaper usikkerhet",Error generating text.,yes
27_09_04_2025,Solkremene våre er trygge,Pål Kristian Selbo,https://premium.vgc.no/v2/images/21740f3b-c0fc-4e4e-86b6-0d7bcf9c1bfb?fit=crop&format=auto&h=1080&w=1920&s=8b8ace02acf781e1029bb663978436b879c08ef9,2025-04-08 20:00:00,https://www.aftenposten.no/meninger/debatt/i/wgQr3P/solkremene-vaare-er-trygge,Helse og forskning,"Her er fem råd om sol som er basert på forskning.
Jeg setter pris på at spalten til fastlege Kaveh Rashidi i A-magasinet gir gode råd om å nyte solen med omtanke og anbefaler å unngå solarium. Samtidig opplever jeg at noen av utsagnene kan forvirre.
Rashidi antyder at solkrem kan være mer skadelig enn selve solstrålene. Dette er feil. I EU og Norge er kjemikaliene i solkrem strengt regulert, og solkremene vi får kjøpt i Norge, er grundig helserisikovurdert av Vitenskapskomiteen for mat og miljø (VKM).
Unnlater å nevne forskning
Stoffene som utgjør en mistenkt hormonforstyrrende effekt brukes enten i svært små mengder (langt under grenseverdiene) eller er forbudt. Solkremene våre er trygge for vår helse. Rashidi antyder også at solkrem reduserer kroppens produksjon av D-vitamin. Denne påstanden kommer nok fra eksperimentelle forsøk utført i laboratoriet, som har vist at solkrem blokkerer UV-stråler.
Flere observasjonsstudier på solkrembruk i virkelige situasjoner viser at kroppen er i stand til å produsere tilstrekkelige mengder D-vitamin, selv ved bruk av solfaktor 15 og høyere. Grunnen til dette er at noe UV-stråler kommer gjennom solkremlaget fordi vi ikke alltid greier å smøre tykt og jevnt nok.
Selv om Rashidi advarer mot bruk av solarium, peker han på en observasjonsstudie som antyder at bruk av solarium kan være helsefremmende. Til tross for at Rashidi er kritisk til dette studiet, unnlater han å nevne forskning som viser det motsatte. Innen medisinsk forskning er det viktig å se på samlet evidens.
Øker risikoen for hudkreft
Som Rashidi påpeker, kan slike studier ha alternative forklaringer til konklusjonen som det ikke er tatt hensyn til. Verdens helseorganisasjon (WHO), Kreftforeningen, nasjonale og internasjonale hudlegeforeninger advarer klart mot bruk av solarium, fordi den samlede forskningen viser en tydelig sammenheng mellom solariebruk og økt hudkreftrisiko.
Norge ligger i verdenstoppen i forekomst og dødelighet på grunn av melanom (føflekkreft), som er den farligste hudkreftformen forårsaket av UV-stråling. Kvinner fra Hongkong, Japan og Sør-Korea lever lengst av alle i verden, og er et klart bevis på at solarier ikke er nødvendige for å fremme bedre helse og et langt liv. Kanskje fordi de vet at UV-stråling fremskynder hudens aldringsprosess?
Fem solråd basert på forskning
Det er bred vitenskapelig enighet om at UV-stråling fra solarium øker risikoen for hudkreft. WHO har klassifisert solarium som «karsinogen i gruppe 1», altså på samme nivå som tobakk og asbest. På tross av dette får solariebransjen lov til å drive markedsføring.
Jeg støtter Kreftforeningen, som jobber for å forby solarier, og som har disse fem utmerkede solrådene som er fundamentert på forskning:",Error generating text.,no
