aid,title,author,image_url,published_date,article_url,category,raw_text,text,is_manipulated
32_07_04_2025,Stor Syden-pågang: –⁠ Fortsatt dyrt å være nordmann,Jan Gustav Andreaasen,https://akamai.vgc.no/v2/images/3be8f780-55e5-449f-8286-d7a23f6aecae?format=auto&w=1080&s=55ecea61f98c285b044c5a80ab9ff90426eb8574,2025-04-07 03:21:41,https://www.vg.no/nyheter/i/yEM4Vx/syden-i-paasken-her-er-de-beste-reisetipsene,"Travel, Economics, Finance","Droppe fjellet i påsken? Du er i så fall ikke alene skal vi tro charterselskapene, som melder om fulle «påskefly».
For 13 minutter siden
Snart er det tid for å nyte sola – enten det er i hytteveggen eller under en parasoll.
Og mens vi venter på rentekutt, lønnsoppgjør og hvetemel til under 30 kroner kiloen, kan det jo kanskje være fristende med en liten utenlandstur.
VG har snakket med reisebyråer og en valutaekspert, og samlet deres heteste tips for deg som drømmer om litt ekte sydensol.
Selv om de klassiske charterflyene er i ferd med å fylles opp, er det fortsatt håp for dem som lengter etter sand mellom tærne.
Granca, Granca, Granca!
Gran Canaria troner på toppen som det desidert mest populære reisemålet, tett fulgt av Tenerife og Lanzarote.
Men ifølge Apollo har den greske øya Kreta for første gang kapret annenplassen foran de spanske «konkurrentene» Tenerife og Fuerteventura.
Beatriz Rivera i Apollo forteller at alle deres tradisjonelle charterreiser er utsolgt. Men med rutefly kan du fortsatt sikre deg en plass under parasollen.
I stedet for de klassiske Syden-favorittene trekker hun frem et mer uventet tips – nemlig Tunisia i Nord-Afrika.
– Det er et rimelig strandparadis med massevis av historie, deilig mat og kulturelle severdigheter – og sjansen er stor for at naboen ikke har vært der ennå, sier Rivera.
Hvilket reisemål frister mest i påskeferien?
aSyden!bStorby, shopping og kafé!cPåsken skal selvfølgelig tilbringes på fjellet.dIngen! Jeg vil heller være hjemme.
Eksotiske alternativer
Selv om Kanariøyene fortsatt troner på toppen av salgslistene, er bildet annerledes når man ser på hvilke destinasjoner som øker mest i popularitet.
– Thailand er ekstremt populært i år. Vi har solgt over ti ganger flere reiser dit sammenlignet med fjorårets påske, sier Anne Mørk-Løwengreen i TUI.
Hun tror økningen blant annet kan skyldes den nye sesongen av TV-serien «The White Lotus», som er spilt inn i nettopp Thailand.
Men det handler ikke bare om TV-glam og tropisk vibe. Økonomien spiller også en stor rolle når nordmenn velger reisemål, ifølge Mørk-Løwengreen.
– Nordmenn får mye mer igjen for hver krone i Thailand, med gunstig valuta og et mye lavere prisnivå enn på Kanariøyene. Flyturen koster noe mer, men mat, drikke, shopping, opplevelser og aktiviteter koster mye mindre.
Hva koster det?
VG har gjort en uformell sjekk av hva du kan få for pengene i påsken, for en familie med to voksne og to små, med fly og hotell inkludert.
Drømmer du om greske strender og blått hav? En uke i Kato Salos på Kreta koster fra 16.300 kroner.
Dersom du vil føle deg som kongen av Mallorca, kan du reise til Puerto Pollensa. En ukes ferie for en familie på fire starter på 22.500 kroner.
Føles én uke i solen litt snaut? Da kan du strekke påskeferien til ni deilige dager i Alanya. Her starter prisene på rundt 24.000 kroner.
Men hva sier økonomen?
Jan Ludvig Andreassen er sjeføkonom i Eika Gruppen, der han har hovedansvar for overvåkning av makroøkonomi i inn- og utland.
Å gi råd til reiselystne nordmenn nå er vanskelig, og selv med sine 35 fartsår innen finans sier han at rådene om valuta må tas med et haaaav av salt «i disse tider».
Årsaken? Den ustabile internasjonale situasjonen.
– Torsdag og fredag forrige uke falt den norske kronen med femti øre mot dollar og euro. Det har nesten aldri skjedd før, og handler om markedsuroen og tollsatsene til USA, forklarer Andreassen.
Likevel prøver han seg på noen lure «reisehacks»:
Ettersom dollaren er ned litt ned i år, og noen av ulike grunner har avbestilt eller utsatt planlagte USA-turer, kan det hende man får gode tilbud på reiser til for eksempel New York. Det vil hvert fall være billigere i år enn i påsken i fjor, forteller han.
Han påpeker også at siden påsken i år er sen, vil det være varme temperaturer i europeiske land og storbyer. Her vil euroen fremdeles være nokså høy, men ikke noe verre enn det den var i fjor.
For de europeiske reisemålene har han ett hett tips:
– Alltid gang med tolv når det gjelder euro, så unngår du å gå på en smell.
Når det gjelder dollar bør man gange med elleve.
– Så fortsatt dyrt å være nordmann i utlandet?
– Ja. Selv om dollaren er svakere er det fortsatt dyrt.
NOK PR. 1 EUR. Dagskurs: 4. april 2025 Foto: Skjermdump, Norges bank
På spørsmål om når det blir billigere å være nordmann i utlandet, og når den norske krona skal oppover, sier Andreassen at den internasjonale situasjonen må roe seg først.
Men så:
– Jeg har tidligere spådd dollaren til ni kroner. Dét har også den amerikanske investerings- og finansinstutsjonen Goldman Sachs gjort nå, sier han fornøyd.
Resonnementet er at verden går inn i en lavkonjuktur, mens det går bra i Norge. Dette kan gi oss en sterkere krone fordi vi har sterkere renter enn i utlandet, og fordi vi trekker sparepengene våre hjem når det er uro ute i verden.
Med andre ord: USA går dårlig mens Norge går bra, noe som kan føre til 10–15 prosent styrking av kronen.
Når dette vil skje, syns han er vanskelig å spå. Men at påsken 2026 vil være bedre for de reiselystne, er han ganske sikker på.
– Men det er enorme bevegelser i markedet, så alt kan skje!
Selv skal han være hjemme og pusse opp i påsken.",Error generating text.,no
24_07_04_2025,Kan Kina dra nytte av Trumps nye tollar i Afrika?,Vegard Tjørhom,https://gfx.nrk.no/8LSrO8fQCP-Jfm1zzauwRQpPJ81vy8AUOA1qfiQziRuw.jpg,2025-04-06 11:54:24,https://www.nrk.no/urix/kan-kina-dra-nytte-av-trumps-nye-tollar-i-afrika_-1.17371464,"Politics, Economics, Business","Kvinnene bak symaskinane jobbar så raskt dei kan i eit fabrikklokale utanfor Maseru, hovudstaden i Lesotho.
Investorar frå Taiwan har laga fabrikken der det vert produsert for verdskjente merke som Levi's og Calvin Klein. Og eksporten til USA er stor i det vesle landet som har omfamna Agoa «The African Growth and Opportunity Act».
Agoa er avtalen som skulle få USA tilbake i den afrikanske manesjen etter at Kina i årevis har fått betre og betre fotfeste i Afrika.
Avtalen opnar for tollfri eksport til USA, og har eksistert sidan 2000. Seinast i fjor forlenga Joe Biden avtalen, og lova nye store investeringar.
I bytte får USA betre tilgang til afrikanske marknadar, og råstoff og mineral som amerikanske bedrifter treng for å vinne handelskampen – mellom anna mot Kina.
No står heile Agoa i fare, etter at Trump den siste veka innførte toll mot 20 afrikanske land.
Fleire afrikanske land har i ei rekke år hatt null-toll til USA. Nå innfører Donald Trump skyhøge tollsatsar.
Enorm toll for vesle Lesotho
Og Lesotho kom verst ut av det. For dei har vore gode på å få til eksport til USA.
Dei siste åra har tekstilproduksjonen vakse, og det vesle landet med rundt 2 millionar innbyggjarar eksporterte klede for 2,5 milliardar kroner i 2024. Eksporten til USA utgjer heile 10 prosent av det vesle landets brutto nasjonalprodukt.
Når det gjeld import er Lesotho veldig avhengig av Sør-Afrika, som omringar Lesotho på alle kantar. Dei fleste varer kjem inn via Sør-Afrika, og få amerikanske varer blir importert direkte til Lesotho.
Fleirtalet av de som har jobb i Lesotho jobbar i klesindustrien. Nå fryktar de for Trump sine høge tollsatsar Foto: AFP
Dermed slår Trump-administrasjonens reknemåte veldig dårleg ut for Lesotho.
Trumps tal viser at Lesotho påfører USA 99 prosent toll. Men det heile handlar eigentleg om måten Trump reknar på.
For Lesotho har på papiret langt større eksport til USA, enn import frå USA. Med andre ord er det handelsbalansen mellom landa som Trump synest er problematisk, og ikkje Lesothos tollsatsar. Trump svarar med å innføre 50 prosent toll på alle varer frå Lesotho.
Les også Trump hevdet tollen var et motsvar: – Ingen voksne mennesker mener dette henger på greip
– Me såg aldri dette komme, seier Ricky Chang til Reuters.
Han er direktør ved Nien Hsing, det taiwanske selskapet som står bak ein av fabrikkane som skapar arbeidsplassar i Lesotho.
Det vesle landet førebur no ein delegasjon for å reise til USA og forhandle.
– Eg har fått ei forståing av at president Trump er ein forhandlar, seier handelsminister i Lesotho Mokheti Shelile til Reuters, han kallar den nye tollen «sjokkerande».
Handelskrigen med Kina
Trump har tidlegare antyda at han ønsker handelskrig med Kina.
Stadig mindre tyder på at han i så fall ønsker å vinne den kampen på afrikansk jord, slik hans forgjengarar var mest opptekne av.
Dei har forsøkt å ta ein større del av kaka i Afrika, og dermed få tilgang på råvarer som USA treng for å utvikle eigen økonomi. Difor såg Agoa dagens lys under Bill Clinton i 2000.
Å fjerne handelsbarrierar og tollmurar har blitt sett på som eit tiltak for å stimulere til meir handel med utviklingsland. Noreg er blant landa som har tollfritak for fleire av dei minst utvikla landa i verda.
Trump sender ut heilt motsett signal når han no aukar tollen til tjue afrikanske land.
Donald Trump presenterte sine nye tollsatsar denne veka. Det vil ramme afrikansk næringsliv hardt. Foto: Reuters
Sjølve tollsatsane vil ramme dei tjue landa ulikt. For nokre av landa har lite handel med USA, og handlar meir med andre afrikanske land, men også Europa og Asia.
Men for enkeltbedrifter som har produsert varer for den amerikanske marknaden er den nye tollen krise, og dei langsiktige og indirekte konsekvensane er også ein trugsel for afrikanske økonomiar.
Fleire land i Afrika har mykje utanlandsgjeld, og stor arbeidsløyse. Ein nedkjølt verdsøkonomi og høgare inflasjon, vil difor skape vanskar i fleire land.
Den nye tollen kjem berre på toppen av alle dei massive kutta i bistand frå USA. Dette har ramma spesielt mange av Afrikas fattigaste, mens tollane vil ramme arbeidarklassen og bedriftseigarane hardast.
Les også Veronica fortviler over Afrikas store gjeldsproblem
Kan Kina utnytte situasjonen?
Signalet som Trump sender til Afrika er vanskeleg å tolke som positivt slik det ser ut no.
Difor er det langt meir attraktivt for afrikanarane å vende seg mot meir stabile handelspartnarar som EU, Kina og Russland.
Dette er altså det motsette av det USA har forsøkt å få til gjennom dei 25 åra Agoa har eksistert. Og sannsynlegvis også det motsette av kva fleire amerikanske bedrifter faktisk ønsker.
For dei må framleis ha råvarer og mineral som ikkje finst i USA, men i Afrika – og som no blir langt dyrare å importere til USA.
Les også Trump river ned det internasjonale handelssystemet
Kanskje vil fleire amerikanske bedriftsleiarar som treng å importere frå Afrika få sagt frå tydeleg nok, slik at justeringar og endringar skjer når Trumps administrasjon etterkvart får meir oversikt over kva utslag dei nye tollsatsane får.
I Afrika kan konsekvensane av Donald Trump sine nye tollsatsar bli at Kina får meir kontroll. Foto: Reuters
I mellomtida kan Kina stramme eit ytterlegare stramt grep om afrikansk næringsliv.
– Realiteten er at desse nye tollsatsane i hovudsak gjev det meste av Asia og Afrika til Kina, og USA er ikkje førebudde, seier Cameron Johnson til CNBC.
Han jobbar for konsulentfirmaet Tidalwave Solutions i Shanghai i Kina.
Handelen mellom Afrika og Kina vart i fjor rekna til å vere 3.136 milliardar kroner i fjor. Det er langt meir enn handelen mellom Afrika og USA, som vart målt til 862 milliardar kroner.
Dette er tal frå tenkjetanken Carnegie. Og dei legg til at det er venta endå meir handel med Kina, fordi det er berre fem månader sidan Kina opna for tollfri eksport frå verdas minst utvikla land – slik Noreg har gjort.
Altså, det stikk motsette grepet enn det USA har teke.
Akkurat no står Kina fram som ein langt meir stabil handelspartnar for afrikanske land. Ein partnar dei kjenner godt til, og som det er enklare å forholde seg til.
Fleire meiner også at Kina kan forbetre omdømmet sitt i Afrika endå meir ved å ta over meir av den mjuke makta som USAID stod for.
Kuttene i USAID får katastrofale konsekvenser. Kan det også slå tilbake på amerikanere?
Du trenger javascript for å se video.
Kuttene i USAID får katastrofale konsekvenser. Kan det også slå tilbake på amerikanere?
Satsinga som står for fall
Agoa har fram til i fjor haust blitt omtalt positivt frå USA, og fekk ein ny boost då Joe Biden kom med ein ny stor investeringspakke til Afrika.
Kronjuvelen i USAs Afrika-prosjekt har dei siste åra vore planlegginga av ei jernbanelinje frå dei mineralrike områda i grenseområda mellom Zambia, DR Kongo og Angola. Jernbanen skal etter planen frakte afrikanske mineral ned mot Atlanterhavskysten, i retning av USA og ikkje Kina.
Tanken er at USA treng å trappe opp innsatsen i kampen om afrikanske mineral, som både USA og Kina treng til sitt eige næringsliv.
Sjeldne mineral har også Trump vist interesse for, mellom anna ved å forsøke å få i land ein mineralavtale med Ukraina. Men no er mineralrike land som Angola, DR Kongo og Zambia blant landa som er omfatta av dei nye tollsatsane.
Høgare toll er neppe til hjelp for dei amerikanske diplomatane som skal forsøke å inngå nye handelsavtaler. Slik som faren til Trumps svigerson, og USAs ferske Afrika-utsending, Massad Boulos som forsøker å lande ein mineralavtale med DR Kongo akkurat no.
Den sørafrikanske økonomen Dawie Roodt er ein av dei som meiner «Agoa er død». Til den sørafrikanske avisa The Citizen seier han at det er lite som tyder på at avtalen vil bli fornya i september, slik planen eigentleg var.
Sør-Afrika i djup trøbbel
Og også regjeringa i Sør-Afrika er negative. Dei seier ifølgje Reuters at dei nye tollsatsane nullar ut fordelane som afrikanske land får frå Agoa.
– Dei omfattande tolltiltaka vil påverke fleire sektorar av økonomien vår, inkludert bilindustri, landbruk, mat og drikke, kjemikaliar, metall og andre segment av produksjonen., og dette vil ha følger for arbeidsplassar og vekst, seier Sør-Afrikas utanriks- og finansminister i ei felles utsegn.
For Sør-Afrika – Afrikas nest største økonomi – er dei nye tollsatsane berre toppen av eit stadig meir skummelt isfjell. For landet er i djup økonomisk trøbbel.
Mange skaper sine eigne uformelle jobbar i Sør-Afrika, der arbeidsløysa er stor. Her frå ein frisørsalong i Daveyton. Foto: AFP
Ifølge Renaissance Capital Africa står Sør-Afrika for 37 prosent av all eksport frå Afrika til USA, og er dermed det landet i Afrika med mest eksport til USA. Det gjeld alt frå bildelar til vin.
Dei omfattande USAID-kutta rammer mange, landets ferske og første fleirpartiregjering slit med å bli einige om eit budsjett, og utanlandsgjelda er enorm.
På toppen av alt kjem den store arbeidsløysa på over 40 prosent, og denne kan bli forverra i Sør-Afrika ved at eksport til USA blir dyrare.
Så ringverknadane av tollsatsane kan bli store i Afrika. På kort sikt må enkeltbedrifter og deira tilsette betale prisen for høgare tollar.
Men kanskje endå meir urovekkande er dei langsiktige konsekvensane for verdsøkonomien, og korleis dette vil slå ut på Afrikas svakaste økonomiar – der verktøykassa ofte er for liten når økonomiske tiltak trengst som mest.",Error generating text.,no
