aid,title,author,image_url,published_date,article_url,category,raw_text,text,is_manipulated
12_09_04_2025,Milliardær Bill Ackman mener seg misforstått: – Jeg støtter Trumps bruk av toll,Janne Johannessen,https://images.dngroup.com/image/eyJ3IjoxMjAwLCJmIjoid2VicCIsImsiOiI2NjQ2YjllODg1YTAzNjI4ZThmOWNlOTAwODA4NmIwMiIsImNyb3AiOlswLDAsMjQwMCwxMjAwXSwiciI6MiwibyI6ImRuIn0,2025-04-08 14:20:23,https://www.dn.no/marked/handelskrig/bill-ackman/donald-trump/milliardar-bill-ackman-mener-seg-misforstatt-jeg-stotter-trumps-bruk-av-toll/2-1-1804540,"Business, Politics, Economics","D2, DN Helg og alt digitalt
DN 6 måneder til 60 % rabatt
Bestill nå
Milliardærene Bill Ackman og Elon Musk går verbalt i strupen på to av Trumps nærmeste handelsrådgivere. Nå har Ackman lagt seg langflat.
Hedgefondmilliardæren Bill Ackman er en av mange Wall Street-profiler som i løpet av de siste dagene har gått ut mot Donald Trumps såkalte gjengjeldelsestollsatser, som ble presentert onsdag forrige uke.
I et innlegg på X skrev Ackman søndag at «USA er på vei mot en selvpåført, økonomisk nedsmelting» og at det vil være en feil å iverksette tollbarrierene Trump presenterte på tavlen i Det hvite hus på den såkalte frigjøringsdagen.
Nå rykker han ut med ny melding hvor han justerer budskapet.
– Misforstått
Ackman har vært svært aktiv på X de siste dagene der han har skrevet en rekke innlegg selv, men også repostet flere saker om Trumps nye handelsregime. I «ur-innlegget» fra søndag skriver Ackman at Trump mister tilliten til bedriftsledere verden over, og at dette ikke er hva «vi stemte for».
Tirsdag rykker mangemilliardæren ut i en ny melding, åpenbart med et behov om å rette opp inntrykket fra de siste dagene.
– Noen har misforstått mine tanker om tollsatser. Jeg støtter fullstendig Trumps bruk av toll for å eliminere toll og urettferdig handelspraksis blant våre handelspartnere, innleder han innlegget.
Milliardæren, som har vært en av Trumps støttespillere, tar til orde for en pause på 30, 60 eller 90 dager før satsene trer i kraft.
– På den måten kan man ha forhandlinger uten store, globale forstyrrelser i økonomien. Hvis et land ikke forhandler i «good faith», så kan Trump ta frem det tunge skytset. Men å implementere satsene uten å gi tid vil føre til unødvendig skade, fortsetter investoren.
– Dummere enn en sekk murstein
I et innlegg m andag gikk Ackman ut mot Trumps handelsminister Howard Lutnick hvor han beskyldte ham for å ha en interessekonflikt og hevdet hans finansselskap Cantor tjener penger når økonomien kollapser fordi de er investert i obligasjoner.
Dette gikk han også helt tilbake på – samme dag.
– Det var ikke riktig av meg å gå til angrep på Howard Lutnick. Jeg tror ikke han går etter egne interesser. Jeg er sikker på at han gjør sitt beste for landet mens han representerer presidenten som handelsminister. Det er ikke en lett jobb og vi vet ikke hvordan pølsene ble laget, skriver han på X.
Ackman er ikke den eneste som gyver løs på Trumps nærmeste. Tesla-milliardær og Trump-rådgiver Elon Musk bruker tirsdag adjektivskalaen når han beskriver handelsrådgiver Peter Navarro. På sin egen plattform X skriver han at Navarro «virkelig er en idiot», og fortsetter:
– Tesla har de mest amerikanskbygde bilene. Navarro er dummere enn en sekk murstein.
Uttalelsene er et svar på en video av Navarro hvor han kaller Musk for en «bilperson» og sier Tesla-sjefen vil ha billige deler fra utlandet.
De to har vært i en åpen ordkrig de siste dagene. Selv om Musk har støttet opp om Trumps økonomiske politikk sa han i helgen at det ville være å foretrekke en frihandelssone bestående av Europa og Nord-Amerika.
– En stor feiltagelse
Hedgefondtopp Ackman var også blant de mange som påpekte at Trump-administrasjonens grunnlag for tollsatsene som ble presentert i forrige uke i beste fall var spekulative, og fikk det til å se ut som at flere lands tollsatser på amerikanske varer er langt høyere enn hva som faktisk er tilfellet.
I tillegg til Ackman har også JP Morgan-sjef Jamie Dimon gått ut mot tollsatsene og skrev i sitt årlige brev til aksjonærene at en rask løsning vil være det beste for alle.
Det er utvilsomt toll som preger markedene og nyhetsbildet om dagen.
Tirsdag sier USAs finansminister Scott Bessent til CNBC at USA har en betydelig fordel av Kina.
– Jeg mener denne kinesiske eskaleringen var en stor feiltagelse siden de spiller med et par toere. Hva taper vi ved at Kina øker tollen på oss? Vi eksporterer en femtedel av det de eksporterer til oss, så det er en tapende hånd for dem, sier han til kanalen.
Forrige uke svarte Kina med samme mynt da landet innførte 34 prosent toll på amerikanske varer på toppen av allerede eksisterende tollsatser. Trump svarte denne uken med å true med 50 prosent tilleggstoll på kinesiske varer. Det vil også komme på toppen av alle andre satser, slik at fullstendige satsen på kinesisk import ville havnet på over 100 prosent.",Error generating text.,no
