aid,title,author,image_url,published_date,article_url,category,raw_text,text,is_manipulated
1_19_03_2025,Kunsthistoriker: Bør boikotte handelsparker,Christine Ringdahl Karlsen,https://gfx.nrk.no/UGNI8LafXXATfqBegqJyNw9fJ7yYfimO76rghWMnauKQ.jpg,2025-03-19 06:15:42,https://www.nrk.no/vestfoldogtelemark/kunsthistoriker_-bor-boikotte-handelsparker-1.17343713,"Politics, Lifestyle","– En ødslig ørken, en svær parkeringsplass, bokser som kunne vært i Shanghai eller Bulgaria.
Slik beskriver kunsthistoriker Tommy Sørbø handelsparken på Langrønningen i Bamble.
Han mener områdene gjør oss ulykkelige og stressa, men også at de ødelegger sentrumslivet og miljøet.
Det ble stor diskusjon da kunsthistoriker Tommy Sørbø og tidligere Bamble-ordfører Hallgeir Kjelldal møttes utenfor handelsparken. Foto: Fredrik Pedersen / NRK
Derfor stiller han til debatt i ettermiddagssendinga på P1 med den tidligere ordføreren i Bamble, Hallgeir Kjelldal.
Kjelldal er nemlig ikke enig med Sørbø. Han er tvert imot glad for at kommunen har fått en slik handelspark langs E18.
Miljøfokus
Det var Kjelldal som i sin tid sa ja til planene i dette området. Det angrer han fremdeles ikke på.
– Jeg blir ikke ulykkelig av å være her. På takene er det solcellepaneler og det er et miljøfokus på parken, sier Kjelldal.
Tidligere Bamble-ordfører Hallgeir Kjelldal mener handelsparkene er fornuftige med tanke på å få mest mulig kvadratmeter til lavest mulig pris. Foto: Roald Marker / NRK
Han er enig i at byggene kunne sett annerledes ut, men det ville gått utover funksjonalitet og mest mulig kvadratmeter for lavest mulig pris, mener han.
– Det er en del av problematikken som vi politikere må forholde oss til. Det vi gjør i reguleringsplaner er å blant annet sørge for utnyttelse av tomta.
Han mener det er vanskelig for lokalpolitikerne å gjøre noe med estetikken.
Er du for eller imot handelsparker?
Helt klart for👍 Jeg liker at det er stor plass rundt meg. Imot👎 De dreper bylivet. Samme for meg 🙄 Vis resultat
– Byliv er demokrati
Det er ikke bare utseendet på handelsparkene som er problemet for kunsthistoriker Sørbø. Han mener slike parker også er et demokratisk problem.
– Jeg tenker at byliv også handler om demokrati, samtaler og diskusjoner. Dette ødelegger alt det vi forstår med by og byliv, og sånn sett et demokratisk problem.
I sentrum av Skien er det stille. For stille, mener kunsthistorikeren. Foto: Fredrik Pedersen / NRK
Noen av butikkene i de store parkene burde heller vært i ledige lokaler i sentrum, mener han.
– Jeg skjønner at det er billigere å handle her og større kvantum, men da oppfordrer jeg folk å tenke litt til miljø, vekst og mengder.
Sørbø mener folk bør redusere forbruket for å redde naturen og fremtiden.
Oppfordrer til engasjement
– Man har boikotta Tesla ut fra et moralsk synspunkt, så hvorfor ikke boikotte dette?
Den tidligere ordføreren liker dårlig oppfordringen til boikott. Det er etablert et møtested på en av butikkene i handelsparken, påpeker han.
– Det er noe av det Sørbø kanskje kunne ønske å ha i byene, i flere byer er det en utfordring med få folk, sier Kjelldal.
Slik ser det ut i handelsparken på Langrønningen i Bamble. Foto: Fredrik Pedersen / NRK
Dersom noe skal gjøres annerledes med fremtidige handelsparker må folk begynne å engasjere seg, mener Kjelldal.
– Hvis man ønsker å engasjere seg i tilbudene i en kommune, så engasjer dere i det som har med reguleringsplaner å gjøre, for det er viktig.
Sørbø på sin side mener politikerne har et særlig ansvar i forbindelse med slike etableringer.
– Politikk handler om å styre på vegne av fremtiden.
Han oppfordrer derfor politikerne til å tenke på om vi har behov for slike områder.
– Hva med barnebarna når det ser sånn ut og vi ødelegger natur? Det er et stort ansvar, og der svikter politikerne.",Error generating text.,no
26_19_03_2025,Forsker på behandling av ungdom før de får psykopatiske trekk,NTB-Mette Estep,https://www.dagsavisen.no/resizer/v2/Y42K46AU5MF5HIGSJKMJ3MTKOA.jpg?smart=true&auth=f49f851c78bb43b53a4713c6101ce3414e54b41cc2cb5fea315e016dd8e02463&width=1200&height=630,2025-03-18 17:30:19,https://www.dagsavisen.no/nyheter/innenriks/2025/03/18/forsker-pa-behandling-av-ungdom-for-de-far-psykopatiske-trekk,Samfunn og arbeidsliv,"Ved Universitetet i Oslo er forsker Pamela Waaler i gang med doktorgrad på ungdom med kalde og ufølsomme trekk. Dette er trekk ved en litt ukjent diagnose hos barn og unge, navngitt først på 1990-tallet: Conduct disorder (CD) with callous-unemotional trait (CU).
Diagnosen anses å være et forstadium til psykopatiske trekk. Kjennetegn kan være mangel på anger og skyldfølelse, redusert empati, likegyldighet til å prestere i skole og arbeidsliv og svake eller overfladiske følelser.
– Skal vi forebygge kriminalitet og hjelpe ungdom med alvorlig atferdsproblematikk til et bedre liv, må vi tilby behandling som virker, sier Waaler ved Institutt for spesialpedagogikk
i en presentasjon av arbeidet
.
Professor Gunnar Bjørnebekk er hovedveileder på prosjektet. Han har bred erfaring på området.
– Til tross for intensive tiltak i ungdomsalderen ser det ut til å være vanskeligere å endre denne typen trekk, sammenlignet med når tiltakene settes inn hos yngre barn, sier han til NTB.
Store samfunnskostnader
Ungdommer med kalde og ufølsomme trekk har ofte alvorlig atferdsproblematikk. De kan se det som akseptabelt å bruke vold for å oppnå sine mål. De kan også være spenningssøkende av natur, presse grenser og bry seg mindre om negative konsekvenser. Trusler om straff ser for eksempel ikke ut til å ha noen særlig effekt.
Det er mye å tjene på å finne behandling slik at disse unge ikke utvikler mer alvorlig og vedvarende antisosialitet. Opptil 75 prosent av den alvorlige voldskriminaliteten i et samfunn begås av individer med en kombinasjon av begrensede prososiale emosjoner og alvorlig atferdsforstyrrelse.
Personer involvert i alvorlig voldskriminalitet koster samfunnet rundt 100 millioner kroner per person, ifølge forskerne.
– Så hvis du finner en behandling som får effekt hos én av disse på et tidlig stadium, kan det alene spare samfunnet for mye, sier Bjørnebekk.
Første i sitt slag
Dette er trolig den første studien av sitt slag. Hittil har stipendiat Waaler gjennomgått flere tusen forskningsartikler om hva slags behandling som tilbys disse ungdommene nå. Åtte artikler er valgt ut basert på at de oppfylte forhåndsatte vitenskapelige kriterier.
Et kriterium er at de ser på endring av diagnosen. Det er studier på over tusen deltakere, gjennomført i USA, England, Nederland, Italia og Norge.
Blant elementene som brukes i behandling, er positiv forsterkning, motivasjon, å forbedre familierelasjoner og å ta utgangspunkt i ungdommens perspektiv. Det er uklart hvor stor effekt behandlingene faktisk har.
Har gjort flere funn
Så langt i arbeidet har Waaler gjort noen funn: Denne gruppen ungdommer er ikke godt nok undersøkt, og det er stor forskjell på hvilke typer behandlinger de får.
Det er også behov for flere studier for å få en mer helhetlig forståelse av hva som kan virke.
Waaler er i gang med å se på hvilken type behandlingselementer som fører til best endring hos disse ungdommene, og det varsles noen mer kunnskap om dette til sommeren.
Les også:
Jeg trodde det var gratis å være syk i Norge. Så jeg fikk sjokk
Les også:
Halvor lever med hjernekreft: – Sykdommen definerer meg ikke
(+)
Les også:
– Sjekk doskåla når du er på toalettet – det reddet meg",Error generating text.,no
24_19_03_2025,Er det dumt å ha elbil i en krisesituasjon?,Geir Amundsen,https://premium.vgc.no/v2/images/bccae0af-7caf-40b5-8f26-9604fe6582ea?fit=crop&format=auto&h=1639&w=2048&s=2d049baba8f4d13b8f5d7c94376245f5857f8936,2025-03-18 19:41:28,https://www.aftenposten.no/bolig/i/pP5ea6/er-det-dumt-aa-ha-elbil-i-en-krisesituasjon-tolv-ting-alle-preppere-boer-vite,Økonomi og næringsliv,"Tolv ting om egenberedskap alle «preppere» bør vite.
Det er geopolitiske ulvetider og stadig mer ekstremvær. Myndighetene anbefaler at flest mulig er forberedt på å klare seg selv i en uke.
Hvor sårbar er man uten eget beredskapslager, og hvor dumt er det å ha elbil i en krisesituasjon? Vi har spurt Tore Kamfjord, som er utredningsleder i Direktoratet for samfunnssikkerhet og beredskap (DSB).
1. Noen synes det er hysterisk med beredskapslager: Hvilke scenarioer er det realistisk å forberede seg på i Norge?
DSB peker på følgende scenarioer som kan inntreffe: ekstremvær, pandemier, ulykker, sabotasjer og i verste fall krigshandlinger.
Vil du ha lavere strømregning?
Her er de billigste leverandørene.
Se oversikten på Penger.no
– Egenberedskap handler om å være forberedt på konsekvensene av ulike kriser og hendelser. Det dreier seg om å lære seg hvordan man kan håndtere at strømmen blir borte, at mobil- og internett faller ut, eller at vi ikke kan drikke vannet fra springen, forklarer Kamfjord.
2. Hvor sårbar er man uten et beredskapslager?
– Hvis du ikke har egenberedskapen i orden, setter du deg selv og de rundt deg i en vanskelig situasjon hvis det skjer en krise, advarer Kamfjord.
I tillegg er det fare for at du legger beslag på ressurser fra kommuner og nødetater som burde gått til dem som virkelig trenger hjelp.
3. Hvordan sikrer myndighetene forsyninger ved en langvarig krise, og hvor raskt kan folk få hjelp?
– Enten det er strømbrudd, skred, stengte veier eller bortfall av telekommunikasjon og internett – vil myndigheter, frivillige og næringsliv umiddelbart begynne feilretting og opprydding for å normalisere situasjonen.
Egenberedskap dreier seg om å kunne klare seg selv inntil alt virker igjen. De fleste bør klare én ukes egenberedskap, mener Kamfjord.
Nærings- og fiskeridepartementet (NFD) har koordineringsansvaret for matvareberedskapen.
De opplyser at etter to år med pandemi og tre år med krig i Ukraina er beredskapsordningene og systemene for norsk matvareforsyning godt testet.
Departementet har pr. i dag ikke indikasjoner på forsyningsutfordringer eller behov for å endre dagens systemer.
4. Hvor lenge kan mat og vann lagres, og hvordan bør det oppbevares?
Riktig rengjort og fylt vann (se faktaboks under), lagret kjølig og mørkt, kan holde i mange år. Smaken kan bli litt endret, men vannet er ikke nødvendigvis farlig av den grunn. For smakens skyld kan det være greit å bytte det ut hvert annet år.
Holdbarhetsdatoen er en god veileder for mat, men lukt og smak er viktig.
Kamfjord har følgende tips:
– Det er lurt å ha matvarer i beredskap som du også synes det er godt å spise i normale tider. Da kan du rotere ved å ta fra beredskapslageret, og fylle lageret med nyinnkjøpte varer.
5. Har hermetikk uendelig holdbarhet?
Her har vi spurt matforskningsinstituttet Nofima, som blant annet forsker på hermetikk:
– Nei, men den er trygg å spise selv etter «best før»-datoen, selv om maten kan tape smak og utseende over tid. Det er viktig å ha en rotasjonsplan for å oppdatere lageret med nye produkter, forklarer forskningssjef Morten Sivertsvik i Nofima.
6. Hva slags førstehjelpsutstyr og medisiner bør inngå i et beredskapslager, og hvordan sikrer man tilgang til livsviktige legemidler?
Kamfjord i DSB har følgende punkter på listen:
Ha et grunnleggende førstehjelpsskrin (plaster, bandasjer, sårvask, saltvann, branngelé m.m. Se faktaboksen under).
Ha minst én ukes forbruk av reseptbelagte medisiner og nødvendig medisinsk utstyr.
Snakk med legen din, og lag deg en rutine der du henter ny forsyning senest en uke før du går tom.
Jodtabletter til dem som er under 40 år, gravide eller ammende.
Lær grunnleggende førstehjelp.
7. Hvor mye kontanter bør man ha, og kan myndighetene garantere at betalingssystemene virker?
Kamfjord er klar på at feil og angrep på digitale betalingssystemer kan skje.
– Norges Bank og DSB anbefaler å ha flere alternativer: ulike bankkort, konto i flere banker og noe kontanter.
– Mengden kontanter hver enkelt bør ha, avhenger av din situasjon. Tenk gjennom hva du kan trenge i en uke.
– Det beste er å ha det du trenger for en uke, slik at du slipper å dra i butikken.
8. Hvordan sikre tilgang til offisiell informasjon hvis både internett og mobilnett forsvinner?
– Om det er fare for liv og helse, vil mobiltelefoner som har 4G-/5G-dekning få et nødvarsel.
– NRK P1 har beredskapsansvar og sender på DAB-nettet, som har reservekraft og kan operere uavhengig. Derfor anbefaler vi en DAB-radio som går på batterier som en del av beredskapen.
– De fleste biler har DAB-radio, og noen lokalradioer sender på FM (om du skulle ha en gammeldags radio).
– Kommuner kan også ha fysiske møteplasser for informasjon hvis digital infrastruktur er nede.
9. Hva kan skje ved et stort strømbrudd, og hvordan påvirkes vann, kloakk, handel og kontanter?
– Det er mange forhold som vil ha betydning for hvor store konsekvensene blir, forklarer Kamfjord.
Han understreker at han ikke har forutsetninger for å gå i dybden på det, men at poenget til DSB er at vi alle må være forberedt på å klare oss en uke uten strøm.
– Da må vi tenke gjennom hva vi bruker strøm til, og hvordan vi skal planlegge og forberede oss for å klare oss uten.
Slik påvirker et strømbrudd:
Mye av infrastrukturen, fra vannforsyning til kortterminaler, er avhengig av strøm.
Et langvarig og omfattende strømbrudd vil gi store konsekvenser, særlig om vinteren.
Du bør planlegge for både oppvarming, matlaging og lys uten strøm ved hjelp av vedovn eller gass-/parafinovn. Er det vanskelig å få til, for eksempel om du bor i en leilighet, kan du gjøre en forhåndsavtale med noen du kan reise til hvis det skulle bli kaldt og mørkt lenge.
10. Hvilke særskilte hensyn bør man ta i egenberedskap for eldre, små barn og personer med kroniske sykdommer?
– Får du allerede helsetjenester, vil du få hjelp først i en krise, men det kan likevel ta lengre tid enn normalt.
– Tenk gjennom dine daglige behov og hvilke unike utfordringer du har. Pass på at familie, venner eller naboer vet hvordan de kan hjelpe deg.
– Har du små barn, sørg for ekstra mat som barnemat og nødvendige produkter som bleier.
– Skaff deg en eller flere «beredskapsvenner» – avtal på forhånd hvordan dere kan hjelpe hverandre i en krise. Vær særlig oppmerksom på personer i nærmiljøet som kan trenge ekstra støtte.
11. Hvilke beredskapstiltak bør prioriteres ved lite plass eller begrenset økonomi?
DSBs mann mener at egenberedskap hverken trenger å være spesielt dyr eller ta mye plass:
– Det viktigste er å ha drikkevann og en mulighet til å holde varmen.
– 20 liter vann pr. person er anbefalt, men 5–10 liter er bedre enn ingenting. Bruk beholdere som passer i skap eller under seng.
– Ha en «beredskapsvenn» du kan oppsøke, eller som kan hjelpe deg.
12. Er det dumt å ha elbil i en krisesituasjon?
Kamfjord mener det i stor grad handler om dine egne transportbehov. Han anbefaler å tenke gjennom følgende:",Error generating text.,no
32_19_03_2025,Ferrari-sjefen innrømmer trøbbel: –⁠ Må finne en bedre måte å kommunisere på,Ole Kristian Strøm,https://akamai.vgc.no/v2/images/b35e6fe6-c269-4b35-8bd6-671a023a8594?format=auto&w=1080&s=c3362870686fed6d4db86431b3282e2cf27f4415,2025-03-18 12:11:56,https://www.vg.no/sport/i/AvgMJq/formel-1-lewis-hamilton-og-ferrari-slaktet-av-italienske-medier-etter-debuten,Sports,"Italienske medier er ikke nådige i sin vurdering av Ferraris innsats i Lewis Hamiltons debut i rødt.
Kortversjonen
Lewis Hamilton debuterte for Ferrari med en skuffende 10. plass i Australia.
Italienske aviser beskriver innsatsen som en «katastrofe».
Hamilton slett med å finne seg til rette i en ny bil.
Ferrari innrømmer at det var trøbbel i kommunikasjonen mellom Hamilton og teamet.
Charles Leclerc endte på 8. plass.
Sesongåpningen i Australia endte med 10. plass for syv ganger verdensmester Hamilton. Nok en gang bommet Ferrari på strategien.
«Corriere dello Sport» kaller det «en katastrofe», mens «Gazzetta dello Sport» oppsummerer fansens spott i sosiale medier med en frekk «Lewis, velkommen til Ferrari!».
Formel 1-stjernen beskriver selv sin første Ferrari-opplevelse som en «berg- og dalbane».
Han er samtidig klar på hvor vanskelig bilen var å kjøre:
– Det var veldig vanskelig og gikk mye verre enn jeg trodde det skulle gjøre. Bilen var virkelig, virkelig vanskelig å kjøre, sier han til Sky Sports.
– Jeg er bare takknemlig for at jeg klarte å holde den unna veggen, for det var dit den ville mesteparten av tiden.
Ferrari hadde en tung dag i Melbourne. Charles Leclerc ble nummer åtte.
40-åringen delte sine følelser på Instagram dagen etter det turbulente sesongåpningsløpet og beskrev det som en «berg-og-dalbane».
– Definitivt ikke det vi hadde håpet på, skrev briten.
Kommunikasjonen mellom Hamilton og hans nye racingeniør Riccardo Adami var også anspent. Flere ganger ba Hamilton ingeniøren om å la ham være i fred over teamradioen.
Ferraris teamsjef Frederic Vasseur innrømmer at laget har utfordringer:
– Vi må finne en bedre måte å kommunisere mellom bilen og teamet på, sier han.
Formel 1-VM fortsetter allerede til helgen - nå i Shanghai.",Error generating text.,no
36_19_03_2025,7500 har kjøpt bilen – nå blir den ny,Vegard Møller Johnsen,https://www.cdn.tv2.no/images?imageId=17422786&x=0&y=35.62&cropw=100&croph=58.9&panox=0&panoy=35.62&panow=100&panoh=58.9&width=1200&height=630,2025-03-18 19:00:00,https://www.tv2.no/broom/7500-har-kjopt-bilen-na-blir-den-ny/17422696,Mat og drikke,"BMW har fått dreis på elbilsatsningen sin. De er nå blant merkene som har flest modeller fordelt på ulike segmenter.
Kombisedanen, i4, var ganske tidlig ute. Den har derfor rukket å bli fornyet.
Faceliften er av den ganske beskjedne sorten. Men kjennere vil merke seg noen viktig visuelle endringer.
Men er bilen blitt bedre? Det er vi litt usikre på.
Pris
i4 er tilgjengelig i to varianter: 40 eDrive med bakhjulsdrift og M50 xDrive – som har firehjulsdrift.
Prisene stater på 543.600 kroner for innstegsmodellen. Skal du ha M50 xDrive må du ut med minst 602.200 kroner.
Kampanjemodellen SuperCharged Premium, som er godt utstyrt, letter deg for 643.000 kroner.
Mens testbilen – som er tilnærmet fullspekket – ender på i 747.000 kroner.
Tysk premium blir som vanlig kostbart, når du lesser på med ekstrautstyr.
Populær
Da i4 ble lansert, kostet toppmodellen betydelig mindre enn nå. Med startpris på rundt 540.000 kroner. Det var også langt færre elbiler å velge mellom.
Disse to faktorene, gjorde at pågangen ved lansering av i4 i Norge var enorm.
I dag er det registrert mer enn 7500 eksemplarer på norske skilter. Et ekstremt høyt tall for en slik bil.
Men bør de som var tidlig ute bytte ut den «gamle» nå? Det vil finne svaret på.
Dette er en korttest. Det betyr at vi har kjørt en variant av denne modellen tidligere. Du finner en mer grundig test av denne modellen her.
Hva er nytt:
Bare for å ta det som ikke er nytt aller først: Rekkevidde, ytelser og hurtiglading.
Det vil for M50 xDrive si opptil drøyt 500 kilometers rekkevidde, 0-100 km/t på 3,9 sekunder, toppfart 225 km/t og toppeffekt på 205 kW ved hurtiglading.
Her er det nye:
- Lykter foran - med stående markeringslys
- Grillen har fått horisontale striper
- Lykter bak. Her er de nye laserlysene standard på M50
- Detaljer rundt blant annet speilhus og diffusor er nå endret fra grå til blank svart
- Rattet har fått flat bunn og rød stripe på toppen som markerer senter
- Krystall-knapp erstatter den gamle girsparken
- Dashbordet har fått mer stemningsbelysning – og mindre krom
Det er også noen nye lakkfarger og annerledes design på felger.
Vi tok BMW i4 med på vintertest – og ble imponert
Hvordan fungerer det?
Når jeg ser bilen for første gang, tenker jeg at jeg liker de gamle frontlyktene bedre enn de nye. De gamle hadde litt særpreg og så aggressive ut. De nye såpass anonyme, at de kunne vært plassert på en hvilken som helst annen bil.
En liten runde rundt bilen avslører raskt at jeg egentlig ikke ser noen merkbare forskjeller ellers. Med unntak av de nye laser-baklyktene, da. De er rett og slett lekre – og hentet rett fra M4 CSL.
Så langt er det altså uavgjort. Litt tøffere bak – mindre tøff foran.
Innvendig er testbilen spekket med de lyseste Merino-skinnsetene. Det gir umiddelbar premiumfaktor. Dette velges av de som er nøye med hvem som sitter i bilen – og hvilken mat/drikke de tenker det er greit (og ikke greit!) å nyte i bilen.
Det nye dashbordet må jeg innrømme at jeg ikke legger merke til. Det først når jeg sammenligner med det gamle, at jeg ser en endring. Om den den er til det bedre? Tja, usikker ...
Her var det aller første møtet vårt med i4 - og iX
Midtkonsollen er det lettere å se forskjell på. Her er girspaken borte. I stedet er det en jålete krystallknapp som fungerer som girvelger. Men jeg må innrømme at jeg er av typen som liker en skikkelig girspake. Det ser kanskje gammeldags ut, men er veldig greit å forholde seg til.
Så skal det også nevnes at jeg i løpet av testperioden, blir mer og mer vant med å bruke knappen. Så dette handler nok mest om vane. At den nye løsningen ser mye bedre og mer moderne ut, er det i alle fall ingen tvil om.
Rattet legger jeg fort merke til. Dette er noe av det mest vellykkede BMW har gitt oss. Ser akkurat så tøft og sporty ut som det burde i en slik bil. Dessuten har man valgt å beholde de fysiske knappene. Flere av de nye BMW-modellene har en haptisk løsning, som ikke er på langt nær like bra.
Vi er ellers svært glad for at BMW holder på menyhjul og knapper til infotainmentsystemet. Vi har skjønt at dette dessverre er på vei ut. Det er synd og skam – for det gjør systemet svært enkelt å bruke. Særlig siden man også kan velge å trykke på skjermen, i tillegg. Det beste fra to verdener.
Head up displayet er som før helt i toppklasse. Mens de digitale instrumentene er som på alle de nye modellene, langt unna å imponere. Når skal vi få en mer klassisk visning, med «klokkene» som mange av oss er så glade i?
På veien er dette akkurat som vi husket: En av markedets mest sporty firedørs elbiler. Deilig styrefølelse, et understell som tilpasser seg dine ønsker – og skyv som virkelig merkes i ryggraden. Bedre enn før? Jeg kan ikke si at jeg merker noe forskjell, i alle fall.
Forbruket er det ingen store endringer på. Vi ender på 21,3 kWt per 100 kilometer i testløypa. Som ventet noe høyere enn det bilen blir opplyst å skulle bruke.
Både Broom og NAF har testet rekkevidden på i4 på vinteren, med ganske store forskjeller i resultat. Men vår erfaring er at 380-400 kilometer er realistisk på vinteren.
Ladetestene spriker også en del. Men er du flink til å bruke forvarmeren, som også kan styres via Appen, får du helt klart best effekt.
Ideelt sett skal den klare 10-80 prosent på 31 minutter. Vår erfaring er at det er vanskelig å gjenskape. Rundt 40 minutter virker mer realistisk ...
Slik kommer du lengre med elbilen på vinteren
Konklusjon:
i4 M50 xDrive er fortsatt en ypperlig egobil for den kjøreglade. Baksetene er trange, så noe familiebil er det ikke.
Det er både noen positive og negative sider med faceliften den har fått. Jeg skulle nok ønske at BMW dro på med litt mer, når de først fornyet den. Litt mer rekkevidde, eller dratt på enda et lite knepp på ytelser, hadde ikke gjort noe.
Om du har kjøpt den «gamle» utgaven, tenker jeg egentlig ikke at du går glipp av så mye, om du bare beholder den videre ...
Få et unikt innblikk i BMWs framtid
Bilen for deg hvis?
Du gjerne ofrer praktiske egenskaper for å ha det moro
Ikke bilen for deg hvis?
Plass i baksetet og best mulig rekkevidde for pengene er det viktigste
Eierne mener
I Brooms bilguide, kan norske eierne selv fortelle om bilene sine. Omtrent som en Tripadvisor for bil. Så langt har vi fått inn over 13.000 omtaler!
Du kan også fortelle om bilen din: Klikk her - det er fort gjort.
Det ligger inne 16 vurderinger av denne modellen - les hva eierne mener her.
Her er 5 ting du bør vite om BMW 4-serie
BMW i4 M50 xDrive
Motor og ytelser:
Motor: Elektrisk, to motorer
Effekt: 544 hk / 795 Nm
0-100 km/t: 3,9 sek.
Toppfart: 225 km/t
Forbruk (WLTP): 19,7 kWt/mil
Batteri/lading:
Batteripakke: 83,9 kWt
Rekkevidde: 470 km (WLTP)
Hurtiglading: 205 kW
Ombordlader: 11 kW
Mål, vekt og volum:
Lengde x bredde x høyde: 478 x 185 x 1 44 cm
Bagasjerom: 470 / 1.290 liter
Vekt: 2.290 kg
Tilhengervekt: 1.600 kg
Taklast: 75 kg
Nyttelast: 520 kg
Pris:
Startpris:
543.600 kroner (i4 eDrive40) / 602.200 kroner (i4 M50 xDrive)
Pris testbil: 747.399 kroner
Oppgitt vs målt forbruk:
Målt forbruk* 21,5 kWt/100 km
* = Vi kjører alle testbilene i egen testløype på 100 kilometer, som inkluderer motorvei, småkjøring og landevei.
NB: Forbruket påvirkes likevel av ytre faktorer, som temperatur, vær, kjøreforhold, trafikk og kjøremønster.",Error generating text.,no
