aid,title,author,image_url,published_date,article_url,category,raw_text,text,is_manipulated
1_25_04_2025,«Pax Americana» – «Den amerikanske freden»,Gunnar Strømme,https://vcdn.polarismedia.no/a0d506fa-bdeb-4c88-a6ee-f7d45ab87934?fit=crop&h=630&q=80&tight=true&w=1200,2025-04-25 04:30:00,https://www.fvn.no/mening/debattinnlegg/i/wgj9Jn/pax-americana-den-amerikanske-freden,Politics,"Etter Tysklands kapitulasjon 7. mai 1945 har Vest-Europa opplevd sin lengste fredsperiode i historien. Det skjedde fordi USA ikke så fredsslutningen i 1945 som et punktum for en sterk tilknytting til Vest-Europa, men som en start på et videre tett samarbeid. Marshallplanen ga uvurderlig økonomisk støtte til gjenoppbyggingen av et krigsherjet Vest-Europa. Opprettelsen av NATO i 1949 ga oss nødvendig sikkerhet. Etter at demokratiske regjeringer, en etter en, ble avsatt ved kommunistiske kupp i flere østeuropeiske land, senket det såkalte jernteppet seg mellom Øst- og Vest-Europa.
Sammenbruddet i Øst på slutten av 1980-tallet skjedde både på grunn av en «forgubbing» i lederskapet, men også på grunn av en økende frihetstrang i befolkningen i landene som lå nærmest Vest-Europa. Angiver-virksomhet, men også dårlig økonomisk utvikling sammenliknet med Vesten, var også medvirkende.
Men hva ville ha skjedd med Vest-Europa dersom USA hadde «reist hjem igjen» etter Tysklands kapitulasjon og vendt tilbake til «America First»-politikken fra mellomkrigstiden, med høye toll-satser og politisk isolasjon?
Det ville ha vært ille for begge parter. For det er ikke bare Europa som har tjent på samarbeidet preget av frihandel og andre former for internasjonalt samarbeid. Det har i høy grad også USA gjort. Hva ville skjedd med de store tech-selskapene i USA dersom de bare hadde hatt sitt hjemmemarked på i overkant av 300 millioner mennesker, eller mindre enn det dersom Trumps immigrasjons-politikk hadde vært gjort gjeldende tidligere?
Om få dager er det 80 år siden slutten på andre verdenskrig. At Europa, etter Sovjetunionens sammenbrudd, overlot enda mer av ansvaret for NATOs militære kapasitet til USA, er imidlertid tragisk, og kan få uante følger med en president som Trump ved makten.
Verken Trump eller visepresident Vance ser ut til å ha oppfattet at Ukrainas sikkerhet henger nøye sammen med Europas sikkerhet. Eller kanskje de rett og slett ikke bryr seg?
Utviklingen i Russland gikk ikke slik som vi håpet og trodde at skulle skje for 30 år siden. Den tidligere KGB-offiseren Vladimir Putin fikk makten overlatt fra «redningsmannen» Boris Jeltsin. Dyktige ung-kommunister ble til oligarker etter at de overtok statsbedrifter for en slikk og ingenting og fikk skikk på dem. Parallelt ble KGB til FSB, under Putins stramme ledelse, både før og etter at han ble valgt til president. Stadig større makt gjorde at han kunne si til sine «konkurrenter», de fleste oligarker: Dersom dere lar være å blande dere inn i politikken kan dere drive virksomhetene deres som dere vil. Etter hvert fikk Putin nærmest uinnskrenket makt. Alle forsøk på å tale Putin imot endte enten med fengsel eller med døden. Reaksjonene fra Vesten og NATO etter Russlands innmarsj på Krim i 2014 var uforståelig svake.
Etter at Donald Trump, til manges overraskelse, ble valgt til president i USA i 2016, hadde han flere møter med Putin. Det mest kjente møtet var i Helsinki i 2019 der de to presidentene snakket sammen alene, bare med tolker til stede. Det er mange som har stilt spørsmålet etter den påfølgende pressekonferansen: Hva har Putin på Trump som vi ikke kjenner til? Tre år senere skjedde fullskala-angrepet fra Russland på Ukraina. Denne gangen gjorde Ukraina sterk motstand, delvis fordi de både hadde fått våpen og opplæring fra NATO-land. Men hjelpen gjennom NATO i tiden som fulgte var for liten og kom for sent til å slå Russlands angrep fullstendig tilbake.
Etter Trumps valgseier i 2024 har ting gått fort. Gjennom sin infame måte å opptre på vet alle republikanske kongressmedlemmer at dersom de går imot Trump eller hans nærmeste medarbeidere, kan de bare si takk og farvel til å bli gjenvalgt.
Både president Trump og visepresident Vance ser nå ut til å støtte angriperen, Russland, sterkere enn den angrepne parten, Ukraina. De nærmeste dagene eller ukene vil antakelig kunne være avgjørende. Verken Trump eller visepresident Vance ser ut til å ha oppfattet at Ukrainas sikkerhet henger nøye sammen med Europas sikkerhet. Eller kanskje de rett og slett ikke bryr seg?
Vil Trump også oppheve de økonomiske sanksjonene mot Russland mot å få tak i sjeldne mineraler, samt med det forsøke å svekke Russlands bånd til Kina? Ingen europeiske ledere våger å si høyt hva de innerst inne mener om president Trump. Men at det nå jobbes på høytrykk i europeiske hovedsteder og i Brussel er i alle fall sikkert. I 2020 skrev Mary Trump, Donald Trumps niese, en bok med følgende tittel: «TOO MUCH and NEVER ENOUGH. How my family created the world's most dangerous man». Et 80 år gammelt fredssamarbeid mellom Europa og USA, «Pax Americana», knaker nå i sine sammenføyninger.",Error generating text.,no
4_25_04_2025,"Dette må du vite om møtet mellom Trump, Støre og Stoltenberg",Lytt til saken,https://akamai.vgc.no/v2/images/6220a67b-ea0c-416b-b6cb-5e265148227f?format=auto&w=1080&s=98e1f81b719af15a19a84f784ef72c1224ae4dff,2025-04-24 20:27:51,https://www.vg.no/nyheter/i/yEjK3e/dette-maa-du-vite-om-moetet-mellom-trump-stoere-og-stoltenberg-i-det-hvite-hus,"Politics, Business","Møtet dekket temaer som Ukraina-krigen, handel, toll og sikkerhetspolitikk.
Marie Dreyer Bakken
1 Hva sa Trump om Ukraina?
Trump sa at han var fornøyd med samtalene om Ukraina og roste Støre og Stoltenberg for Norges rolle i konflikten. Støre understreket på sin side viktigheten av at USA legger press på Russland og støtter forsøkene på å få til en våpenhvile.
2 Hva sa Trump om toll på norske varer?
Trump sa at han sannsynligvis ikke vil senke tollsatsen for norske varer, selv om Norge har et handelsunderskudd med USA.
Han begrunnet dette med at Norge har en sterk økonomi og «har råd til å betale mer».
Støre påpekte at Norge mener handelen mellom landene er balansert og at det bør være nulltoll på industrivarer.
3 Hva synes Trump om Norge?
Trump hadde mye positivt å si om Norge. Han kalte det et «utrolig land» med «utrolige folk», sa at nordmenn er «flotte forretningsfolk» og at Norge er en «veldig smart nasjon».
Presidenten sa også at han elsker Norge og ønsker å stå på ski her.
Han sa også at han har stor respekt for kongen av Norge og at han ønsker å møte ham. Han beskrev kongen som en person som har oppnådd stor respekt, noe han mente ikke er lett.
4 Hvorfor dro Støre og Stoltenberg til USA?
Statsminister Jonas Gahr Støre møtte USAs president Donald Trump i Det hvite hus for å diskutere viktige temaer som sikkerhetspolitikk, krigen i Ukraina, handel og Norges strategiske betydning for USA. Møtet var en mulighet til å styrke forholdet mellom Norge og USA, blant annet innen sikkerhet og handel.
Møtet gir også en mulighet til å påvirke amerikansk politikk som kan være gunstig for norske interesser.",Error generating text.,no
24_25_04_2025,Øker med millioner: Nå rennes han ned av agenter,Christian Skare Stendal,https://premium.vgc.no/v2/images/dde74db4-3776-4a32-8bb9-1e2801181297?fit=crop&format=auto&h=1365&w=2048&s=1a5c71af077a0fd60a729f368593f82491533d72,2025-04-24 11:40:54,https://www.aftenposten.no/sport/i/VzwaX6/oeker-med-millioner-naa-rennes-han-ned-av-agenter,Sports,"Nidaros-opprykket får konsekvenser på direkten.
– De er ekstremt mer på, sier Nidaros-leder Kenneth Madsø til Adresseavisen.
«De» i denne sammenhengen er hockeyagenter som forsøker å selge inn spillere til den ferske eliteserieklubben.
– Jeg sitter sikkert i samtaler med agenter ti ganger om dagen. Forskjellen fra i fjor er ganske stor. Da var det vi som jaget, og som selv måtte ta kontakt med agentene. Da ba vi om å få tilsendt liste over aktuelle spillere, og så kom det aldri noen liste.
To under kontrakt
Madsø og Nidaros Hockey er midt i jobben med å bygge en stall som skal være konkurransedyktig nok til å kjempe om en sluttspillplass (topp åtte) i sin første sesong på øverste nivå i norsk ishockey.
Per i dag står klubben med to spillere under kontrakt for neste sesong. Svenskebacken Adam Bäckehag og lokale Sander Vedul-Kjelsås.
Og allerede tirsdag starter sommertreningen.
Sånn sett passer det godt at tilgjengeligheten på potensielle spillere er kraftig forbedret.
– Jeg sto der ved vantet mot Ringerike og tenkte at jobben min blir så vanvittig mye vanskeligere om vi ikke klarer opprykket nå, sier Madsø.
– Men det er fortsatt ingen enkel jobb. Vi skal forme et lag som blir interessant å følge med på, som kan ta en skalp i ny og ne og forhåpentligvis ta en sluttspillplass det første året.
– Er du stresset over at det bare er to spillere på kontrakt neste sesong?
– Nei. Vi er jo i dialog med mange, så det kommer til å dette inn noen i løpet av de neste tre ukene.
– Det verste jeg gjør
Foreløpig har to av spillerne som var med og spilte Nidaros opp fått beskjed om at de ikke får bli med til eliteserien. Det blir trolig flere.
– Man blir jo glad i guttene som har lagt ned en betydelig jobb, og så står man her hvor man kanskje må takke for laget. Det er det verste jeg gjør i denne settingen. Det er ikke noe hyggelig i det hele tatt, sier Madsø.
– Vi skal jobbe for å beholde en tydelig trøndersk profil, og har troen på ungguttene som er her. Samtidig er vi ærlige på at om vi skal nå opp, må vi hente inn både fra ellers i Norge og utlandet for å få den spisskompetansen vi ikke har i dag. Det er vi totalt avhengige av, sier klubbens daglige leder.
– Vi må ikke gjøre kjempestore utskiftninger, men det blir noen.
Millionvekst
Regnskapet for 2024 er klart, og Nidaros lander på et enda renere skjær enn spådd i januar. Da anslo styreleder Frode Storesund et overskudd på 3–400 000 kroner overfor Adresseavisen.
Fasiten viser et pluss på 450 000 kroner etter en omsetning på i overkant av 8,5 millioner kroner.
Budsjettet for 2025 viser en kraftig millionøkning - og klubben anslår en omsetning på tolv millioner kroner - en vekst på nær 40 prosent fra i 2024. Nidaros budsjetterer med knapt overskudd på 16 000 kroner.
I de økte utgiftene ligger også større lønnskostnader. Spillernes totale lønnspott har vært av den beskjedne sorten.
Før rutinerte Villiam Strøm signerte midtveis i sesongen, hadde hele Nidaros-stallen totalt 60 000 kroner i lønn i måneden. Strøm-lønningen ble finansiert eksternt.
– Vi må begynne å verdsette sport litt mer. Det vil si at vi må begynne å tilby noen lønninger. Men vi klarer ikke å matche de største lønningene rundt omkring.
Nye inntekter
Salgs- og markedssjef Daniel Björnberg får en stor del av oppgaven med å hente inn høyere inntekter.
– Hva har skjedd etter opprykket?
– Det ble et lite vakuum i noen dager, og så satte det i gang ganske fort, sier svensken.
– Bare de første ukene har vi hatt en økning på rundt 700 000 kroner. Det er bra kroner, men vi skal opp en bit til, sier han.
Nidaros spilte hele opprykksesongen uten en hovedsponsor på drakten. Det kan endre seg.
– Vi er i dialog med noen. Vi snakker spesifikt med enkelte bedrifter som er sterke i samfunnet her i byen. Jeg tror vi er veldig nærme, sier Björnberg.",Error generating text.,no
16_25_04_2025,JD Vance bryter stillheten om møtet med paven,Vebjørn Barlaup,https://www.cdn.tv2.no/images?imageId=17672291&x=0&y=5.83&cropw=100&croph=71.67&panox=0&panoy=5.83&panow=100&panoh=71.67&width=1200&height=630,2025-04-24 07:38:34,https://www.tv2.no/nyheter/utenriks/jd-vance-bryter-stillheten-om-motet-med-paven/17672282,Politics,"Søndag morgen, 1. påskedag, møttes visepresident JD Vance og pave Frans i Vatikanet. Det korte møtet ble fanget på video, hvor man ser visepresidenten, som konverterte til katolisismen i 2019, hilse på paven.
– Hallo. Så godt å se deg, innleder republikaneren.
Paven sitter i rullestol, og det er ikke mulig å høre hva han svarer.
– Jeg vet du ikke har vært i toppform, men det er godt å se at du føler deg bedre, fortsetter Vance.
– Ganske sprøtt
Dagen etter døde paven, og den amerikanske visepresidenten var en av de siste som så ham i live. Vance har siden reist videre til India, hvor han for første gang uttaler seg til pressen om det spesielle møtet.
– Det er egentlig ganske sprøtt. Da jeg besøkte ham hadde jeg jo ingen anelse om at han hadde under 24 timer igjen på jorden, sier Vance ifølge Reuters.
– Jeg var heldig som fikk ta ham i hånden og fortelle ham at jeg ber for ham hver dag fordi det gjorde jeg, og det gjør jeg, fortsetter visepresidenten.
Avviser krangel
Søndagens møte mellom Vance og paven var i utgangspunktet ikke planlagt, og skjedde nokså spontant etter at visepresidenten møtte kardinal Pietro Parolin lørdag.
– Det ble en meningsutveksling rundt den internasjonale situasjonen, særlig knyttet til land påvirket av krig, politiske gnisninger og utfordrende humanitære situasjoner, med særlig fokus på innvandrere, flyktninger og fanger, sa Vatikanet i en uttalelse etter møtet, gjengitt av The Guardian.
Pave Frans kritiserte ved flere anledninger Trump-administrasjonen, men etter 88-åringens bortgang ønsker JD Vance å tone ned de politiske forskjellene.
– Jeg er klar over at han var uenig i deler av vår politikk. Han var også veldig enig i andre deler av vår politikk, poengterer Vance.
I januar kritiserte pave Frans Trump-administrasjonens innvandringspolitikk, og kalte planene om massedeportasjoner for «en skam». Paven fulgte opp kritikken i februar, da han i et brev til alle amerikanske biskoper kritiserte deportasjoner og behandling av innvandrere.
– Jeg ønsker ikke å ødelegge hans ettermæle ved å snakke om politikk. Jeg mener han var en veldig god kristen pastor, og det er slik jeg velger å huske ham, understreker visepresidenten.
«Antikrist»
Dødsfallet førte umiddelbart til en rekke mer eller mindre seriøse spekulasjoner på nett, hvor visepresidenten ble anklaget for å ha forårsaket pavens død. Noen hevdet at bare det å møte Vance kunne føre til at man mistet livet, og på et tidspunkt trendet «Antikrist» på plattformen X.
– Kan du møte Putin neste gang?, skrev én bruker til visepresidenten.
Spekulasjonene gikk så langt at TV-kanalen France24 gjennomførte en faktasjekk for å bekrefte det alle egentlig visste: Nei, JD Vance tok ikke livet av pave Frans.
På spørsmål om hvem visepresidenten ønsker seg som neste pave, understreker JD Vance at det er spørsmål kardinalene må avgjøre.
– Vi har nok av problemer å fokusere på i USA. Jeg vil bare be en bønn for visdom, for jeg vil selvsagt at kardinalene velger rett person, avslutter visepresidenten.",Error generating text.,no
21_25_04_2025,Verden trenger amerikanske universiteter,Sigrun Aasland,https://vcdn.polarismedia.no/39c52d2b-1436-421c-b89a-9163f8181d59?fit=crop&h=630&q=80&tight=true&w=1200,2025-04-24 17:45:00,https://www.fvn.no/mening/kronikk/i/PpGOx0/verden-trenger-amerikanske-universiteter,Politics,"I år feirer Norge og USA
Restauration
loss i Stavanger, med 52 norske emigranter om bord. De første norske utvandrerne kom fra Tysvær og andre bygder i Rogaland og Stavanger. Folk i Agder fulgte etter: Fra slutten av 1800-tallet til midten av 1960-tallet hadde agderfylkene den
De norske utvandrerne som ble igjen
over there,
var med på å bygge en nasjon som er helt uten sidestykke i verden. USA har en brokete, voldsom og unik historie. Det er et land med store kontraster, et land som både viser og vekker sterke følelser.
Sigrun Aasland
Forsknings- og høyere utdanningsminister
På den ene siden har USA verdens beste universiteter og fremste vitenskapsfolk: De utklasser resten av verden i antall nobelpriser gjennom historien.
Amerikanerne har vært ledende i å forme den globale kulturen. De har begeistret oss med litteratur, film, musikk, månefart og store medisinske og teknologiske gjennombrudd.
På den andre siden er USA et land med sterk splittelse. Det er et land som er bygget på sosial mobilitet og innvandring, men der sosial mobilitet blir stadig vanskeligere og innvandringen stadig mer konfliktfull. Der de økonomiske forskjellene har vokst og mulighetene for mange har krympet.
Alt dette er også et land jeg elsker, fascineres av og frustreres over. Slik tror jeg mange nordmenn har det. Fra 2001 til 2007 studerte og jobbet jeg i den amerikanske hovedstaden Washington DC. På Johns Hopkins University, der jeg var student, møttes studenter og forskere fra hele verden og mer enn 80 ulike land. Det var, kort oppsummert, stort mangfold, høyt faglig nivå og uforglemmelige opplevelser.
Nå skjer dramatiske endringer i den amerikanske politikken for forskning og høyere utdanning. Det legges begrensninger på hva det skal forskes på. Universiteter som ikke vil forplikte seg til å avslutte arbeid med inkludering, likestilling og bærekraft, opplever store budsjettkutt. Flere forskningsinstitutter har måttet si opp ansatte og avlyst internasjonale reiser. Store forskningsprosjekter og viktige datasett er i spill. Ved Johns Hopkins, som også driver omfattende arbeid med global helse, er
Dette er dårlige nyheter for amerikanske forskere og universiteter. Aller mest er det dårlige nyheter for oss alle. Fra amerikanske universiteter har vi blant annet fått livreddende vaksiner, insulin, livmorhalsprøver og p-piller. Amerikanske forskningsmiljøer sitter på omfattende ekspertise, data og tidsserier om vær, temperaturer og klima, som er viktig både for å forstå klimaendringer og varsle fremtidige naturkatastrofer.
Fra amerikanske universiteter har vi blant annet fått livreddende vaksiner, insulin, livmorhalsprøver og p-piller.
USA er også vår viktigste forskningssamarbeidspartner. Fra starten av min periode som forsknings- og høyere utdanningsminister har jeg vært opptatt av å forstå både hva som skjer med amerikanske universiteter, hva det betyr for oss, og hva vi kan gjøre i møte med det som skjer. I dette arbeidet har jeg hatt tett kontakt med norske kunnskapsmiljøer, og jeg har snakket godt med de andre nordiske forskningsministrene.
Det er i hvert fall sikkert at vi fortsatt trenger resten av verden, selv om den er mer uforutsigbar. Ja, kanskje særlig da. Norge er et lite land, og skal vi løse store samfunnsoppgaver, må vi gjøre det sammen med andre. Dersom usikkerheten om amerikansk forskning blir større, må også Norge, Norden og Europa gjøre mer. Derfor er jeg opptatt av at norske forskere må ha gode muligheter til å være koblet på internasjonale prosjekter – både i USA og resten av verden. Da må vi gjøre det lettere å samarbeide om kunnskap på tvers av landegrenser.
Denne uken kunne vi offentliggjøre at Forskningsrådet setter av inntil 100 millioner kroner til rekruttering av internasjonale forskere til norske forskningssentre. Det betyr at vi kan bygge enda sterkere forskningsmiljøer i Norge, med større internasjonale nettverk. Det betyr forhåpentlig også at vi kan fortsette gode samarbeidsprosjekter med amerikanske forskere.
I år, 200 år etter
Restauration
, er USA fortsatt viktig for oss. USA har, med alle sine utfordringer og kontraster, i århundrer strukket seg mot å være en
Å verne om denne friheten, og fortsette å bygge ny kunnskap i samarbeid med andre, er noe av det viktigste vi kan gjøre nå.",Error generating text.,no
15_25_04_2025,Ulstein med stikk til Ap: – Familien må for ofte vike for arbeidslinjen,Mathea Hallingstad Laugen,https://gfx.nrk.no/kKDaFrRpOi6f7GiF5F4-NACe5bWLetQq_G57Temn45bg,2025-04-24 09:02:53,https://www.nrk.no/norge/ulstein-med-stikk-til-regjeringen_-_-apner-dorene-for-sorteringssamfunn-1.17392114,Politics,"KrF-leder Dag Inge Ulstein åpner nå partiets landsmøte med ledertalen – knappe tre måneder etter han ble offisielt valgt som partileder.
Et tema som har vekket intern strid i KrF er foreldrepermisjonen. Skal man opprettholde inndelte kvoter slik som i dag - eller skal foreldrene få velge fritt hvordan de bruker ukene sine?
– Familienes betydning og behov er ikke på radaren til regjeringen. Det som er bra for familien må altfor ofte vike for det som er bra for arbeidslinjen.
– For eksempel den statlige detaljstyringen av foreldrepermisjonen. Det er ikke vår linje. KRF vil gi familiene mer frihet, mer tillit og vi vil fjerne den fullstendig rigide tredelingen av permisjonen.
KrF-leder Dag Inge Ulstein taler til landsmøtet. Foto: Paul S. Amundsen / NRK
Et av KrFs hjertesaker er familien, og Ulstein kommer fra talerstolen med enda et stikk til Arbeiderpartiet:
– I Arbeiderpartiets program er det heller ikke et eneste ord – om utfordring med synkende fødselsrater, og å legge til rette for at folk kan få flere barn. Ikke et ord.
Åpner for sorteringssamfunn
På talerstolen kritiserer han regjeringens abortpolitikk, som han mener «åpner dørene på vidt gap for enda mer sortering».
I desember ble det vedtatt en utvidelse av dagens selvbestemte abortgrense fra 12 til 18 uker. Den nye abortloven trer i kraft fra juni.
– Da KrF for 15 år siden advarte mot et sorteringssamfunn, ble vi beskyldt for skremselsretorikk. Men det som en gang ble kalt et skremselsbilde, er nå virkelighet: i dag blir over 90 prosent av barn som får påvist Downs syndrom nettopp sortert bort.
Politikken har sviktet elevene
Ulstein sier også at det trengs et krafttak for kvalitet i skolen. Norske elevers ferdigheter i norsk, matte og naturfag har stupt til et nordisk bunnivå, sier han.
– Her har politikken sviktet, mener Ulstein.
– Høyresiden roper på mer disiplin – ja takk, sier vi i KrF. Vi gir oss ikke før det er ro i klasserommet. Venstresiden snakker om mer praktisk undervisning – ja takk, sier vi. Alle barn må møtes med respekt for de evnene de har. Men KrFs inngang er klar: Forskjellen på en god skole, og en dårlig skole er læreren.
Nei til «splittende» EU-debatt
Partileder Ulstein beskriver tiden vi lever i som «alvorlig».
– Vi må fremskynde Langtidsplanen for Forsvaret. Vi må forenkle de militære anskaffelsesprosessene. Vi må øve mer, fylle lagrene og vi må trappe opp våpenproduksjonen i Norge.
Han peker på Nato som «bærebjelken» i norsk sikkerhetspolitikk, og mener ikke tiden er inne for å se til EU.
– I en tid som krever samling, trygghet og tydelighet, er ikke en ny splittende EU-debatt det landet vårt trenger.
KrF-ere fra hele Norge er samlet i Bergen for landsmøte. Foto: Paul S. Amundsen / NTB
Skal over sperregrensa
Fra talerstolen har Ulstein et tydelig budskap:
– Vi skal over sperregrensa! For vi skal bidra til et nytt flertall og en ny regjering.
På NRKs meningsmåling i april fikk KrF 3,2 prosent oppslutning. Dette plasserte dem under sperregrensen i Norge på 4 prosent.
– Du vet, for bergensere er Bergen ikke bare en by. Det er verdens navle. Planetens toppunkt. Punktum, sier Dag Inge Ulstein fra podiet.
Bevæpning, foreldreperm og kvoteflyktninger
Denne gangen samles partiet på Flesland i Bergen, for å vedta ny politikk de neste tre dagene.
Viktige saker som står på agendaen er:
Om partiet skal gå inn for generell bevæpning eller ikke.
Foreldrepermisjonen – skal foreldrene kunne velge fritt hvem som skal ta ut permisjonen?
Kvoteflyktninger – hvor mange skal Norge ta imot?",Error generating text.,no
