aid,title,author,image_url,published_date,article_url,category,raw_text,text,is_manipulated
8_09_04_2025,Knappest mulig Støre-flertall: Målfoto,Lars Nehru Sand,https://gfx.nrk.no/nxDKn81munRcYWeVZuDgQg7uLX5FEfLxbg1VHlFcH-xA.jpg,2025-04-08 15:59:30,https://www.nrk.no/ytring/knappest-mulig-store-flertall_-malfoto-1.17374951,Politics,"Valg
Siste meningsmåling
Arbeiderpartiet justeres litt ned etter jubellandsmøtet, mens Sp går frem. Frp er fortsatt større enn Høyre, men avstanden minker. Det mest spennende er at det er dødt løp mellom blokkene med MDGs mandater på vippen.
Meningsmåling april 2025 Hvordan ville Norge stemt?
Vis i tillegg
Forrige måling
Valget i 2021
Feilmargin Partioppslutning
Parti Oppslutning
Endring
27,9 %
−2,2
21,0 %
−1,9
18,9 %
+0,8
7,2 %
+2,2
6,3 %
−0,1
3,8 %
−0,6
3,7 %
−0,8
3,3 %
+0,8
3,2 %
+0,6
Vis flere partier
Partimåling fra Norstat for april 2025 med 994 spurte. Viser endring fra meningsmåling i mars.
Høyre stabiliserer seg etter siste måneders uro.
Både Støre og Solberg spiller aktivt på sin erfaring med å styre Norge i krevende tider.
Trygghetsbudskapet har preget landsmøtetalene, politiske vedtak og medieutspill fra de to helt siden før Donald Trump ble innsatt som amerikansk president.
Rundt årsskiftet var velgerne opptatt av trygghet for sin egen personlige økonomi og et grovere kriminalitetsbilde. Nå har tollkrig og Trumps trussel-diplomati satt internasjonal trygghet på dagsorden.
De to partiene og deres ledere kan høste en politisk gevinst av at det råder en viss krisestemning. Hvis velgerne ikke er moden for nye eksperimenter eller brå skifter, tjener det de to store partienes vektlegging av egen styringsevne, lange linjer og stabilitet.
Høyre har falt fra sitt svært høye nivå over 30 prosent for snart to år siden, til et stabilt nivå rundt 18 prosent de siste tre månedene. Lekkasje av velgere til sine to hovedkonkurrenter Frp og Ap gjør at partiet ikke løfter seg. Et valgresultat som denne målingen ville vært lavere enn valgnederlaget i 2021.
Aps nåværende og tidligere statsminister snakker ofte om trygg styring. Politikerne vil fortelle oss at de er til å stole på og vil oss og landet det beste. Det blir et stadig viktigere budskap. Foto: Amanda Pedersen Giske / NTB
For Aps del kan denne målingen danne et inntrykk av at toppen er nådd, men partiet er ikke nødvendigvis fullmobilisert. Det viktigste for Ap er at partiet de siste tre månedene i snitt har 28,9 prosent på Norstat-målingene mot 17,9 prosent i snitt de tre siste månedene i fjor.
Senterpartiet går frem på denne målingen, eneste endring som er statistisk gyldig fra forrige måling. EU-vedtak hos ja-partier og ikke minst dem selv, har gitt partiet mer synlighet enn noe annet siden regjerings-exiten.
Skjøre og krevende flertall
I norske valgkamper har regjeringsalternativene, deres styringsevne og stabilitet stor betydning. Det handler ikke om hvem som skal leke med hvem, men også om hva slags politikk som vil få flertall og hvilke dragkampene som blir viktigst.
Når styring fremstilles som viktig, er det paradoksalt at flertallene er så skjøre.
«Jonas mot Erna» kan høres ut som en reprise av noe vi kjenner. Men situasjonen i høst vil uansett bli ny:
Høyre er ikke største parti på borgerlig side i denne målingen. Frp har vært større enn Høyre i seks måneder på rad, men avstanden er mindre enn noen gang tidligere i år. I Solberg-regjeringen i 2013, var Høyre 10 prosentpoeng større enn Frp.
I år blir styrkeforholdet, og dermed politiske gjennomslag, annerledes.
Frp er tre ganger så store som summen av Venstre og KrF på denne målingen.
De tre rødgrønne partiene som prøvde å danne flertallsregjering i 2021, er nå fire mandater og to støttepartier unna flertall.
Interne forskyvninger
Dette viser for alvor at bevegelsene internt i de to hovedblokkene er vel så interessante som bevegelsen mellom dem. De store partiene vokser i stor grad på bekostning av sine venner.
Særlig ser vi det med Aps vekst:
Arbeiderpartiet henter 88.000 velgere fra andre partier som ikke vil sette inn Solberg som statsminister.
Støre mister derimot 30.000 velgere til Frp.
De 20.000 velgerne han henter fra Høyre har dermed mindre effekt mellom blokkene.
For Høyres del er det dumt at antallet velgere som forsvinner til Støre er høyere og økende, men Høyre mister hele 80.000 velgere til Frp, internt på borgerlig side.
At Ap begynner å ta velgere fra Høyre, fremfor å miste til dem er en stor endring sammenlignet med før Sp gikk ut av regjering i slutten av januar.
Flertall på Stortinget Antall stortingspolitikere Antall politikere per parti
Parti Endring Venstresiden: 85
-7
-1
7
-14
0
Høyresiden: 84
0
-5
1
20
Viser hvor mange politikere partiene ligger an til å få valgt inn på Stortinget ifølge NRKs partimåling april 2025. Sammenlignet med hvor mange partiene fikk inn ved valget høsten 2021.
Sperregrensedrama
Kampen innad i hver blokk gir liv til ekstra dramatikk rundt sperregrensen. De små mister til de store.
Både Venstre, KrF, MDG og Rødt er under sperregrensen på denne målingen. Kampen om å oppnå mer enn 4 prosent oppslutning for å få 7 mandater fremfor 1–3 er sentralt for både enkeltpartiene og å vippe makten i den ene statsministerkandidatens favør.
KrF og MDG har over tid vært under sperregrensen, mens Venstre og Rødt har vært over.
Rødt velgerne setter seg i økende grad på gjerdet, mens Venstre-velgerne går til andre partier i tillegg til at Venstre i mindre grad henter fra rødgrønn side.
Listhaug er fortsatt storesøster på borgerlig side, men avstanden til Erna Solbergs mindre enn på lenge. Foto: William Jobling, NRK
Jonas Gahr Styring
Det er MDG som vipper makten. Så sent som i fjor ville det tradisjonelt blokkuavhengige MDG ikke peke på én bestemt statsministerkandidat, men i februar snudde partiet. Nå vil partiet først forhandle med venstresiden i en erkjennelse av at avstanden til Frp er stor.
Uansett valgresultat: Jonas Gahr Støre leder en ettpartiregjering for Ap. Han må ikke forhandle frem en eneste regjeringsplattform med noen som helst.
Hans foretrukne alternativ er en flertallsregjering utgått av Ap, Sp og SV.
Mange i Ap drømmer seg tilbake til en rødgrønn flertallsregjering med et betydelig større Ap enn ved forrige valg. Her fra Stoltenbergs regjeringsforhandlinger med Sp-leder Åslaug Haga og SV-leder Kristin Halvorsen i 2005. Foto: NTB
Denne målingen viser at det kan bli enklere i høst enn det var i 2021.
I Ap viser man tilbake til 2005 og Stoltenbergs første regjeringssamarbeid. Ap var dobbelt så store som summen av SV og Sp. Dermed var kjøttvekta enklere enn i 2021 da Sp skaffet Støre et flertall.
Som på borgerlig side: Høyre og Ap har det til felles at kjøttvekta var enklere før.
Uten trepartiflertall, kan Ap måtte forholde seg til Sp, SV, Rødt og MDG. Det kan det fort bli for mye av det gode.
Da kan dagens regjering fortsette. Den vil ikke bli kastet av et flertall på Stortinget. De fem (!) partiene må bli enige om statsbudsjettet hvert år. Det kan bli krevende nok.
Frem til høstens valg kan regjeringen tåle noen nederlag, skjule noen nederlag ved å stemme for noe man egentlig er imot, og ikke minst la være å fremme saker for stortinget.
I én hel periode blir det umulig. Da vil ettpartiregjeringen få det tøffere.
Arbeiderpartiets landsmøte var en oppvisning i å fremstå som et styringsparti.
Regjeringen fikk forankret sine viktige saker og krevende krav fra grasrota effektivt stoppet.
Det ble aldri uttrykt direkte, men Ap er rede til å lede landet alene også i fortsettelsen.
Dødt løp
Med ett mandats overvekt viser målingen først og fremst at det er dødt løp mellom blokkene. Små velgerbevegelser vil avgjøre om flertallet blir rødt eller blått.
Uansett ser det ut til at den som vinner vil få en krevende jobb med å styre trygt og forutsigbart.",Error generating text.,no
15_09_04_2025,Verdig og vakkert – og langt på overtid,Journalist,https://www.dagsavisen.no/resizer/v2/EYS2CFV6WBD3VKXEEILJPOG2UA.jpg?smart=true&auth=f98e4cbeef31aa97d1f661540167bd78ec713d4eaf3792c9eed9b1673fd4e3b2&width=1200&height=630,2025-04-08 13:13:01,https://www.dagsavisen.no/debatt/kommentar/2025/04/08/verdig-og-vakkert-og-langt-pa-overtid,Politikk,"Det er snart 14 år siden hendelsen som forandret Norge for alltid. 14 år siden den høyreradikale Anders Behring Breivik først sprengte en bilbombe i regjeringskvartalet i sentrum av Oslo, og siden kjørte de 37,5 kilometerne til Utøya, der han drepte 69 mennesker. Brorparten av de døde var barn og unge, som ifølge den skrudde logikken som fortsatt herjer i mørke kroker på internett hadde gjort seg skyldige i forbrytelsen å være sosialdemokrater og å kjempe for en bedre framtid.
22. juli var en tragedie. Men det var også politikk, øyeblikket som reiv oss ut av naiviteten, som fikk nasjonen til å innse at det finnes farer der ute – og her hjemme.
Terroristens villfarelser ble ikke nedkjempet i årene som fulgte 22. juli. De kom stadig nærmere den politiske mainstreamen.
Vi lovte oss selv at vi skulle lære. Vi skulle ikke lenger være naive, vi skulle slå tilbake – på vårt vis. Med rosetog og mer demokrati, mer frihet. Og vi har gjort en god del rett på de 14 årene som har gått. Det norske demokratiet er fortsatt sterkt og levedyktig. Vi lot oss ikke knekke, og i dag sitter mange av ungdommene som overlevde marerittet på Utøya i viktige posisjoner i det norske samfunnet. Det skal vi være stolte av.
Vi besto deler av testen. Men vi har også gjort mye galt.
Denne uka ble det kjent hvem som skal få lage nasjonalt minnested etter 22. juli-terroren i regjeringskvartalet. Vinneren av konkurransen ble bildekunstner og forfatter Matias Faldbakken og hans verk «En opprettholdelse». Verket er en torgskulptur bygd på stålriggen som ble brukt til å flytte Pablo Picassos «Fiskerne» fra den revne Y-blokka i regjeringskvartalet, som skal fylles med en mosaikk med en tegning av en vadefugl som speiler seg i Tyrifjorden.
Les også:
Arktis er ikke «no man's land»
, skriver Hedda Langemyr
Når stålriggen fylles med et motiv hentet fra Utøya og Tyrifjorden, knyttes de to stedene terroristen rammet den fatale dagen sammen. Oslo skal med dette få et nytt byrom, heter det i juryens begrunnelse, «en stor og åpen plass med rom for seremonier og minnehandlinger». Faldbakken selv forteller at «riggen skal oppleves som stor og insisterende, og den enorme vekten må svare til vekten denne hendelsen har hatt i Norge».
Både juryens begrunnelse og Faldbakkens egen beskrivelse lover godt. Det blir helt sikkert et flott monument. Jeg klarer likevel ikke bli kvitt den tanken som har bitt seg fast et sted bak i hodet, i form av et spørsmål:
Hvorfor har dette tatt så lang tid?
«Dette» i betydningen alt eller det meste som har skjedd etter 22. juli. Barn født etter den vondeste dagen kan fylle 14 år i år. De har levd livet sitt i et annet Norge enn det vi eldre kjente før det utenkelige skjedde. Mine egne barn har gått fra å kjenne Anders Behring Breivik som «han slemme mannen med bomba» til å nå skjønne mer om den høyreradikale terroristen.
Les også:
Jeg elsker Teslaen min. Og jeg hater den. Men bør jeg skamme meg over den?
14 lange år etterpå er regjeringskvartalet fortsatt en byggeplass. Og minnestedene, monumentene som skal sørge for at vi aldri glemmer, er enten midlertidige, ikke ferdigstilte, eller sterkt minimerte av ulike hensyn og årsaker. Det er noe nesten uverdig over at det nå snakkes om at Matias Faldbakkens «En opprettholdelse» planlegges ferdigstilt neste sommer. Da vil det ha gått 15 år siden terroren. Det er 15 år uten et endelig monument til minne om en av de mest avgjørende og dramatiske dagene i nasjonens historie.
Vi har tapt mye på de 14 årene som har gått. Lenge ble AUF og Arbeiderpartiet anklaget for å trekke Utøya-kortet når de ønsket en bedre og dypere nasjonal samtale om årsakene og bakgrunnen for angrepet 22. juli. Du har lest det før, men det er likevel greit å lese det enda en gang:
Offeret ble anklaget for å politisere tragedien
. Anklagen kom også fra folk langt inne på «den anstendige høyresiden».
Stikk i strid med det vi antok ettersom vi lærte mer om terroristen, ble ikke de høyreradikale villfarelsene hans nedkjempet i årene som fulgte. Det ble motsatt: Villfarelsene kom stadig nærmere den politiske
mainstreamen
. I dag er Ukraina voldtatt av mye av det samme tankegodset, og frihetens høyborg USA styrt av folk som tangerer det. Ytre høyre stormer fram. Den som trodde fascismen var et tilbakelagt stadium har måttet lære seg å tenke nytt på de 14 årene som er gått.
Les også:
Driver Donald Trump egentlig med økonomi?
Litt på siden, men likevel ikke, lider også regjeringskvartalet som en gang skal stå ferdig av samme forsinkelse. Den sikkerhetspolitiske tankegangen er allerede delvis avleggs. Nå er det ikke fascistiske bilbomber vi burde frykte. Neste gang kommer trolig angrepet – fortsatt i fascistisk støpning – fra lufta, i form av droner. Da hjelper det lite å bruke år og milliarder på å grave ned en tunnel som utgjør en viktig del av hovedstadens transportårer.
Meningen er selvsagt ikke å antyde at et minnesmerke, et monument – eller raskere ferdigstillelse av regjeringskvartalet, for den saks skyld – ville gjøre Norge bedre rustet til å håndtere den eskalerende brutaliseringen av verden og samfunnet vårt. Det ville være en søkt påstand.
Jeg blir likevel ikke kvitt tanken på at denne sendrektigheten, denne evige utsettelsen av avgjørelser og byggetillatelser, forteller oss et eller annet om måte vi forholder oss til 22. juli på, og alt det vonde og farlige som har fulgt etterpå. Det er en slags berøringsangst der, både overfor den mørke dagen selv og i forholdet til hvordan vi som samfunn, i demokratisk fellesskap, skal forholde oss til de truslene vi står overfor.
Nå får vi endelig definitivt minnested et 22. juli. Det blir nok verdig og vakkert. Men spørsmålene står fortsatt igjen: Hvorfor har det tatt så lang tid å komme hit, og hva har vi tapt på veien?
Les flere kommentarer av Jo Moen Bredeveien
Hold deg oppdatert. Få daglig nyhetsbrev fra Dagsavisen",Error generating text.,yes
11_09_04_2025,Forhastet digitalt eksperiment truer fastlegeordningen,Anne-Karin Rime,https://www.dagsavisen.no/resizer/v2/SJXX2Y6SM5HKFHABPVZCJE7Q74.jpg?smart=true&auth=b0ddfe9ea4f4ba88dbbc33eb10b724486cc1d316b5731e43660053c52d2046dd&width=1200&height=630,2025-04-08 14:27:39,https://www.dagsavisen.no/debatt/2025/04/08/forhastet-digitalt-eksperiment-truer-fastlegeordningen,Politikk,"I jakten på raske løsninger foreslår regjeringen en prøveordning med digitale allmennlegetjenester utenfor fastlegeordningen.
Resultatet vil bli dårligere kvalitet, feilslått ressursbruk – og en svekket helsetjeneste.
Et pilotprosjekt med digitale allmennlegetjenester, også kalt «E-legen», skal i første omgang skje i noen utvalgte kommuner. Basert på erfaringer fra disse skal videre utrulling vurderes.
Vi er kritiske og tydelige: Dette forslaget svekker selve fundamentet for hva som er god allmennmedisin.
Fastlegeordningen er tuftet på kontinuitet. Det betyr at legen kjenner deg, historikken din og kan følge deg opp over tid.
Dette er ikke bare en hyggelig bonus. Det gir bedre behandling, færre feil og mer målrettet bruk av helseressurser.
Leger vil trekkes bort fra fastlegekontorene og legevaktene.
Den digitale tjenesten regjeringen foreslår, vil i stor grad benytte leger som ikke har tilgang til pasientjournalene eller tidligere vurderinger. Da må de starte på nytt – hver gang.
Det gir risiko for feilvurderinger, unødvendige undersøkelser, overdiagnostikk og overbehandling.
I resten av helsetjenesten er vi svært opptatt av at pasientinformasjon deles, og at helsepersonell har god kjennskap til pasientene. Hvorfor skal dette kastes på båten når det kommer til digitale tjenester?
Helseminister Jan Christian Vestre hevder tiltaket skal avlaste fastleger og legevakter. Men erfaring og forskning tilsier det stikk motsatte.
Økt tilgjengelighet skaper økt etterspørsel. Når terskelen for å kontakte lege blir lavere, øker også antallet henvendelser som ikke nødvendigvis trengs.
Digitalt tilgjengelige leger, uten pasientkjennskap, vil i tillegg bruke mer tid og flere ressurser per konsultasjon.
Det fører til flere prøver, flere henvisninger, flere kontakter med primærhelsetjenesten og flere henvisninger til spesialisthelsetjenesten – uten at det nødvendigvis gir pasienten bedre helse.
Regjeringen satte selv ned en helsepersonellkommisjon fordi vi er på vei inn i en bemanningskrise. Dette aktuelle tiltaket vil bli en ny tjeneste som vil kreve flere leger og gi økte kostnader.
Tiltaket går derfor på tvers av regjeringens politikk hittil.
I tillegg er digitale vurderinger vanskelige, og de krever høy allmennmedisinsk kompetanse. Men dette er kompetanse vi har behov for i fastlegeordningen og på legevakt – ikke i en ny parallell tjeneste.
Forslaget vil derfor ikke avlaste fastlegene – det vil forsterke utfordringene i fastlegeordningen.
Leger vil trekkes bort fra fastlegekontorene og legevaktene, og innsatsen vil i stedet brukes på enkeltkonsultasjoner uten pasientkjennskap eller oppfølging.
Vi kan ikke gamble med kjernen i god allmennmedisin.
Konsekvensen vil bli at enda flere mister fastlegen sin, og at kontinuiteten og kvaliteten i helsetjenesten svekkes ytterligere.
Fastlegeordningen er ikke perfekt. Den må utvikles og forbedres, og digitalisering er en viktig del av løsningen. Riktig brukt kan digitale verktøy gjøre både fastlegeordningen og legevakten mer tilgjengelig og forutsigbar for pasientene.
Men innovasjon må være målrettet – og styrke det som allerede fungerer. I stedet blir verdifulle ressurser nå trukket bort fra forbedringer i fastlegeordningen for å bygge opp et nytt dårlig system.
Norsk helsenett har allerede varslet at arbeidet med å styrke den digitale kontakten mellom fastlege og pasient blir forsinket fordi de må prioritere utviklingen av den nye digitale tjenesten regjeringen ønsker å utprøve.
Det er uheldig og hodeløst at regjeringens pilot kommer til å gå på bekostning av nødvendig innovasjon i fastlegeordningen.
Regjeringens forslag er ikke utredet og mangler en helhetlig vurdering av konsekvensene. Vi forstår behovet for innovasjon, men vi kan ikke gamble med kjernen i god allmennmedisin.
Fastlegeordningen må styrkes – ikke fragmenteres og undergraves.
Vi ber derfor regjeringen legge dette lite gjennomtenkte forslaget tilbake i skuffen, og heller rette innsatsen der den virkelig trengs: Flere fastleger, bedre arbeidsforhold og et mer robust førstelinjetilbud.
For det er dette som vil ivareta befolkningens behov for kontinuitet og trygghet – og ikke minst sikre flest mulig best mulig helse.
Les også: Bernard Minier:
– Det er uendelig mye elendig skit på strømmetjenestene
(+)
Les også:
Hedvig Montgomery: – Det lager problemer når foreldre snoker på barna sine
(+)
Les også:
– Vi har vært fiskere så lenge jeg vet, i alle fall mer enn hundre år
(+)",Error generating text.,yes
29_09_04_2025,– Du er liksom allerede gitt opp ved diagnose,Karl Kristian Bekeng,https://akamai.vgc.no/v2/images/3e92aa1a-6e8c-4f2a-b393-2a888b9e0c90?format=auto&w=1080&s=4f81b0a99d6b979bdd1d8d2c77b68b9a79969432,2025-04-08 10:59:52,https://www.vg.no/helse/i/nyK7QQ/bukspyttkjertelkreft-krever-svar-fra-regjeringen,Health,"Flere dør av bukspyttkjertelkreft enn brystkreft i Norge. Pasient Thomas Lillebror Finne ønsker en handlingsplan fra regjeringen.
Nå
Kortversjonen
Flere dør av bukspyttkjertelkreft enn brystkreft i Norge. Dette får pasienter og politikere til å kreve handling.
Kreftsyke Thomas Lillebror Finne ønsker økt fokus på forskning før han går bort.
Regjeringens kreftstrategi får kritikk for å mangle konkrete tiltak mot denne krefttypen.
Vis mer
I helgen skrev VG om familiefaren Thomas Lillebror Finne, som har bukspyttkjertelkreft.
Han har de siste 18 månedene kjempet for livet, en kamp som – om ikke det skjer noe ekstraordinært – er tapt.
Nå etterlyser Finne mer fokus på det som er en av de dødeligste kreftformene i Norge i dag.
– Det føles som du er en i rekken som skal gjennom en dødstunnel og få behandling som tar smerten på veien. Du er liksom allerede gitt opp ved diagnose, sier han.
Finne er blant tusen nordmenn som årlig blir rammet av bukspyttkjertelkreft.
Like mange dør av den.
– Jeg har avfunnet meg med min situasjon, men før jeg går ut av tiden vil jeg sette fokus på dette slik at de som kommer etter meg kan få et medisinsk gjennombrudd, sier han.
Tolv år med stillstand
Det har ikke vært forskningsgjennombrudd på behandling av bukspyttkjertelkreft siden 2013, forteller Arne Westgaard, overlege på Oslo universitetssykehus, til VG.
Dette er kritisk med tanke på den høye dødeligheten.
– Denne kreftformen er svært alvorlig og utfordrende å behandle. Mange rekker ikke engang å få diagnosen før de dør. Det er nok også noe av grunnen til at det er forsket forholdsmessig lite på dette sammenlignet med andre kreftformer, sier han.
Ofte har kreftformen spredt seg før den oppdages. Hvis man ser på alle som får bukspyttkjertelkreft under ett, er median levetid rundt tre til fire måneder.
Det trengs et strategisk løft for å sikre flere studier og bedre tilgang for pasientene i Norge, mener Westgaard.
Han tror manglende fokus på bukspyttkjertelkreft skyldes at denne typen kreft ikke er så hyppig som for eksempel bryst- eller tarmkreft.
– Men den er mye mer dødelig. Det er stort tap av liv, sier han.
Om bukspyttkjertelkreft
Kilder: Helsenorge, FHI, Kreftforeningen
Bukspyttkjertelkreft, også kjent som pankreaskreft, er en alvorlig sykdom som ofte oppdages sent på grunn av få og diffuse symptomer.
Symptomer kan inkludere:
Behandling avhenger av sykdommens stadium og kan omfatte kirurgi, cellegift og strålebehandling. Dessverre er prognosen ofte dårlig, da sykdommen ofte oppdages sent.
I 2023 ble det registrert 968 nye tilfeller av bukspyttkjertelkreft i Norge, med 461 menn og 507 kvinner diagnostisert.
Fem år etter diagnosen er overlevelsesraten cirka 15 prosent. Tidlig oppdagelse gir bedre prognose, men kun en liten andel av tilfellene oppdages på et tidlig stadium.
Forebyggende tiltak inkluderer å unngå tobakksbruk, opprettholde en sunn kroppsvekt og begrense alkoholforbruket.
Vis mer
Ny norsk kreftstrategi
I februar lanserte regjeringen en ny kreftstrategi for de neste ti årene.
I den står det at mange med kreft lever lenger og med høyere livskvalitet enn tidligere, men også at det for enkelte kreftformer har vært få behandlingsmessige gjennombrudd.
Bukspyttkjertelkreft nevnes som en av disse.
– Men så står det ingenting mer om hva de har tenkt å gjøre med dette. Det vil jeg gjerne ha konkretisert, hva er strategien i kreftstrategien? spør kreftsyke Finne.
Han er ikke den eneste som etterlyser dette.
Etter å ha møtt Finne på Stortinget, sendte KrFs leder Dag-Inge Ulstein et brev til helse- og omsorgsministeren.
– Tiden er ikke på vår side her. Bukspyttkjertelkreft har høy dødelighet, likevel er forskning og klinisk utprøving sterkt underfinansiert. Jeg ønsker å utfordre helseministeren på dette, sier Ulstein.
Han har bedt helseministeren begrunne hvorfor regjeringen ikke har inkludert bukspyttkjertelkreft i den nye kreftstrategien.
– Vil regjeringen sikre økte ressurser til forskning, bedre klinisk utprøving og en styrket oppfølging av familiene til disse pasientene? Det vil vi ha svar på, sier partilederen.
«Får den behandling det er mulig å gi»
Den 31. mars besvarte helseminister Jan Christian Vestre Ulsteins spørsmål.
Han presiserer at kreftstrategien har langsiktige mål for å forebygge kreft, forbedre behandling og sikre bedre livskvalitet for pasienter og pårørende.
Han skriver også at det hvert år øremerkes midler til helseforskning, men at det ikke kan legges føringer for hvilke sykdommer eller behandlingsmetoder det skal forskes på.
Her er det de forskningsprosjektene som vurderes å ha høyest kvalitet – og som er mest relevante – som får finansiering, skriver han.
VG har også spurt statssekretær Karl Kristian Bekeng hva regjeringen tenker om statusen til bukspyttkjertelkreft i Norge i dag:
– Norske pasienter får den behandling det er mulig å gi. Hovedproblemet for kreftformer med høy dødelighet er at eksisterende behandlingsmetoder har begrenset effekt. Dette er et problem i alle land, også i Norge.
Han sier videre at norske myndigheter vanskelig kan vedta at det skal utvikles behandling for én bestemt kreftform, når vi ikke vet hva denne behandlingen skal bestå av.
På spørsmål om hva regjeringen vil gjøre for å sikre at også de med bukspyttkjertelkreft får en reell sjanse til å overleve, henviser Bekeng til den nye kreftstrategien. Gjennom 17 tiårsmål setter denne søkelys på nye initiativer som skal tas de neste årene, på tvers av ulike krefttyper.
– Et av disse initiativene er at alle med kreft skal få tilbud om gentest, når det er relevant for behandlingsvalget. Dette vil også gjelde pasienter med pankreaskreft, sier han.
Disse svarene gjør ikke Finne mer rolig.
– Bukspyttkjertelkreft har vært den glemte kreftformen. Nå er det den oppgitte. Om ti år håper jeg det igjen er den glemte kreftformen – fordi den da er utryddet, sier han.",Error generating text.,no
