aid,title,author,image_url,published_date,article_url,category,raw_text,text,is_manipulated
21_07_04_2025,Sjeføkonom: Norge gjør lurt i å avvente tollforhandlinger,Journalist,https://www.tu.no/_neste/ogTU.png,2025-04-06 22:20:00,https://www.tu.no/nyhetsstudio/sjefoekonom-norge-gjoer-lurt-i-aa-avvente-tollforhandlinger/75546,Økonomi og næringsliv,"Flere land har gått i tollforhandlinger med USA og Donald Trump. Norge gjør lurt i å avvente, mener sjeføkonom, som sier den kommende uka vil gi flere svar.
USAs president Donald Trump og hans drastiske tolløkninger sendte før helgen sjokkbølger gjennom aksjemarkeder over hele verden.
Spillereglene i verdenshandelen er i ferd med å endres med «Trumpomania», sier sjeføkonom Kyrre M. Knudsen i Sparebank 1 Sør-Norge.
– Vi er ekstra spente på hvor lenge Trump vil fortsette med politikkendring som minner mer om selvskading enn riktig dreining av den amerikanske økonomien, sier han til NTB.
Flere land i forhandlinger
Over 50 land har slengt seg på telefonen for å forhandle om tollkutt med USA, ifølge Det hvite hus.
Uken vi har foran oss, vil gi flere svar på hvordan de kommende tollforhandlingene vil bli, sier han.
– Hvor langt ønsker Trump å strekke strikken med fare for å ødelegge for folk og bedrifter i USA? Hvordan vil de respektive land reagere: vil de svare med økte tollsatser eller vil de gå i forhandlinger, sier Knudsen.
– Lurt å avvente
Land som Taiwan og Zimbabwe vil fjerne all toll på amerikanske varer. Vietnam har bedt USA innstendig om å utsette toll på import fra landet.
– Norge gjør nok lurt i å avvente, særlig fordi det er hvordan EU rammes som betyr mest for norsk økonomi. Responsen fra EU får vi vite mer om denne uken, sier Knudsen.
– Trolig er det mer å hente på konstruktive og smarte forhandlinger enn å respondere med økte tollsatser. Jeg håper derfor vi denne uken vil se at EU gir signaler om at de er klare for forhandlinger. I så måte var det et interessant oppspark fra Elon Musk i helgen hvor han sa at han ønsket seg tollfri handel mellom USA og Europa.
Vil avklare tollsatsene mot Norge
Utenriksdepartementet er i løpende kontakt med amerikanske myndigheter om USAs tollsatser mot Norge, sier utenriksminister Espen Barth Eide til Dagens Næringsliv søndag.
– Vi jobber blant annet med å avklare hvilken tollsats som gjelder for norske varer, og andre spørsmål for avklaring, sier Eide.
– Vårt budskap er fortsatt at slike tollsatser er en dårlig idé. Ingen land er tjent med handelskrig og økte tollmurer. Alle land taper på handelskonflikt. Vi ønsker å redusere toll mot Norge, og derfor vil vi nå koordinere videre oppfølgning med våre nærmeste handelspartnere, understreker Eide.
Kraftige børsfall
Fredag raste Oslo Børs ned 5 prosent, det største fallet siden mars 2020 da pandemien stengte ned landet.
På børsene i New York var det nye kraftige fall fredag, og indeksen S&P 500 stupte 6 prosent. Dax-indeksen i Tyskland og FTSE 100 i London falt begge rundt 5 prosent.
I København stupte indeksen C25 6,2 prosent, og fallet her var det nest største siden indeksen ble etablert i 2017.",Error generating text.,no
31_07_04_2025,Penger å spare – men det er ikke så lurt,Bjørn Eirik Loftås,https://www.cdn.tv2.no/images?imageId=17616406&x=0&y=0&cropw=100&croph=100&panox=0&panoy=0&panow=100&panoh=100&width=1200&height=630,2025-04-06 15:18:00,https://www.tv2.no/broom/penger-a-spare-men-det-er-ikke-sa-lurt/17616201,Sport,"NAF har nettopp publisert sin årlige test av sommerdekk, og nok en gang er det premiumdekk fra kjente produsenter som får best skussmål.
Aller best ut kommer dekkene Michelin Pilot Sport 4 SUV og Nokian Hakka Black 3 SilentDrive – begge med 86 av 100 mulige poeng.
Billigdekk på bunn
I andre enden av skalaen finner vi lavbudsjettdekket Hifly Vigorous HP801 fra kinesiske Shandong Hengfeng, som scorer kun 54 poeng.
Dekket får blant annet sterk kritikk for at det ikke klarer å opprettholde kontrollen i brå svinger. Ifølge juryen er dekket totalt uegnet for tunge kjøretøy, som for eksempel elbiler.
– Det er helt klart stor kvalitetsforskjell mellom premiumdekk og billigdekk, sier senior kommunikasjonsrådgiver Nils Sødal hos NAF, til Broom.
Typiske problemer er dårlig veigrep og lange bremselengder – begge deler er kritiske egenskaper for bildekk.
– Noen av dem er greie på våt asfalt, men skikkelig dårlige på tørr asfalt, mens andre billige dekk er motsatt at de fungerer greit på tørr asfalt, men mister veigrep og vannplaner lett på våt asfalt. De takler rett og slett ikke alle underlag, sier Sødal.
Trenger ikke å kjøpe de dyreste
Samtidig understreker han at du ikke nødvendigvis må kjøpe de dyreste dekkene for å være trygg på veien.
– Det finnes dekk mellom de dyreste og billigste som er gode dekk. Uansett er det viktig å tenke sikkerhet ved dekkvalg. Dekkene er eneste kontakten bilen har med underlaget, og da må de være av god kvalitet, undertreker han.
Advarer mot spesialdekk
Ofte er det dekk fra de anerkjente produsentene som scorer best i tester, men det er ikke alltid en garanti.
– Det var et billigdekk som kom dårligst ut i år, men spesialdekkene var jammen heller ikke mye bedre, sier Sødal.
Dekkene han sikter til er såkalte miljødekk eller økodekk, som ofte er spesiallaget for elbiler. De har lav rullemotstand og sørger for god rekkevidde, men har lavere dekkmønster og presterer dermed dårligere på blant annet veigrep og oppbremsing på våt asfalt.
– Det er viktig å tenke på hvordan føreforholdene er der du kjører mest i hverdagen. Selv om dette er viktigere for vinterdekk, gjelder det også for sommerdekk. Bor du i et område med mye regn, er det viktig at dekkene er gode på våt asfalt og ikke vannplaner. De beste dekkene takler riktignok både tørr og våt asfalt bra, avslutter han.
Få også med deg denne:",Error generating text.,no
16_07_04_2025,Er det egentlig økonomi han driver med?,Journalist,https://www.dagsavisen.no/resizer/v2/FIIFWL346NBFFBFFKH5AKX3L4A.jpg?smart=true&auth=8047b09da17b7fcd2196fa43c4a68113df723be2e64ade4c9c6bbf7470df353d&width=1200&height=630,2025-04-06 11:17:09,https://www.dagsavisen.no/debatt/kommentar/2025/04/06/er-det-egentlig-okonomi-han-driver-med,Politikk,"Resten av verden driver og venner seg til all den nye økonomiske politikken som kommer fra den oransje mannen i Det hvite huset. Nesten daglig. Hva er det han driver med? Hva vil han oppnå?
Hvorfor driver han med aktiv selvskading på denne måten?
Det siste spørsmålet stilles av økonomer som kan regne og som er svært tydelige på at tollene Donald Trump innfører ikke gir noen som helst mening i økonomisk forstand. De er kostbare og hemmende for økonomisk utvikling. Både i USA og i resten av verden.
Nei, noe forsøk å forhandle fram økonomisk, optimale handelsavtaler er dette ikke.
USA har ført økonomisk klasse-politikk i mange år. Det har ikke vært til arbeiderklassens gunst, for å si det pent. Investeringer har vokst i verdi drevet av lave renter og økning i pengemengden. Samtidig har amerikanske lønninger stått stille, holdt nede av den giftige kombinasjonen av globalisert produksjon og handel uten kollektive lønnsforhandlinger. Kaka har blitt mye større, men de minste bitene har blitt mindre.
Les også:
USA-ekspert: – Elon Musk gjorde dødssynden
Det er ingen som tror at de millionene av
«blue collar jobs»
som har forsvunnet fra det som i dag kalles «Rustbeltet» kommer tilbake. Den produksjonen som eventuelt kommer, vil komme i form av sterile, sterkt automatiserte fabrikker med relativt få ansatte med relativt høy utdanning. Bra for investorene, men neppe noe som vil forbedre livene til millioner av skuffede arbeiderklassefolk på den amerikanske landsbygda.
USAs egne aksjebørser er nådeløse i sin dom. Milliardverdier er borte på kort tid. Kanskje den eneste formen for tilbakemelding som gjør inntrykk på den dynamiske duo Trump og Musk i Washington.
Elon Musk og Donald Trump, her fra mars i år.
(Brendan Smialowski/AFP)
Så hva er det de driver med der borte?
Mest av alt ligner det på klassisk mafiataktikk. Den kan være svært effektiv. En tradisjonell mafiaboss som ønsker å erobre et område begynner med å statuere et eksempel. Brenn ned en restaurant eller noe.
Les også:
Støre-opprørerne hadde helt rett. Det måtte endring til
Da blir de andre som driver restaurant mer forhandlingsvillige. Da kan mafiabossen kreve lojalitet fra dem i form av beskyttelsespenger. En ekstra skatt om du vil. Eller avgift. Men også mafiaen har utviklet seg med tiden. Moderne mafia bruker nesten ikke åpenlys vold. Økonomisk press og trusler er mer effektivt og lønnsomt. Særlig i kombinasjon med beskyttelse og økonomisk støtte(!).
Det har vært et sivilisasjonsprosjekt, i hvert fall for vestlige demokratier, å redusere effektiviteten av slik taktikk til fordel for mer forutsigbare avtaleregimer.
Det kan kanskje være en del av grunnen til at svarene på denne nye politikken varierer i tid og omfang.
Les også:
Jonas lyste opp på Ap-landsmøtet
, skriver Kjell Werner
Det er også en del forvirring (eventuelt så er det en bevisst strategi) av typen epler og pærer. For eksempel ser vi folk hevde at avgifter og moms på amerikanske biler som importeres til Norge påstås å være proteksjonisme og tollbarrierer mot USA. Det er det selvsagt ikke. Alle bilprodusenter har samme vilkår for eksport til Norge. Ikke minst har den USA-amerikanske Tesla tjent godt på det norske avgiftsregimet for biler som ikke er toll, men bilavgifter.
Det samme gjelder importvernet på jordbruksvarer. Man kan mene mye om det norske behovet for beredskap og spredt bosetting, men det rammer alle utlendinger likt. Alle land har slike mekanismer. Også USA.
Nei, noe forsøk å forhandle fram økonomisk, optimale handelsavtaler er dette ikke. Forhandlingsspill er noe vi har mye kunnskap om. Det optimale utfallet av forhandlinger er en avtale begge eller alle parter tjener på. Slik vi tilstreber i norske lønnsforhandlinger. Så høye lønninger som mulig, men ikke så høye at bedriften ikke klarer å tjene penger.
Les også:
2025 blir et år fullt av skremmende hendelser. Men vi kan også gjøre det til året der ting snur
, skriver Jonas Bals
Det som er med forhandlinger, er at partene jo går inn i dem med et etablert utgangspunkt, og med et sett forventninger. Kunsten er å påvirke disse på forhånd. Det er et vårtegn like sikkert som linerla og rødstrupa, at vi ser arbeidsgivere i media proklamere at «i år er ikke tidspunktet for lønnsvekst» samtidig som motparten selvsagt er ute med motsatt budskap. Forhandlingskortene deles ut til denne årvisse fuglesangen. Klarer man å flytte forståelsen av hvor vi er, flytter man også forhandlingsrommet. Altså hvor vi skal. Får du lov av motparten til å feste et anker, får du også aksept for å bevege deg mindre.
Ingen tror heller på at vi skal inn i en verden helt uten avtaler, så sa er spørsmålet bare hvilken avtale. Avtale A er bedre enn avtale B. Men avtale B er bedre enn ingen avtale.
Place your bets
.
Det er dette Trump driver med. Mannen er ingen økonom, men heller ingen politiker. Og han er bedøvende likeglad med om et forhandlingsresultat er noe alle tjener på – bare han gjør det selv. Det er ikke økonomi han driver med. I alle fall ikke bare. Det er godt gammaldags maktspill.
Les også:
Musk er ikke den første: – Trakk i trådene bak presidenten
Les også:
Ekspert tviler på «Trump-smutthull» i 2028: – Helt urealistisk
Les også:
Dette mener nordmenn om Trumps politikk
Les flere kommentarer av Kjetil Staalesen
Hold deg oppdatert. Få daglig nyhetsbrev fra Dagsavisen",Error generating text.,yes
10_07_04_2025,Vil bevæpne studentene på universitetet,Kjetil Iden,https://www.cdn.tv2.no/images?imageId=17601583&x=0&y=0&cropw=100&croph=100&panox=0&panoy=0&panow=100&panoh=100&width=1200&height=630,2025-04-06 18:10:20,https://www.tv2.no/nyheter/utenriks/vil-bevaepne-studentene-pa-universitetet/17601418,Politikk,"For et stort flertall av nordmenn er politikken til USAs president Donald Trump svært annerledes og tidvis skremmende.
Men hva tenker unge amerikanere nå som han har vært president i snart to og en halv måned?
TV 2 er på besøk hos universitetet i republikanske Sør-Carolina i jakten på svar.
Liker innvandringspolitikken
Våren har kommet hit til campus, og studentene har helt andre ting å tenke på enn politikk.
Likevel kan kanskje disse unge, høyt utdannede menneskene i denne delstaten, hvor 60 prosent stemte på Trump, hjelpe oss med å forstå de gjorde det.
En av studentene her er Noah Lindner. Han er president for collegerepublikanerne.
– Jeg stemte på innvandringspolitikken hans og mener at han var det beste valget blant kandidatene, forteller Lindner til TV 2.
Nå slåss han for retten til å bære våpen inne på universitetsområdet.
– Jeg vokste opp landlig og skjøt mye. Jeg er trygg med våpen. Det er veldig viktig at folk får muligheten til å beskytte seg selv, sier Lindner.
Han er uenig i at mer våpen fører til mer utrygghet.
– Vi har en av de høyeste voldtektsstatistikkene i Sør-Carolina, blant de høyeste drapstallene, den høyeste overfallsraten og den høyeste kriminalitetsraten, argumenterer Lindner.
Fornøyd med kuttene
Noe av det han liker aller best med «Trump 2.0», er alle kuttene som gjøres i føderale etater og byråer.
– Når man blør så mye penger som landet vårt gjør, må man gjøre dype kutt til å begynne med, og så kan vi bygge det opp igjen for å være mer effektive, mener Lindner.
Han liker at både Trump og hans høyre hånd, Elon Musk, har bakgrunn som forretningsmenn.
– De kommer begge fra penger og vet hvordan forretninger fungerer.
Tempoet er skyhøyt i Trump-administrasjonen og nyhetene kommer løpende som Usain Bolt. Lindner følger med så godt han kan, selv om det har vært utfordrende.
– Jeg ser overskriftene, men jeg har hatt to eksamener og studert mye nå, sier Lindner, som legger til at han gjerne bruker helgen på å hente inn det tapte.
Kristne verdier
Sykepleierstudenten Aubrey stemte på Trump fordi hun mener at han har gode, kristne verdier.
– Vesten har definitivt blitt veldig liberal på noen områder, og jeg liker at han fremmer mer tradisjonelle verdier, sier hun til TV 2.
Den menneskejakten som Trump-administrasjonen har satt i gang blant innvandrere i landet, fremstår ikke som spesielt kristen verdimessig.
Aubrey vedgår også at Trump ikke alltid oppfører seg på en kristelig måte.
– Men det er det ingen kristne som gjør. Det er hele poenget med kristendom, ingen er perfekte kristne, mener Aubrey.
Samtidig er det ikke alle studentene på campus her som støtter Trump. Noen forteller om direkte frykt.
– Jeg har mange mørke og skeive venner som frykter for sitt eget ve og vel, og for hva de må tåle å leve med hvis det fortsetter slik, sier Red, som studerer sosialantropologi og historie.
Hun forteller at hun også er blitt en skyteskive for hets.
– Nylig kom det noen kjørende forbi med høyttalere, Trump-flagg og alt mulig. De spilte for full guffe og ropte «til helvete med pronomenene deres» og «dra tilbake dit dere kom fra», forteller Red.
– Det er skremmende å plutselig være uønsket i sitt eget hjem, legger hun til.
– Blir latterliggjort
Red tror ikke at de fleste på universitetet liker Trump, ei heller i resten av landet.
– Mange av oss ser på ham som en som blir latterliggjort av andre. Vi respekterer ham ikke, fastslår Red.
Likevel er de fleste amerikanerne TV 2 snakker med, strålende fornøyd med president Trump og lite bevisst på hvordan han fremstår for resten av verden.
Lindner ønsker til og med at USA melder seg helt ut.
– USA bør ikke involvere seg i utenrikspolitikk i det hele tatt. Jeg er veldig isolasjonistisk og mener at USA bør fokusere på seg selv først. Vi bør sette våre egne innbyggere først, før vi ser til resten av verden, sier republikaneren.",Error generating text.,yes
6_07_04_2025,Først demonstrerte hun. Nå prøver hun å velge den mest «uskyldige» osten,Aysun Yazici,https://www.cdn.tv2.no/images?imageId=17596037&x=0&y=14.72&cropw=100&croph=71.67&panox=0&panoy=14.72&panow=100&panoh=71.67&width=1200&height=630,2025-04-06 22:09:44,https://www.tv2.no/nyheter/utenriks/forst-demonstrerte-hun-na-prover-hun-a-velge-den-mest-uskyldige-osten/17604261,Politikk,"Hvilken ost bør velges? Hvilken sjokolade bør spises?
Tyrkiske «Selin» bruker mange timer i matbutikken, men for henne handler det ikke om å spise sunt.
For mat er politikk, og gjennom kjøpene hun gjør, tar «Selin» et politisk valg.
Og hun er langt fra alene om dette i Tyrkia om dagen.
– Urettferdighet, lovløshet og fattigdom plager oss. Vi ønsker ikke å bli arrestert for dette. Vi ønsker å vise at vi er her og eksisterer, sier «Selin» til TV 2.
En omfattende boikottkampanje pågår i Tyrkia for tiden.
Millioner av mennesker velger bort TV-kanaler, aviser og merker som annonserer hos medieselskaper som har et åpent og nært forhold til regjeringen.
«Selin» er en av mange tyrkere som deltar i en boikottkampanje.
Av sikkerhetsgrunner ønsker hun å være anonym i saken, men TV 2 kjenner hennes virkelige identitet.
– 301 unge har blitt fengslet etter demonstrasjonene. Tusenvis er pågrepet. Mange har blitt redde og tør ikke lenger gå ut i gatene, sier «Selin».
– For å fortsatt vise vår motstand, boikotter vi, sier hun.
Arrestert
Det hele startet da universitetet i Istanbul trakk vitnemålet til Imamoglu, som i praksis diskvalifiserer han fra å bli valgt som presidentkandidat.
Dagen etter, 19. mars, ble ordføreren pågrepet.
Han ble anklaget for korrupsjon, terrorstøtte og en rekke andre forhold.
Pågripelsen skjedde da det ble klart at Tyrkias største opposisjonsparti, Det republikanske folkepartiet (CHP), ville nominere 53-åringen som sin presidentkandidat.
Imamoglu blir sett på som den sterkeste utfordreren til president Recep Tayyip Erdogan.
Men nå sitter Imamoglu fengslet i Silivri høysikkerhetsfengsel utenfor Istanbul.
CHP-leder Ozgur Ozel kunngjorde en boikottliste etter at noen medier ikke viste demonstrasjonene i sendingene.
Lederen oppfordret alle til å unngå TV-kanaler som ikke dekker demonstrasjonene, og oppfordret til å boikotte selskaper som annonserer på disse kanalene.
– Kupp mot demokratiet
Tyrkiske «Can» deltok i demonstrasjonene. Nå boikotter han.
Av sikkerhetsgrunner ønsker han ikke å bli navngitt. TV 2 kaller ham derfor bare «Can».
Han forteller at Istanbuls ordfører er den første politikeren som har skapt håp hos ham, men at drømmene hans er nå knust.
– Imamoglu er en lovlig valgt ordfører, to ganger. Han har blitt et håp for millioner av mennesker som er lei av 23 år med Erdogan-regime. At Imamoglu er avsatt og fengslet, er rett og slett et kupp mot demokratiet, sier «Can».
Etter at Ekrem Imamoglu ble fengslet har partiet hans, Det republikanske folkepartiet (CHP), gjennomført et primærvalg for å nominere sin presidentkandidat. Mer enn 15 millioner velgere stemte på Imamoglu.
Dette viser opposisjonens makt, mener «Can».
Han sier mange i landet tror på demokrati, men at mange er svært bekymret for at deres opparbeidede rettigheter skal gå tapt.
– Ignorerer alt som ignorerer meg
Derfor gjør han alt han kan for å vise sin motstand. På samme måte som «Selin», har også «Can» begynt å boikotte.
Det gjør at han velger produkter med omhu i matbutikken.
– Jeg er veldig nøye med hva jeg kjøper. Jeg skulle kjøpe en sjokolade i forrige uke. Så tenkte jeg at selskapet har et veldig nært forhold til regjeringen, så da byttet jeg den ut med et annet merke, sier han.
– Hver dag vokser boikottkampanjen. Jeg elsker landet mitt og ønsker ikke å forlate det, men jeg ønsker å leve i et demokratisk land.
Presidenten og regjeringen er kritisk til boikottkampanjen og sier at det er skadelig for landets økonomi og folk.
«Can» er uenig i kritikken. Han ser ikke noe poeng med å se på regjeringsvennlige TV-kanaler som ikke dekker at millioner av mennesker protesterte i gatene.
– Jeg prøver å ignorere alt som ignorerer meg og mine rettigheter, sier han.
«Selin» er enig: Hun sier hun vil fortsette med kampanjen til Tyrkia får demokrati.
– I mange år har vi blitt fortalt at hvis man studerer og jobber, så vil alt gå bra. Men nå ser vi at dette ikke gjelder lenger. Våre opparbeidede rettigheter, som vitnemål, kan bli kansellert uten grunn.
– Vi må bare fortsette kampen - for jeg elsker landet mitt, sier hun til slutt.
Boikotter undervisninger
Boikottkampanjen gjelder ikke bare varer og TV-kanaler. Ved mange universiteter har tusenvis av studenter og akademikere bestemt seg for å ikke delta i undervisning.
I stedet demonstrerer de i gatene.
– Studentene ønsker ikke å delta i undervisning, fordi de så at et vitnemål kunne bli ulovlig kansellert i løpet av en natt. Så de ser ingen fremtid, sier Beyzade Sayin, som er representant for landets største studentorganisasjon, til +90.
– Jeg er her, ikke for å vise en støtte til en politiker. Jeg er her for rettferdighet og landet vårt, sier en student til +90.
Boikottkampanjen viser seg også i sosiale medier. Nå er det mange som oppfordrer hverandre til å blokkere kjendiser som ikke poster noe om fengslingen av Imamoglu og unge.",Error generating text.,yes
8_07_04_2025,Future-handelen i USA åpner skarpt ned – indikerer globalt børsfall mandag,Janne Johannessen,https://images.dngroup.com/image/eyJ3IjoxMjAwLCJmIjoid2VicCIsImsiOiJlYzBjN2I3NmQ3ZDgxMDVjYmNiNDEzYmE0NGE2ZTg2MyIsImNyb3AiOlswLDIwMCwyNDAwLDEyMDBdLCJyIjoyLCJvIjoiZG4ifQ,2025-04-06 20:12:47,https://www.dn.no/makrookonomi/usa/donald-trump/elon-musk/future-handelen-i-usa-apner-skarpt-ned-indikerer-globalt-borsfall-mandag/2-1-1803318,"Business, Finance, Politics, Economics","Prøv DN i 4 uker for 1 kr
Full tilgang til de viktigste nyhetene om næringslivet.
Bestill
Amerikanske aksjer faller bratt i førhandelen, et tegn på at bunnen langt fra er nådd for børsene.
Oppdatert for 6 minutter siden
Da future-handelen åpnet ved midnatt norsk tid faller de ledende amerikanske børsindeksene med rundt fem prosent. Det gjelder både Dow Jones, S&P 500 og Nasdaq, altså et bredt fall.
Det kan være et varsel om en blytung dag på verdens børser, først i Asia i natt, før børsene i Europa åpner mandag morgen, og Wall Street på ettermiddagen. Dette kommer på toppen av det kraftige børsfallet torsdag og fredag, etter at president Donald Trump la frem sin tollpakke sent onsdag.
Tollstrid i Washington
Samtidig utfordres toll-idyllen i Trump-administrasjonen. To av Donald Trumps topprådgivere, Elon Musk og Peter Navarro, har havnet i åpen konflikt om toll.
Mens president Donald Trump har brukt helgen til å spille golf i Florida, har flere av hans toppfolk på økonomi og toll tatt runden til tv-studioene for å forsvare og forklare etter sist ukes børskollaps.
Trumps trofaste våpendrager, Tesla-sjef Elon Musk, har hele tiden støttet helhjertet opp om presidentens økonomiske politikk, inkludert hans forkjærlighet for toll. Men i helgen gikk Musk ut og sa at det ville være å foretrekke en frihandelssone bestående av Europa og Nord-Amerika (se video).
Musk reagerte også da en bruker på hans sosiale plattform X forsvarte Peter Navarro, Trumps seniorrådgiver på handel og industri, og påpekte at han har en doktorgrad i økonomi fra Harvard.
«En doktorgrad i økonomi fra Harvard er en dårlig ting, ikke en bra ting», meldte Musk, og antydet at Navarro har problemer med sitt ego.
Musk fortsatte i en senere og nå slettet melding med å omtale Navarro som «bullshit».
Mener Musk kun er en bilselger
Navarro regnes blant arkitektene bak Trump-tollen.
Navarro nølte da heller ikke med å gå rett i strupen på Musk, og mer enn antyder at Musk kun er ute etter å mele sin egen kake, altså å selge flere Teslaer. Han mener Musk ikke forstår hvordan toll virker, og hvordan andre land svindler USA.
– Det som jeg mener er viktig å forstå med Elon er at han selger biler, det er det han gjør. Han beskytter bare sine egne interesser, som alle forretningsfolk ville gjøre, sa Navarro, ifølge Axios.
Navarro insisterer på at det ikke er noen uenigheter i Trump-administrasjonen, og at Musk må få si hva han vil.
Det er tidligere kjent gjennom et lydopptak at visepresident J.D. Vance er svært misfornøyd med Musk og den makten han har i administrasjonen.
Men alle ryktene om et snarlig brudd mellom Trump og Musk lar vente på seg, og de to omtaler hverandre i svært fordelaktige ordelag.",Error generating text.,no
