aid,title,author,image_url,published_date,article_url,category,raw_text,text,is_manipulated
32_09_04_2025,Krever at politiet sletter «romregister»: – Føler meg stemplet som kriminell,Ragnhild Aarø Njie,https://gfx.nrk.no/s4Zdg85sz4pspWkGJ7Dr7Ab0wooCelvRo2uD9u719qcQ.jpg,2025-04-08 08:02:14,https://www.nrk.no/stor-oslo/krever-at-politiet-sletter-_romregister__-_-foler-meg-stemplet-som-kriminell-1.17370083,Politics,"I dag er den internasjonale romdagen.
– Det er en dag der vi kan oppskatte kulturen vår. Det betyr dansing, feiring, god mat, familie og fellesskap.
Amorina Lund smiler forsiktig.
– Det er en glad dag for oss romer, over hele verden.
Hun jobber ved Romano Kher, det romske kultur- og ressurssenteret i Oslo.
Der har den romske minoriteten samlet seg for å feire nasjonaldagen i flere år.
Men i år blir det ikke bare jubel og fest, sier Amorina:
– I år har vi tenkt annerledes. I år vil vi demonstrere i Oslo.
Kartlagt av politiet
– Man visste ikke hva man skulle gjøre, hva man skulle si. Hvorfor har dette skjedd? Hva vil de med dette?
Amorina snakker om den omfattende kartleggingen Øst politidistrikt har gjort av over 600 personer med romsk bakgrunn.
Saken ble først omtalt av Aftenposten i fjor vår.
Og har preget det romske miljøet siden.
Les også Palermo (17) er en del av minoriteten nordmenn er mest skeptiske til:- Jeg er stolt
Den romske minoriteten i Norge er ikke stor. Trolig er de ikke flere enn 700 til 1000 personer.
De fleste bor på Østlandet.
Amorina kan selv være en del av dette oversikten uten å vite det.
Det kan også familiemedlemmer eller venner av henne.
Det føles ubehagelig. Og stigmatiserende.
Vi føler at vi har et stempel på oss. Jeg har aldri gjort noe kriminelt, likevel føler jeg meg stemplet. Amorina Lund
Politiet avviser register
NRK har stilt politidistrikt Øst en rekke spørsmål om kartleggingen.
De skriver i en epost at de ikke har et register over norske romer.
De kaller oversikten et internt arbeidsnotat, med utgangspunkt i straffesaker i familier med «et bekymringsfullt stort omfang av kriminalitet».
Les hele svaret fra politiet her
– Øst politidistrikt har ikke, og har ikke hatt, et register over norske romer. Saken i Aftenposten dreide seg om interne arbeidsnotater med utgangspunkt i straffesaker i familier med et bekymringsfullt stort omfang av kriminalitet, skriver Thomas Stærk, leder for felles enhet for etterforskning, etterretning og forebygging.
– Datatilsynet har gjennom sin behandling av saken slått fast at behandlingen av disse opplysningene er i tråd med kravene og adgangen gitt i politiregisterloven.
Datatilsynet vurderte i fjor at politiet ikke hadde brutt personregelverket.
De tok ikke stilling til behandlingen av personopplysningene til hver enkelt person i oversikten.
603 personer var kartlagt, ifølge Datatilsynet.
NRK forklarer
Hvem er de norske romene?
Hvem er de norske romene?
Hvem er romene? Den nasjonale minoriteten romer har langvarig tilknytning til Norge.
De første romene kom til Norge fra Øst-Europa på 1800-tallet, men mange har også kommet i nyere tid.
Det er over 700 romer i Norge, men ingen vet akkurat hvor mange.
Hvem er de norske romene?
Hvor kommer de fra? Forfedrene til dagens romske minoritet utvandret trolig fra India for mellom 1000 og 1500 år siden.
Etterkommerne deres er i dag Europas største minoritet.
Språket deres, romanés, er beslektet med indiske språk.
Hvem er de norske romene?
Hvordan har de blitt behandlet i Europa? Romene ble utsatt for systematisk diskriminering i Europa, også før Holocaust.
Mellom 250.000 og 500.000 europeiske romer ble drept under folkemordet. 62 av disse var norske romer.
I Romania i Øst-Europa ble romene holdt som slaver i over 500 år.
Hvem er de norske romene?
Hvordan har de blitt behandlet i Norge? «Sigøynerparagrafen», som ble innført i 1927, førte til at romer ble kastet ut av og nektet adgang til Norge.
Loven ble opphevet i 1956, som betyr at de norske romene som overlevde Holocaust, først ikke fikk returnere til Norge.
Etter krigen ble de møtt med assimileringspress og diskriminering.
Hvem er de norske romene?
Har Norge beklaget? I 2015 beklaget Norges daværende statsminister Erna Solberg den rasistiske behandlingen romer har blitt utsatt for.
Det har aldri blitt laget noen handlingsplan mot antisiganisme i Norge.
Romer nevnes sjelden i offentlige handlingsplaner mot rasisme.
Kilde: SNL, Romano Kher, Udir.no og Solvor Mjøberg Lauritzen
Forrige kort
Neste kort
– Rasistisk, etnisk register
– Registeret politiet har laget over norske romer er et rasistisk, etnisk register.
Det sier historiker Maria Rosvoll ved Holocaust-senteret.
– Registeret tar utgangspunkt i de fire norske romene som overlevde Holocaust. Og så har de bygget ut slektstre derifra, sier hun.
– Norske romer ble jo fratatt statsborgerskapene sine og kastet ut av landet. Og endte opp i Auschwitz-Birkenau.
Den romske befolkningen fikk en unnskyldning fra daværende statsminister Erna Solberg i 2015.
Men tilliten de har til myndighetene er tynnslitt. Med god grunn, mener Rosvoll.
Maria Rosvoll Forsker ved Holocaust-senteret Har skrevet flere bøker om norske romer og romsk historie Hatt kontakt med romske miljøer i over 20 år
Det at politiet lager et etnisk register, kan oppleves som en forfølgelse av minoriteten. Og svekke tilliten til majoritetssamfunnet. Maria Rosvoll
Hun er enig i at katleggingen bør slettes.
– Jeg synes de skal be norske romer om unnskyldning. Og gå i dialog med dem.
Rosvoll er en av flere som har jobbet opp mot det romske miljøet i over 20 år.
– Og så kommer en av våre mektigste institusjoner og bryter ned all tillit på denne måten. Det er jo katastrofe.
SVERRE A. BØRRETZEN / NTB Ble utestengt og jaktet på Bildene er tatt i Oslo i juni 1968, tolv år etter at «sigøynerparagrafen» ble opphevet.
Ukjent fotograf Ble forsøkt utryddet Loven stengte norske romer ute fra landet, slik at de ble fritt vilt i et Europa der ble jaktet på. 62 norske romer ble drept under Holocaust. Noen av de overlevende fikk ikke tilbake statsborgerskapene sine før på 70-tallet. Romene måtte gå rettens vei for å få statsborgerskapene sine tilbake.
SVERRE A. BØRRETZEN / NTB Staten ga unnskyldning
Først i 2015 sa staten unnskyld til norske romer.
Mange romer ønsker en handlingsplan mot antisiganisme, noe de ennå ikke har fått.
De ble ikke inkludert i sannhets- og forsoningskommisjonen, som gransket fornorskingspolitikk og urett overfor de nasjonale minoritetene samer, kvener og norskfinner.
De heller ikke fått et minnesmerke.
– På overtid med egen handlingsplan
Flere romer har tatt til orde for at de ønsker en egen handlingsplan mot antisiganisme de siste årene.
Dette er også et av kravene under demonstrasjonen.
Rosvoll ved Holocaust-senteret mener en slik handlingsplan burde vært laget for lenge siden.
– Et av funnene til politimannen som har laget dette registeret, er paradoksalt nok at norske romer lever i gjennomsnitt til de blir 55 år, sier Rosvoll.
– Det betyr at vi har en minoritet i dette landet som lever nesten 30 år kortere enn majoritetssamfunnet.
Amorina Lund ønsker en handlingsplan mot antisiganisme. Hun sier at registeret gjør at hun mister motivasjon for framtiden. I tillegg svekker det tilliten hun og andre romer har til myndighetene, sier hun. Foto: Hallgeir Braastad / NRK
Rosvoll mener dette ikke bare handler om livsstil.
Men også om hvordan norske romer blir tatt imot av majoritetssamfunnet:
– Det er vi som må rekke ut en hånd og få de til å bli en del av vårt samfunn.
En handlingsplan kan være et viktig steg på veien mot forsoning, mener Amorina.
Vi er ikke dårlige folk. Vi vil være en del av storsamfunnet. En handlingsplan hadde vært en sjanse til å forbedre ting.",Error generating text.,no
1_09_04_2025,Klart flertall vil ha bevæpnet politi,Vilhelm O. Bjørgul,https://premium.vgc.no/v2/images/d5a6d2df-d8e4-4d6c-aef0-d4d2c400ef76?fit=crop&format=auto&h=1366&w=2048&s=16f6f172252e01d4d32410c8db44035135bdf8c9,2025-04-09 04:04:37,https://www.aftenposten.no/norge/politikk/i/wgmwwn/klart-flertall-vil-ha-bevaepnet-politi,Politikk,"Flere partier har snudd om generell bevæpning av politiet. Nå viser en fersk meningsmåling at de er i takt med folkemeningen.
– Jeg synes det er trist at det er sånn, men nå har kriminalitetsbildet og situasjonen utviklet seg slik at det er nødvendig å si ja til generell bevæpning i politiet.
Det sier justis- og beredskapsminister Astri Aas-Hansen (Ap), til Aftenposten.
Nå viser ferske tall at store deler av befolkningen støtter henne.
Folket har talt
Hele 56 prosent av det norske folk sier at de er positive til generell bevæpning av politiet.
Det sier tallene Respons Analyse har hentet inn på vegne av Aftenposten. 27 prosent er negative, mens resten er usikre.
Tallene viser at menn er noe mer positive til bevæpning enn kvinner. De eldste velgerne støtter i størst grad mer våpen til politiet.
Det er store ulikheter i synet på bevæpning av politiet mellom de ulike partienes velgere:
Frps velgere er de klart mest positive til bevæpning. Justispolitsk talsperson i Frp, Helge Andre Njåstad er ikke overrasket.
– Vi har jo vært det partiet som har vært tydeligst på bevæpning lengst, og har stått alene om det i norsk politikk helt frem til landsmøte våren i år, sier han.
Få oppdrag med våpen i dag
Bare 4 prosent av oppdragene til politiet var bevæpnet i 2024, ifølge politidirektoratets tall.
Justisministeren mener likevel at generell bevæpning er nødvendig.
Imidlertid er hun opptatt av å tydeliggjøre hva Arbeiderpartiet mener.
– Vi har sagt at vi mener det nå er riktig med en generell bevæpning, men med en innramming, sier hun og legger til:
– Politi som jobber inn mot barn og unge, på idretts- og kulturarrangementer, eller som jobber forebyggende, skal fortsatt ha et sivilt preg.
Det er også store forskjeller mellom de ulike distriktene. Oslo har for eksempel klart flest væpnede oppdrag, opplyser politidirektoratet.
I 2013 var nåværende justis- og beredskapsminister Astri Aas-Hansen statssekretær i det samme departementet.
Da sa hun at det ikke ville bli noen generell bevæpning av politiet med det første.
Siden den gang og frem til og med 2024 har politiet brukt skytevåpen 87 ganger.
Flertall på Stortinget
Arbeiderpartiet var sist ut av partiene til å snu om bevæpning. Statsminister Jonas Gahr Støre understreket selv viktigheten av et politi vi kan «se inn i øynene» i forkant av debatten på landsmøtet i forrige uke.
Det var flere var motstandere, men partiet landet til slutt på et vedtak for generell bevæpning.
Til tross for snuoperasjonen, måtte de trolig innført det uansett.
Først og fremst dreier det seg om at Senterpartiets landsmøte forrige helg gikk inn for generell bevæpning av politiet.
Dermed har flertallet på Stortinget snudd. Høyre har også nylig gått inn for det samme, og Kristelig Folkeparti har varslet at de slenger seg på.
Frp er allerede for. Sammen med de øvrige går det derfor mot et flertall for generell bevæpning av politiet i Norge.
– Dypt alvor
Aas-Hansen avviser kontant at regjeringen snur kappen etter vinden i bevæpningsspørsmålet.
– Nei, det gjør vi ikke. Jeg gikk inn i dette da jeg kom inn i justisdepartementet i februar med et stort og dypt alvor.
– Når kommer det til å bli innført?
– Det er for tidlig å si. Det krever en endring av politiloven. Det tar tid å endre lover. Hvor lang tid det tar kan jeg ikke si nå, avslutter Aas-Hansen.
Både Frp og Høyre har varslet at de ønsker å starte prosessen i vår. Det samme sier justis- og beredskapsministeren.",Error generating text.,yes
31_09_04_2025,Seks av ti samer har liten tillit til regjeringen,Vetle Mathiesen Knutsen,https://gfx.nrk.no/0oFDh6Aa-nTnNJiUexKHwQiQKMZWx5bXUIph7LMEsi_g.jpg,2025-04-08 19:49:57,https://www.nrk.no/sapmi/seks-av-ti-samer-har-liten-tillit-til-regjeringen_-_-ikke-saerlig-overraskende-1.17372835,Politics,"Lohkh saemiengïelesne.
Det kommer frem i en meningsmåling gjort av Norstat på vegne av NRK.
Der svarte 58 prosent at de har «ganske liten tillit» eller «svært liten tillit» til at myndighetene tar hensyn til samiske interesser.
Jonas Stein er valgforsker ved UiT og har sett at samiske velgeres tillit til Stortinget har sunket, mens tilliten til Sametinget økt.
– Ganske høyt
Forskeren forklarer tallene NRK har vist han enkelt og greit:
– Det viser jo at en majoritet av den samiske befolkninga ikke mener at regjering og norske myndigheter tar tilstrekkelig hensyn til samiske interesser og rettigheter.
Totalt ble 1001 personer i Sametingets valgmanntall intervjuet. Feilmarginen er mellom 0,9 og 3,1 prosentpoeng.
– Hvor høyt vil du si tallene er?
– Jeg vil si det er ganske høyt, sier Stein men legger til at det er viktig å nyansere det litt.
– Spørsmålet handler ikke om tillit til den generelle institusjonen, men om tillit til hvorvidt institusjonene tar hensyn til samiske interesser og rettigheter.
Jonas Stein er førsteamanuensis i statsvitenskap ved UiT. Foto: NRK
Da mener Stein det ikke er så overraskende at mange ikke har tillit til at myndighetene.
Han viser også til Fosen-saken som pågikk i flere år før man nylig har kommet til en slags løsning.
Liten tiltro?
– Det er ikke særlig overraskende.
Det sier Per Torleiv Ravna fra Tana i Finnmark til NRK. Han forteller at man i samiske samfunn hører at folk ikke har tiltro til regjeringen og norske myndigheter.
– Det er overraskende at 40 prosent har tillit.
I bygda hans pågår det nå en debatt om Tanaelva.
Elva regnes av mange som en av verdens viktigste lakseelv, men den har vært stengt for laksefiske de siste årene.
Per Torleiv Ravna ser på tallene fra NRKs meningsmåling. Foto: Eilif Andreas Aslaksen / NRK
Han mener norske myndigheter har «kjørt gjennom saken» uten at lokale interesser blir hørt.
– Det virker som om vi i samiske samfunn spesielt i indre strøk ikke har noe stemme når vi kommer til sentrale politiske myndigheter, sier han.
Det har vært sterke reaksjoner på laksefellen i Tanaelva. – Som om jævelen holder på i kirka, sa Ravna til NRK i fjor.
– Det virker som det samiske gjør seg bra på et postkort og i turisme. Men når det virkelig blir konflikter, så blir man ikke hørt, sier Ravna og fortsetter:
– Da kjører staten gjennom og det virker som samiske interesser er minste motstands vei.
– Vi har en jobb å gjøre
Statssekretær Agnete Masternes Hanssen (Ap) skriver i en e-post til NRK at regjeringen jobber hver dag for å skape trygghet for framtida, også for den samiske befolkninga, men legger til:
– Tallene viser at vi har en jobb å gjøre for å vise at vi har et oppriktig ønske om å både ta hensyn til samiske interesser og rettigheter og utvikle samfunnene våre.
Agnete Masternes Hanssen (Ap) er statssekretær i Kommunal- og distriktsdepartementet. Foto: Aurora Ytreberg Meløe / NRK
– Vi vet at forsoningsprosesser tar tid. Nå skal den samme staten bygge tillit. Den jobben tar jeg på alvor, sier hun.
– Samiske samfunn har en sterk stemme gjennom Sametinget og at de har en svært tett og god dialog med sametinget, forteller Hanssen.
Mange departement rådfører seg også med Sametinget i saker hvert eneste år, sier hun.
Selv om de ikke alltid blir enige fører det til at myndighetene i dialog med samiske samfunn prøver å finne gode løsninger sammen.
I fjor sommer saksøkte Sametinget staten. De mener staten har brutt konsultasjonsplikten.
Dette svarer statssekretær Agnete Masternes Hanssen
«Regjeringa jobber hver eneste dag for å skape trygghet for framtida, også for den samiske befolkninga. Tallene viser at vi har en jobb å gjøre for å vise at vi har et oppriktig ønske om å både ta hensyn til samiske interesser og rettigheter og utvikle samfunnene våre.
Sannhets- og forsoningskommisjonens rapport fra 1. juni 2023 viste hvordan fornorskningspolitikken Staten utførte har gjort stor skade på det samiske samfunnet. Vi vet at forsoningsprosesser tar tid. Nå skal den samme staten bygge tillit. Den jobben tar jeg på alvor.
I løpet av denne Regjeringsperioden har vi tatt betydelige grep for å utvikle samisk språk og kultur. Det skal vi fortsette med også fremover.
Stortinget behandlet Sannhets- og forsoningskommisjonens rapport 12. november 2024. Stortinget har sendt 16 anmodningsvedtak til regjeringen for oppfølging. Regjeringens arbeid med disse vedtakene er viktig for videre forsoning.
Samiske samfunn har en sterk stemme gjennom Sametinget. Vi har svært tett og god dialog med Sametinget, og mange departement konsulterer om konkrete saker hvert eneste år. Når vi konsulterer, er det med mål om å bli enige med de samiske interessene. Dette er en viktig del av regjeringens samepolitikk.
Selv om vi ikke alltid blir enige, fører konsultasjonene til at myndighetene i dialog med samiske samfunn prøver å finne gode løsninger sammen. Dette tror jeg også er med på å bygge tillit.»
– Naturlig konsekvens
I meningsmålingen kommer det frem at de tre største partiene på Sametinget har velgerne fra Norske Samers Riksforbund (NSR) minst tillit til regjering og myndigheter.
Velgerne fra Nordkalottfolket (Nkf) har størst tillit til myndighetene. Her svarer seks av ti velgere at de har «svært stor tillit» eller «ganske stor tillit».
Valgforskeren Jonas Stein sier det ikke er så overraskende.
– For det vi også vet fra forskning som er gjort er at NSRs velgere er mer opptatt av samisk selvbestemmelse og samiske rettigheter enn de andre partiene, sier han.
Stein legger til:
– Så da er det en naturlig konsekvens at man er mer opptatt av at norske myndigheter og regjering skal ta hensyn til disse rettighetene og den samiske selvbestemmelsen.",Error generating text.,no
26_09_04_2025,Hjemmefødsler: –⁠ Må forstå hva dette handler om,Lytt til saken,https://akamai.vgc.no/v2/images/33486f0a-d073-4724-b46f-c825571f4042?format=auto&w=1080&s=dcbb80a00fee8890392d470154ecef8389d9dea1,2025-04-08 20:20:02,https://www.vg.no/nyheter/i/nyKkPx/hjemmefoedsler-maa-forstaa-hva-dette-handler-om,Health,"Er trenden med fri fødsler et symptom på svakheter ved fødselsomsorgen? Ja, mener forskere og jordmødre.
Malene Birkeland
Emilie Rydning
Synne Eggum Myrvang
og 1 til
For 18 minutter siden
Kortversjonen
To forskere og tidligere jordmødre påpeker svakheter med omsorg i fødselsomsorgen.
Jordmor Carina Vedeler har skrevet doktorgrad om kvinners erfaringer med fødsel i Norge, og fremhever behovet for å lytte til deres opplevelser.
Ellen Blix, professor i jordmorfaget, understreker viktigheten av omsorg i fødsel.
– Vi må forstå hva dette handler om. Vi må lytte til kvinnene og deres erfaringer. Det er skummelt om vi bare avviser det og ikke prøver å forstå.
Det sier jordmor og universitetslektor ved Universitetet i Sørøst-Norge Carina Vedeler.
Mens debatten om uassisterte hjemmefødsler raser – mener hun diskusjonen er polarisert og unyansert.
I sin forskning ser hun en fødselsomsorg med svakheter.
Hun har skrevet doktorgrad om erfaringene til 8400 kvinner som har født i Norge.
En annen studie hun har gjort, viste at mens 68 prosent var fornøyde med fødselsomsorgen, hadde 20 prosent blandede opplevelser og 12 prosent var utelukkende negative.
– Det er kvinner som beskriver at de ikke får fødselsomsorgen de har behov for, i en situasjon hvor de føler seg veldig sårbare, sier Vedeler.
Det innebærer blant annet:
De følte seg ikke sett og hørt
De følte seg overkjørt
De følte seg som på et samlebånd
De følte seg objektivert og fremmedgjort
De opplevde mangel på omsorg
De opplevde mangel på informasjon, deltagelse i beslutningstaking og samtykke før undersøkelser
De opplevde manglende ivaretagelse i eller etter akutte situasjoner
Fødselsdebatten
Dette har skjedd
Stadig flere er interessert i å føde hjemme uten helsepersonell. Barnelegeforeningen har advart mot dette.
Jordmødre ser en økende «trend» med at flere motsetter seg undersøkelser i svangerskapet og under fødsel.
I mars ble det kjent at en baby døde og at fødselen etterforskes. Doulaen ble anmeldt av sykehuset for forsømmelse av hjelpeplikt.
I fjor døde en baby i en uassistert hjemmefødsel. Politiet har henlagt den saken.
Vis mer
Må tas på alvor
– Vanskelige opplevelser må vi ta på alvor.
Vedeler er sterkt uenig i at kvinner i dag er mer kravstore til fødselsopplevelsen.
– De som beskriver dårlige opplevelser prøver å forstå og skape mening i opplevelsene sine. De ser også at helsepersonell gjør så godt de kan. De ser at de ikke har rammene som trengs for å gi omsorgen de skal, at helsevesenet er presset på tid og ressurser.
Vedeler mener også kritikken må tolkes som en kritikk mot systemet, ikke den enkelte jordmor eller fødselslege.
Hjemmefødsler
Uassistert hjemmefødsel
En uassistert hjemmefødsel er en fødsel uten kvalifisert helsehjelp. Dette er ikke ulovlig, men frarådes av leger, jordmødre og Helsedirektoratet.
Tall fra Medisinsk fødselsregister (FHI) viser at det var 20 planlagte uassisterte hjemmefødsler i tidsperioden 2020–2023.
Disse tallene inkluderer ikke uassisterte hjemmefødsler som ble overført til sykehus underveis i fødselen eller like etterpå, og gir dermed ikke svar på det totale omfanget.
Assistert hjemmefødsel
Assisterte hjemmefødsler er derimot planlagte hjemmefødsler med jordmor. Forskning viser at det er trygt, så lenge en jordmor påser at den gravide kvinnen oppfyller en rekke kriterier satt av Helsedirektoratet.
Å føde hjemme med jordmor er ikke en del av det offentlige helsetilbudet, men gis av privatpraktiserende jordmødre. Man må betale for det av egen lomme.
I 2023 fødte 140 kvinner hjemme med jordmor.
VG vil gjerne snakke med kvinner som har erfaring med uassisterte eller assisterte hjemmefødsler. Interessert? Ta kontakt med VGs journalist her.
– Dreier seg om mer enn medisinske utfall
Ellen Blix er tidligere jordmor, nå professor i jordmorfaget ved OsloMet.
Hun mener fødselsomsorgen trenger mer fokus på omsorg.
– Vi har verdens beste fødselsomsorg i lys av medisinsk utfall, men mange opplever fødselen som noe eksistensielt, som en livsovergang, at det dreier seg om mer enn medisinske utfall.
Er du fornøyd med fødselsomsorgen i Norge?
aJa!bNei!cVeldig blandet.
Studert kvinner som føder hjemme
Blix har blant annet utført en studie på kvinner som føder hjemme, uassistert.
Den kvalitative studien, fra 2020, har et utvalg på 12 kvinner.
I studiens konklusjon står det:
«Denne studien viste at motivasjon for frifødsel var innebygd i generell misnøye med dagens barselomsorg, det mangelfulle hjemmefødselstilbudet og dyp tillit til kvinnenes egen kapasitet til å føde»
– Det må være et mål om at fødselsopplevelsen skal bli så positiv som mulig. Men helsevesenet kan ikke alltid garantere det, for akutte ting og opplevelser skjer.
– Men å bli møtt med omsorg, det kan man gjøre noe med.
Hun understreker at det er en del av lovverket, at pasienter skal møtes med omsorg.
I studien ønsket majoriteten å føde med jordmor, opplyser Blix. Men fordi det for noen ikke var mulig på grunn at det ikke var jordmor tilgjengelig – eller de var utenfor seleksjonskriteriene – ble det altså uassistert.
– Også negative fødselsopplevelser på sykehus spilte inn i avgjørelsen om å føde hjemme uten helsepersonell, sier hun.
– Jordmødre i skvis
Blix understreker at jordmødre har det travelt og slik sett står i en skvis.
– De står også i en skvis i møte med kvinner som nekter undersøkelser, med tanke på å gi faglig forsvarlig fødselsomsorg, sier hun.
Les også: Flere gravide nekter undersøkelser: Jordmødre advarer
Hun sier at vi ikke må glemme at en kvinne i fødsel er sårbar:
– Det er nakenhet, hun er helt avhengig av andre, det er undersøkelser av kjønnsdeler. For noen er det uproblematisk, men for noen kan en slik setting være mer skadelig enn helsefremmende.
Behov for en endret fødselsomsorg
Vedeler, som har forsket på kvinners erfaringer, mener det er på tide å snakke om endring i fødselsomsorgen med mer fokus på det emosjonelle og relasjonelle.
– Det er behov for en fødselsomsorg som kan ivareta ulike typer kvinner med ulike behov og erfaringer.
– Er det realistisk med de ressursene vi har? Også med tanke på for eksempel jordmormangel.
– Ja, men vi må kanskje prioritere annerledes. Vi må klare å møte kvinner på deres ønsker og behov for omsorg og trygghet, og tilrettelegge for at jordmødre ønsker å bli i jobben.
Og negative fødsler har også en kostnad for samfunnet, understreker hun.
– Samfunnet kan ikke ta seg råd til å ikke investere i en god fødselsomsorg. Dersom vi ønsker at det skal fødes flere barn – må vi investere i god omsorg for de fødende og i den første fasen av livet.
Vedeler peker på at det i dag mangler kvalitetsindikatorer på omsorg i fødselstilbudet.
– Det bidrar til at den viktige omsorgen jordmødre gir forblir usynlig.
Alvorlige følger
Negative fødselserfaringer «har store konsekvenser» for kvinnen og barnets helse, sier hun. Det kan ha betydning for tilknytning, føre til problemer med amming, kan gi fødselsdepresjon, fødselsangst og så videre.
– Dette er alvorlige konsekvenser, sier Vedeler.",Error generating text.,no
