aid,title,author,image_url,published_date,article_url,category,raw_text,text,is_manipulated
11_07_04_2025,Kan vi stole på ekspertene?,Bjørn Stærk,https://premium.vgc.no/v2/images/8891bc50-eb27-4b21-b5a4-d4576cf051c6?fit=crop&format=auto&h=852&w=1616&s=8b2964b74a6044787464cf3f6d8ff8896c5c75a4,2025-04-06 18:00:00,https://www.aftenposten.no/meninger/kronikk/i/XjLKP7/kan-vi-stole-paa-ekspertene,Politikk,"Høyrepopulistenes ekspertskepsis bygger på en grunnleggende mangel på nysgjerrighet.
I usikre tider åpner vi oss for å tenke nytt og hente informasjonen vår fra nye steder. Gamle autoriteter kan over natten fremstå utdaterte.
Hvem kan hjelpe oss å med å forstå det nye USA Donald Trumps regjering er i ferd med å skape, og hva dette vil innebære for Norge? Neppe de samme kommentatorene som har tonet ned frykten for at han står for en radikal og autoritær vending i amerikansk politikk. Heller ikke de som har sett lyspunkter i Trump og Elon Musks hevngjerrige kampanje mot «woke» og «offentlig sløsing».
En klassiker i sjangeren er Kjetil Rolness' kommentar «Make sunn fornuft great again» fra 1. februar. Den kjører frem den velbrukte analysen om at høyrepopulisme er vanlige folks opprør mot en «like ekstrem» venstrebevegelse og deres venner blant meningseliten.
Er det noe i denne forklaringen? Jo da. To måneder senere kan vi likevel slå fast at det også er mye mer som foregår, og at de som i årevis har sagt at vi må lære av amerikanske kulturkrigere, ikke har forstått hvilken kamp de lot seg verve til.
Ekspertene bommer også
Men også eksperter med faglig tyngde er blitt tatt på sengen av det som skjer. De fleste forventet at Trumps andre presidentperiode ville bli som hans første. Krumspringene har kommet som et sjokk. Kan vi da stole på rådene de gir om veien videre?
Dette er ikke et nytt problem. Østblokkens fall kom like uventet på mange Sovjet-kjennere. I 1990-årene forsket Philip Tetlock på eksperters evne til å forutsi hendelser. Han fant at de gjorde det litt bedre enn «dartpilkastende sjimpanser», altså tilfeldig, men ikke særlig bedre enn «sofistikerte dilettanter», altså amatører som leser avisen.
Fra 2017 til 2020 gjennomførte Forsvarets forskningsinstitutt (FFI) en prediksjonsturnering hvor hundrevis av forskere, offiserer og andre skulle prøve å forutsi utviklingen i forholdet mellom Norge og Russland. Resultatet ble det samme. Ekspertene spådde knapt bedre enn amatørene, og ikke særlig bedre enn tilfeldig.
Noen gjør det mindre dårlig
Er eksperter dermed verdiløse? Ikke helt, fordi noen eksperter gjør det mindre dårlig enn andre. Tetlock fant at såkalte «rever», som har mange motstridende tanker, traff bedre enn «pinnsvin», som bare har én stor idé i hodet. Revene justerte seg også raskere når utfallet ble annerledes enn de forventet.
Er eksperter dermed verdiløse? Ikke helt, fordi noen eksperter gjør det mindre dårlig enn andre.
FFI fant på sin side at eksperter med god tallforståelse og evne til å unngå tankefeil gjorde det minst dårlig. Faktakunnskap og evnen til å ta uønskede konklusjoner på alvor var også en fordel. Slike «superforecastere» er dessuten flinkere til å vurdere sin egen treffsikkerhet, skriver FFI-forsker Alexander Beadle.
Noen ser altså verden klarere enn andre, og det finnes et ideal vi kan måle ekspertene mot. Men dette er lite til hjelp for deg og meg, der vi sitter blant stormkastene og skal ta stilling til den ene påståtte eksperten etter den andre.
Problemet går enda dypere enn dette. Noen ganger er også grunnsannhetene i fagfeltet ekspertene bygger på feil.
Tvilsom vitenskap
Det er lettest å se dette hvis vi går et stykke tilbake i tid. For hundre år siden var det få mennesker i Norge som hadde større tro på fornuft og vitenskap enn psykiater Johan Scharffenberg. Med ny forskning i hånd gikk han til kamp for å sterilisere omstreifere, vaneforbrytere, idioter og andre som visstnok hadde dårlige arveanlegg.
Scharffenberg var sterkt kritisk til tysk og amerikansk rasehygiene, som han mente var drevet av rasehat. Han forholdt seg til anerkjent vitenskap fra ledende forskere. Problemet var bare at vitenskapen var feil.
Historien er full av eksempler på eksperter og hele fagfelt som ikke har vært til å stole på
Historien er full av eksempler på eksperter og hele fagfelt som ikke har vært til å stole på. Det finnes ingen enkle svar på dette.
Tenk på dilemmaet homofile havnet i da aidsepidemien kom. Få år tidligere hadde ledende helseautoriteter fortalt dem at de var syke og burde kurere legningen sin. Nå kom de samme autoritetene og advarte mot en sykdom som visstnok bare kunne bekjempes ved at de innskrenket seksuallivet sitt.
Mange var skeptiske, med tragisk resultat. Det er som regel best å lytte til helseeksperter – bortsett fra når det iblant ikke er det.
Til krig mot vitenskapen
Det finnes ingen sannheter som kan heves over skepsis. Jeg er selv jevnlig kritisk til ting mange eksperter og samfunnseliten er enige om.
Men dermed er vi også tilbake ved start – og Trump-regimets krig mot ekspertise og vitenskap. Statsansatte fagfolk mister jobben. Forskere med politisk ukorrekte meninger holdet hodet lavt og tenker på emigrering. Farligst er situasjonen for utenlandske studenter, som risikerer å få visumet inndratt og bli arrestert på gaten.
Det finnes ingen sannheter som kan heves over skepsis
Er dette «sunn fornuft» fra «folkevettets naturlige forsvarere» som bare har sporet av litt? At tanken var god, men uheldigvis gikk det galt?
Jeg kan forstå de som svarer ja. I 2000-årene drev jeg en høyrepopulistisk blogg med mange av de samme kjepphestene vi ser i dag: Vi må forsvare frihet, vitenskap og sunn fornuft mot de venstreorienterte elitene.
Det var ærlig ment. Jeg ønsket ikke å ødelegge ekspertise og forskning, men å redde den.
Skepsis uten nysgjerrighet
En av faktorene som likevel drev meg bort fra dette miljøet, slik jeg skriver om i boken «Ingen tenker alene», var at jeg mistet troen på folkene jeg hadde endt opp sammen med. De var «skeptiske», men manglet troen på at det er mulig å lære noe nytt fra et uventet sted. De var ikke nysgjerrige.
Ett aha-øyeblikk kom da jeg begynte å lese de fæle akademikerne vi advarte mot, og kom frem til at de tydeligvis visste en del om det de snakket om. Jeg oppdaget at jeg liker kjedelige fagnerder, men befant meg blant folk som avskydde dem.
Det går en rett linje fra denne avskyen til politikken Trump og Musk fører i dag. Likeledes er det med holdningen deres til mennesker som er annerledes enn dem selv. Også i 2000-årene skrøt høyrepopulister av hvor kritiske de var til påstander om undertrykkelse. Aktivisme på vegne av underprivilegerte grupper var bare et skalkeskjul for særbehandling, hevdet de.
Å lytte med respekt
Kritisk skal man være, men de var ikke nysgjerrige på hvordan verden så ut for gruppene de var kritiske til. Det lå ingen tanke bak om at andre mennesker er eksperter på sitt eget liv og fortjener å bli lyttet til med respekt. At man kunne lære noe av å lytte til dem.
Uten slik nysgjerrighet fremstår de andre som barbarer, og når barbarene nekter å la seg veilede av oss opplyste kulturmennesker, må de knuses. Det går en rett linje herfra til Trump-regimets ønske om å skade sine fiender. Livet skal gjøres til et helvete for ulovlige innvandrere, transpersoner, politisk ukorrekte forskere og andre grupper man har irritert seg over i flere tiår.
Skepsis til ekspertene er ikke problemet her. Den trengs. Problemet er fraværet av åpenhet, respekt og nysgjerrighet på andre menneskers liv. Prosjektet var råttent fra starten, og nå står de fritt til å føre det til sitt naturlige endepunkt.",Error generating text.,yes
32_07_04_2025,Stor Syden-pågang: –⁠ Fortsatt dyrt å være nordmann,Jan Gustav Andreaasen,https://akamai.vgc.no/v2/images/3be8f780-55e5-449f-8286-d7a23f6aecae?format=auto&w=1080&s=55ecea61f98c285b044c5a80ab9ff90426eb8574,2025-04-07 03:21:41,https://www.vg.no/nyheter/i/yEM4Vx/syden-i-paasken-her-er-de-beste-reisetipsene,"Travel, Economics, Finance","Droppe fjellet i påsken? Du er i så fall ikke alene skal vi tro charterselskapene, som melder om fulle «påskefly».
For 13 minutter siden
Snart er det tid for å nyte sola – enten det er i hytteveggen eller under en parasoll.
Og mens vi venter på rentekutt, lønnsoppgjør og hvetemel til under 30 kroner kiloen, kan det jo kanskje være fristende med en liten utenlandstur.
VG har snakket med reisebyråer og en valutaekspert, og samlet deres heteste tips for deg som drømmer om litt ekte sydensol.
Selv om de klassiske charterflyene er i ferd med å fylles opp, er det fortsatt håp for dem som lengter etter sand mellom tærne.
Granca, Granca, Granca!
Gran Canaria troner på toppen som det desidert mest populære reisemålet, tett fulgt av Tenerife og Lanzarote.
Men ifølge Apollo har den greske øya Kreta for første gang kapret annenplassen foran de spanske «konkurrentene» Tenerife og Fuerteventura.
Beatriz Rivera i Apollo forteller at alle deres tradisjonelle charterreiser er utsolgt. Men med rutefly kan du fortsatt sikre deg en plass under parasollen.
I stedet for de klassiske Syden-favorittene trekker hun frem et mer uventet tips – nemlig Tunisia i Nord-Afrika.
– Det er et rimelig strandparadis med massevis av historie, deilig mat og kulturelle severdigheter – og sjansen er stor for at naboen ikke har vært der ennå, sier Rivera.
Hvilket reisemål frister mest i påskeferien?
aSyden!bStorby, shopping og kafé!cPåsken skal selvfølgelig tilbringes på fjellet.dIngen! Jeg vil heller være hjemme.
Eksotiske alternativer
Selv om Kanariøyene fortsatt troner på toppen av salgslistene, er bildet annerledes når man ser på hvilke destinasjoner som øker mest i popularitet.
– Thailand er ekstremt populært i år. Vi har solgt over ti ganger flere reiser dit sammenlignet med fjorårets påske, sier Anne Mørk-Løwengreen i TUI.
Hun tror økningen blant annet kan skyldes den nye sesongen av TV-serien «The White Lotus», som er spilt inn i nettopp Thailand.
Men det handler ikke bare om TV-glam og tropisk vibe. Økonomien spiller også en stor rolle når nordmenn velger reisemål, ifølge Mørk-Løwengreen.
– Nordmenn får mye mer igjen for hver krone i Thailand, med gunstig valuta og et mye lavere prisnivå enn på Kanariøyene. Flyturen koster noe mer, men mat, drikke, shopping, opplevelser og aktiviteter koster mye mindre.
Hva koster det?
VG har gjort en uformell sjekk av hva du kan få for pengene i påsken, for en familie med to voksne og to små, med fly og hotell inkludert.
Drømmer du om greske strender og blått hav? En uke i Kato Salos på Kreta koster fra 16.300 kroner.
Dersom du vil føle deg som kongen av Mallorca, kan du reise til Puerto Pollensa. En ukes ferie for en familie på fire starter på 22.500 kroner.
Føles én uke i solen litt snaut? Da kan du strekke påskeferien til ni deilige dager i Alanya. Her starter prisene på rundt 24.000 kroner.
Men hva sier økonomen?
Jan Ludvig Andreassen er sjeføkonom i Eika Gruppen, der han har hovedansvar for overvåkning av makroøkonomi i inn- og utland.
Å gi råd til reiselystne nordmenn nå er vanskelig, og selv med sine 35 fartsår innen finans sier han at rådene om valuta må tas med et haaaav av salt «i disse tider».
Årsaken? Den ustabile internasjonale situasjonen.
– Torsdag og fredag forrige uke falt den norske kronen med femti øre mot dollar og euro. Det har nesten aldri skjedd før, og handler om markedsuroen og tollsatsene til USA, forklarer Andreassen.
Likevel prøver han seg på noen lure «reisehacks»:
Ettersom dollaren er ned litt ned i år, og noen av ulike grunner har avbestilt eller utsatt planlagte USA-turer, kan det hende man får gode tilbud på reiser til for eksempel New York. Det vil hvert fall være billigere i år enn i påsken i fjor, forteller han.
Han påpeker også at siden påsken i år er sen, vil det være varme temperaturer i europeiske land og storbyer. Her vil euroen fremdeles være nokså høy, men ikke noe verre enn det den var i fjor.
For de europeiske reisemålene har han ett hett tips:
– Alltid gang med tolv når det gjelder euro, så unngår du å gå på en smell.
Når det gjelder dollar bør man gange med elleve.
– Så fortsatt dyrt å være nordmann i utlandet?
– Ja. Selv om dollaren er svakere er det fortsatt dyrt.
NOK PR. 1 EUR. Dagskurs: 4. april 2025 Foto: Skjermdump, Norges bank
På spørsmål om når det blir billigere å være nordmann i utlandet, og når den norske krona skal oppover, sier Andreassen at den internasjonale situasjonen må roe seg først.
Men så:
– Jeg har tidligere spådd dollaren til ni kroner. Dét har også den amerikanske investerings- og finansinstutsjonen Goldman Sachs gjort nå, sier han fornøyd.
Resonnementet er at verden går inn i en lavkonjuktur, mens det går bra i Norge. Dette kan gi oss en sterkere krone fordi vi har sterkere renter enn i utlandet, og fordi vi trekker sparepengene våre hjem når det er uro ute i verden.
Med andre ord: USA går dårlig mens Norge går bra, noe som kan føre til 10–15 prosent styrking av kronen.
Når dette vil skje, syns han er vanskelig å spå. Men at påsken 2026 vil være bedre for de reiselystne, er han ganske sikker på.
– Men det er enorme bevegelser i markedet, så alt kan skje!
Selv skal han være hjemme og pusse opp i påsken.",Error generating text.,no
31_07_04_2025,Penger å spare – men det er ikke så lurt,Bjørn Eirik Loftås,https://www.cdn.tv2.no/images?imageId=17616406&x=0&y=0&cropw=100&croph=100&panox=0&panoy=0&panow=100&panoh=100&width=1200&height=630,2025-04-06 15:18:00,https://www.tv2.no/broom/penger-a-spare-men-det-er-ikke-sa-lurt/17616201,Sport,"NAF har nettopp publisert sin årlige test av sommerdekk, og nok en gang er det premiumdekk fra kjente produsenter som får best skussmål.
Aller best ut kommer dekkene Michelin Pilot Sport 4 SUV og Nokian Hakka Black 3 SilentDrive – begge med 86 av 100 mulige poeng.
Billigdekk på bunn
I andre enden av skalaen finner vi lavbudsjettdekket Hifly Vigorous HP801 fra kinesiske Shandong Hengfeng, som scorer kun 54 poeng.
Dekket får blant annet sterk kritikk for at det ikke klarer å opprettholde kontrollen i brå svinger. Ifølge juryen er dekket totalt uegnet for tunge kjøretøy, som for eksempel elbiler.
– Det er helt klart stor kvalitetsforskjell mellom premiumdekk og billigdekk, sier senior kommunikasjonsrådgiver Nils Sødal hos NAF, til Broom.
Typiske problemer er dårlig veigrep og lange bremselengder – begge deler er kritiske egenskaper for bildekk.
– Noen av dem er greie på våt asfalt, men skikkelig dårlige på tørr asfalt, mens andre billige dekk er motsatt at de fungerer greit på tørr asfalt, men mister veigrep og vannplaner lett på våt asfalt. De takler rett og slett ikke alle underlag, sier Sødal.
Trenger ikke å kjøpe de dyreste
Samtidig understreker han at du ikke nødvendigvis må kjøpe de dyreste dekkene for å være trygg på veien.
– Det finnes dekk mellom de dyreste og billigste som er gode dekk. Uansett er det viktig å tenke sikkerhet ved dekkvalg. Dekkene er eneste kontakten bilen har med underlaget, og da må de være av god kvalitet, undertreker han.
Advarer mot spesialdekk
Ofte er det dekk fra de anerkjente produsentene som scorer best i tester, men det er ikke alltid en garanti.
– Det var et billigdekk som kom dårligst ut i år, men spesialdekkene var jammen heller ikke mye bedre, sier Sødal.
Dekkene han sikter til er såkalte miljødekk eller økodekk, som ofte er spesiallaget for elbiler. De har lav rullemotstand og sørger for god rekkevidde, men har lavere dekkmønster og presterer dermed dårligere på blant annet veigrep og oppbremsing på våt asfalt.
– Det er viktig å tenke på hvordan føreforholdene er der du kjører mest i hverdagen. Selv om dette er viktigere for vinterdekk, gjelder det også for sommerdekk. Bor du i et område med mye regn, er det viktig at dekkene er gode på våt asfalt og ikke vannplaner. De beste dekkene takler riktignok både tørr og våt asfalt bra, avslutter han.
Få også med deg denne:",Error generating text.,no
