aid,title,author,image_url,published_date,article_url,category,raw_text,text,is_manipulated
6_07_04_2025,Først demonstrerte hun. Nå prøver hun å velge den mest «uskyldige» osten,Aysun Yazici,https://www.cdn.tv2.no/images?imageId=17596037&x=0&y=14.72&cropw=100&croph=71.67&panox=0&panoy=14.72&panow=100&panoh=71.67&width=1200&height=630,2025-04-06 22:09:44,https://www.tv2.no/nyheter/utenriks/forst-demonstrerte-hun-na-prover-hun-a-velge-den-mest-uskyldige-osten/17604261,Politikk,"Hvilken ost bør velges? Hvilken sjokolade bør spises?
Tyrkiske «Selin» bruker mange timer i matbutikken, men for henne handler det ikke om å spise sunt.
For mat er politikk, og gjennom kjøpene hun gjør, tar «Selin» et politisk valg.
Og hun er langt fra alene om dette i Tyrkia om dagen.
– Urettferdighet, lovløshet og fattigdom plager oss. Vi ønsker ikke å bli arrestert for dette. Vi ønsker å vise at vi er her og eksisterer, sier «Selin» til TV 2.
En omfattende boikottkampanje pågår i Tyrkia for tiden.
Millioner av mennesker velger bort TV-kanaler, aviser og merker som annonserer hos medieselskaper som har et åpent og nært forhold til regjeringen.
«Selin» er en av mange tyrkere som deltar i en boikottkampanje.
Av sikkerhetsgrunner ønsker hun å være anonym i saken, men TV 2 kjenner hennes virkelige identitet.
– 301 unge har blitt fengslet etter demonstrasjonene. Tusenvis er pågrepet. Mange har blitt redde og tør ikke lenger gå ut i gatene, sier «Selin».
– For å fortsatt vise vår motstand, boikotter vi, sier hun.
Arrestert
Det hele startet da universitetet i Istanbul trakk vitnemålet til Imamoglu, som i praksis diskvalifiserer han fra å bli valgt som presidentkandidat.
Dagen etter, 19. mars, ble ordføreren pågrepet.
Han ble anklaget for korrupsjon, terrorstøtte og en rekke andre forhold.
Pågripelsen skjedde da det ble klart at Tyrkias største opposisjonsparti, Det republikanske folkepartiet (CHP), ville nominere 53-åringen som sin presidentkandidat.
Imamoglu blir sett på som den sterkeste utfordreren til president Recep Tayyip Erdogan.
Men nå sitter Imamoglu fengslet i Silivri høysikkerhetsfengsel utenfor Istanbul.
CHP-leder Ozgur Ozel kunngjorde en boikottliste etter at noen medier ikke viste demonstrasjonene i sendingene.
Lederen oppfordret alle til å unngå TV-kanaler som ikke dekker demonstrasjonene, og oppfordret til å boikotte selskaper som annonserer på disse kanalene.
– Kupp mot demokratiet
Tyrkiske «Can» deltok i demonstrasjonene. Nå boikotter han.
Av sikkerhetsgrunner ønsker han ikke å bli navngitt. TV 2 kaller ham derfor bare «Can».
Han forteller at Istanbuls ordfører er den første politikeren som har skapt håp hos ham, men at drømmene hans er nå knust.
– Imamoglu er en lovlig valgt ordfører, to ganger. Han har blitt et håp for millioner av mennesker som er lei av 23 år med Erdogan-regime. At Imamoglu er avsatt og fengslet, er rett og slett et kupp mot demokratiet, sier «Can».
Etter at Ekrem Imamoglu ble fengslet har partiet hans, Det republikanske folkepartiet (CHP), gjennomført et primærvalg for å nominere sin presidentkandidat. Mer enn 15 millioner velgere stemte på Imamoglu.
Dette viser opposisjonens makt, mener «Can».
Han sier mange i landet tror på demokrati, men at mange er svært bekymret for at deres opparbeidede rettigheter skal gå tapt.
– Ignorerer alt som ignorerer meg
Derfor gjør han alt han kan for å vise sin motstand. På samme måte som «Selin», har også «Can» begynt å boikotte.
Det gjør at han velger produkter med omhu i matbutikken.
– Jeg er veldig nøye med hva jeg kjøper. Jeg skulle kjøpe en sjokolade i forrige uke. Så tenkte jeg at selskapet har et veldig nært forhold til regjeringen, så da byttet jeg den ut med et annet merke, sier han.
– Hver dag vokser boikottkampanjen. Jeg elsker landet mitt og ønsker ikke å forlate det, men jeg ønsker å leve i et demokratisk land.
Presidenten og regjeringen er kritisk til boikottkampanjen og sier at det er skadelig for landets økonomi og folk.
«Can» er uenig i kritikken. Han ser ikke noe poeng med å se på regjeringsvennlige TV-kanaler som ikke dekker at millioner av mennesker protesterte i gatene.
– Jeg prøver å ignorere alt som ignorerer meg og mine rettigheter, sier han.
«Selin» er enig: Hun sier hun vil fortsette med kampanjen til Tyrkia får demokrati.
– I mange år har vi blitt fortalt at hvis man studerer og jobber, så vil alt gå bra. Men nå ser vi at dette ikke gjelder lenger. Våre opparbeidede rettigheter, som vitnemål, kan bli kansellert uten grunn.
– Vi må bare fortsette kampen - for jeg elsker landet mitt, sier hun til slutt.
Boikotter undervisninger
Boikottkampanjen gjelder ikke bare varer og TV-kanaler. Ved mange universiteter har tusenvis av studenter og akademikere bestemt seg for å ikke delta i undervisning.
I stedet demonstrerer de i gatene.
– Studentene ønsker ikke å delta i undervisning, fordi de så at et vitnemål kunne bli ulovlig kansellert i løpet av en natt. Så de ser ingen fremtid, sier Beyzade Sayin, som er representant for landets største studentorganisasjon, til +90.
– Jeg er her, ikke for å vise en støtte til en politiker. Jeg er her for rettferdighet og landet vårt, sier en student til +90.
Boikottkampanjen viser seg også i sosiale medier. Nå er det mange som oppfordrer hverandre til å blokkere kjendiser som ikke poster noe om fengslingen av Imamoglu og unge.",Error generating text.,yes
10_07_04_2025,Vil bevæpne studentene på universitetet,Kjetil Iden,https://www.cdn.tv2.no/images?imageId=17601583&x=0&y=0&cropw=100&croph=100&panox=0&panoy=0&panow=100&panoh=100&width=1200&height=630,2025-04-06 18:10:20,https://www.tv2.no/nyheter/utenriks/vil-bevaepne-studentene-pa-universitetet/17601418,Politikk,"For et stort flertall av nordmenn er politikken til USAs president Donald Trump svært annerledes og tidvis skremmende.
Men hva tenker unge amerikanere nå som han har vært president i snart to og en halv måned?
TV 2 er på besøk hos universitetet i republikanske Sør-Carolina i jakten på svar.
Liker innvandringspolitikken
Våren har kommet hit til campus, og studentene har helt andre ting å tenke på enn politikk.
Likevel kan kanskje disse unge, høyt utdannede menneskene i denne delstaten, hvor 60 prosent stemte på Trump, hjelpe oss med å forstå de gjorde det.
En av studentene her er Noah Lindner. Han er president for collegerepublikanerne.
– Jeg stemte på innvandringspolitikken hans og mener at han var det beste valget blant kandidatene, forteller Lindner til TV 2.
Nå slåss han for retten til å bære våpen inne på universitetsområdet.
– Jeg vokste opp landlig og skjøt mye. Jeg er trygg med våpen. Det er veldig viktig at folk får muligheten til å beskytte seg selv, sier Lindner.
Han er uenig i at mer våpen fører til mer utrygghet.
– Vi har en av de høyeste voldtektsstatistikkene i Sør-Carolina, blant de høyeste drapstallene, den høyeste overfallsraten og den høyeste kriminalitetsraten, argumenterer Lindner.
Fornøyd med kuttene
Noe av det han liker aller best med «Trump 2.0», er alle kuttene som gjøres i føderale etater og byråer.
– Når man blør så mye penger som landet vårt gjør, må man gjøre dype kutt til å begynne med, og så kan vi bygge det opp igjen for å være mer effektive, mener Lindner.
Han liker at både Trump og hans høyre hånd, Elon Musk, har bakgrunn som forretningsmenn.
– De kommer begge fra penger og vet hvordan forretninger fungerer.
Tempoet er skyhøyt i Trump-administrasjonen og nyhetene kommer løpende som Usain Bolt. Lindner følger med så godt han kan, selv om det har vært utfordrende.
– Jeg ser overskriftene, men jeg har hatt to eksamener og studert mye nå, sier Lindner, som legger til at han gjerne bruker helgen på å hente inn det tapte.
Kristne verdier
Sykepleierstudenten Aubrey stemte på Trump fordi hun mener at han har gode, kristne verdier.
– Vesten har definitivt blitt veldig liberal på noen områder, og jeg liker at han fremmer mer tradisjonelle verdier, sier hun til TV 2.
Den menneskejakten som Trump-administrasjonen har satt i gang blant innvandrere i landet, fremstår ikke som spesielt kristen verdimessig.
Aubrey vedgår også at Trump ikke alltid oppfører seg på en kristelig måte.
– Men det er det ingen kristne som gjør. Det er hele poenget med kristendom, ingen er perfekte kristne, mener Aubrey.
Samtidig er det ikke alle studentene på campus her som støtter Trump. Noen forteller om direkte frykt.
– Jeg har mange mørke og skeive venner som frykter for sitt eget ve og vel, og for hva de må tåle å leve med hvis det fortsetter slik, sier Red, som studerer sosialantropologi og historie.
Hun forteller at hun også er blitt en skyteskive for hets.
– Nylig kom det noen kjørende forbi med høyttalere, Trump-flagg og alt mulig. De spilte for full guffe og ropte «til helvete med pronomenene deres» og «dra tilbake dit dere kom fra», forteller Red.
– Det er skremmende å plutselig være uønsket i sitt eget hjem, legger hun til.
– Blir latterliggjort
Red tror ikke at de fleste på universitetet liker Trump, ei heller i resten av landet.
– Mange av oss ser på ham som en som blir latterliggjort av andre. Vi respekterer ham ikke, fastslår Red.
Likevel er de fleste amerikanerne TV 2 snakker med, strålende fornøyd med president Trump og lite bevisst på hvordan han fremstår for resten av verden.
Lindner ønsker til og med at USA melder seg helt ut.
– USA bør ikke involvere seg i utenrikspolitikk i det hele tatt. Jeg er veldig isolasjonistisk og mener at USA bør fokusere på seg selv først. Vi bør sette våre egne innbyggere først, før vi ser til resten av verden, sier republikaneren.",Error generating text.,yes
7_07_04_2025,Hardt ut mot Støre og Vedum: –⁠ Viser sitt sanne ansikt,Philippe Bédos Ulvin,https://akamai.vgc.no/v2/images/c7e3013a-9e37-4fa4-af91-a859246773a1?format=auto&w=1080&s=b57e0b13236794631e5eebfd3cbcb86e4dc4e004,2025-04-06 21:38:25,https://www.vg.no/nyheter/i/8qKy51/unge-venstre-leder-omar-yagci-mener-norsk-eu-nei-kan-vaere-putin-vennlig,Politics,"Unge Venstre-leder Omar Svendsen-Yagci er bekymret for at norsk sikkerhet svekkes dersom norsk EU-medlemskap ikke diskuteres.
Kortversjonen
Unge Venstre-leder Omar Svendsen-Yagci frykter svekket sikkerhet uten EU-medlemskap.
Han mener Norge baserer sin trygghet på flaks og advarer mot russisk innflytelse.
EU-medlemskap vil styrke norsk forsvar og beredskap, mener Svendsen-Yagci.
Han avviser kritikk om maktoverføring til EU-eliter som villedende.
Svendsen-Yagci ønsker norsk medlemskap i EU, men med forbehold, spesielt mot euroen.
– Jeg mener at EU-motstanderne løper Putins ærend. All den tid deres nei til EU først og fremst er et nei til Norges trygghet, sier Svendsen-Yagci.
Han reagerer på at statsminister Jonas Gahr Støre har stengt døren for en folkeavstemning om EU, og at Senterpartiet har lovet at «Norge aldri, aldri skal bli medlem av EU»:
– Venstresiden, Frp og ikke minst Senterpartiet burde tenke seg om to ganger. Den som kommer til å juble høyest for et norsk nei til EU, er Putin – ikke det norske folk.
Torsdag lanserte Arbeiderpartiet sitt slagord for valgkampen: « Trygghet for fremtiden ».
– I en urolig tid, vil jeg heller holde Norge samlet – enn å sende oss ut i en ny runde med for eller mot, sa Støre.
Svendsen-Yagci mener slagordet er en «vits».
Han viser til forsvarskommisjonen som har pekt på at EU-samarbeid vil styrke norsk beredskap og forsvarsevne – både gjennom militært samarbeid, mot desinformasjon og ved å bygge opp norsk forsvarsindustri.
– Bygger Norges trygghet på flaks
Unge Venstre -lederen mener Norge ikke har råd til å stå på utsiden av et stadig dypere forsvarssamarbeid i EU. Han er skuffet over at Støre slo ned forslaget fra Oslo Arbeiderparti om å gå inn for EU-medlemskap, «når tiden er rett».
– Der viste Støre sitt sanne ansikt. Han nekter å ta debatten og stå med våre allierte i Europa, samtidig som ukrainske soldater dør for det europeiske fellesskapet, sier Svendsen-Yagci.
– Det bekymrer meg at partier som Senterpartiet og Arbeiderpartiet i praksis bygger Norges trygghet på flaks, sier Svendsen-Yagci.
Til intervjuet med VG har han stilt opp med EU-flagg utenfor Russlands ambassade. Mens han advarer om russisk innflytelse, blir han forsøkt jaget vekk av ambassadens sikkerhetsvakt.
Yagci-Svendsen understreker at han mener EU også vil gi Norge en styrket evne til å stå imot russisk hybridkrigføring og desinformasjon.
Utover forsvarssamarbeidet, kan EU-medlemskap garantere strategiske goder som vaksiner, sier Yagci.
– Pandemien viste at det var flaks at vi fikk vaksiner fra EU. Det kan ikke være grunnlaget for trygghet.
AUF-leder: - Stødige forsvarere
Jonas Gahr Støre har ikke kunnet besvare Svendsen-Yagcis utsagn. AUF-leder Gaute Skjervø sier til VG at han er veldig uenig i kritikken.
– Det er ingenting nytt med at Unge Venstre er ivrige etter å melde Norge inn i EU. Mange er legitimt bekymra for europeisk sikkerhet nå. Men vår sikkerhetsgaranti kommer gjennom Nato, og det må vi verne om, sier Skjervø.
Han mener i likhet med sin partileder at det ikke er rett tidspunkt for «en opprivende norsk folkeavstemning om EU».
– Det kan potensielt sette EØS-avtalen i spill. Det er en dårlig idé i en urolig tid. Jeg er glad Støre og Arbeiderpartiet er stødige forsvarere av EØS og Nato, sier Skjervø.
– Udemokratisk
Under forrige folkeavstemning var Venstre og daværende partileder Odd Einar Dørum mot norsk EU-medlemskap. Grunnen var blant annet at Dørum mente EU-medlemskap strider med norsk selvbestemmelsesrett og grunnlovens paragraf 115.
Siden har gradvis partiet snudd tvert om og under landsmøtet i starten av mars lanserte Venstre folkeavstemning om EU som sin fremste sak.
Unge Venstre-lederen sier at han selv er en ihuga EU-tilhenger, blant annet fordi EUs politikk ender opp med å være gjeldende i Norge gjennom EØS.
– Norge får ikke være med å forme politikken – mens Jonas Gahr Støre må drikke pils i baren mens de andre topplederne bestemmer.
Ungdomspolitikeren ønsker seg norske folkevalgte i EU-parlamentet, plass i EU-kommisjonen og innflytelse i Rådet.
Avviser elitekritikk
Senterparti-leder Vedum har på sin side fastholdt at norsk EU- og EØS-medlemskap overfører makt til «dresskledde eliter i Brussel».
– Det stemmer ikke. Alle i Norge har interesse av et tettere samarbeid med våre allierte. Det handler om trygghet og beredskap. To tredjedeler av befolkningen i EU støtter medlemskapet – det er folkelig forankret. Også i våre naboland har støtten økt, nettopp fordi de ser verdien av fellesskapet, svarer Svendsen-Yagci.
Ønsker forbehold
Selv om ungdomspolitikeren fra Gjøvik ønsker seg inn i EU, er han ikke begeistret for alt statsforbundet har å tilby, som euroen. Han tror også at det vil bli mulig å ivareta interessene til norske landbruk og fiskeri.
– EU er ikke en trussel mot norsk suverenitet. Mange EU-land har forbehold – det kan også Norge ha. Jeg tror for eksempel at vi bør ha forbehold mot euroen. Norsk økonomi er oljeavhengig og trenger fleksibilitet i pengepolitikken. Det kan vi forhandle om, sier Svendsen-Yagci.",Error generating text.,no
21_07_04_2025,Sjeføkonom: Norge gjør lurt i å avvente tollforhandlinger,Journalist,https://www.tu.no/_neste/ogTU.png,2025-04-06 22:20:00,https://www.tu.no/nyhetsstudio/sjefoekonom-norge-gjoer-lurt-i-aa-avvente-tollforhandlinger/75546,Økonomi og næringsliv,"Flere land har gått i tollforhandlinger med USA og Donald Trump. Norge gjør lurt i å avvente, mener sjeføkonom, som sier den kommende uka vil gi flere svar.
USAs president Donald Trump og hans drastiske tolløkninger sendte før helgen sjokkbølger gjennom aksjemarkeder over hele verden.
Spillereglene i verdenshandelen er i ferd med å endres med «Trumpomania», sier sjeføkonom Kyrre M. Knudsen i Sparebank 1 Sør-Norge.
– Vi er ekstra spente på hvor lenge Trump vil fortsette med politikkendring som minner mer om selvskading enn riktig dreining av den amerikanske økonomien, sier han til NTB.
Flere land i forhandlinger
Over 50 land har slengt seg på telefonen for å forhandle om tollkutt med USA, ifølge Det hvite hus.
Uken vi har foran oss, vil gi flere svar på hvordan de kommende tollforhandlingene vil bli, sier han.
– Hvor langt ønsker Trump å strekke strikken med fare for å ødelegge for folk og bedrifter i USA? Hvordan vil de respektive land reagere: vil de svare med økte tollsatser eller vil de gå i forhandlinger, sier Knudsen.
– Lurt å avvente
Land som Taiwan og Zimbabwe vil fjerne all toll på amerikanske varer. Vietnam har bedt USA innstendig om å utsette toll på import fra landet.
– Norge gjør nok lurt i å avvente, særlig fordi det er hvordan EU rammes som betyr mest for norsk økonomi. Responsen fra EU får vi vite mer om denne uken, sier Knudsen.
– Trolig er det mer å hente på konstruktive og smarte forhandlinger enn å respondere med økte tollsatser. Jeg håper derfor vi denne uken vil se at EU gir signaler om at de er klare for forhandlinger. I så måte var det et interessant oppspark fra Elon Musk i helgen hvor han sa at han ønsket seg tollfri handel mellom USA og Europa.
Vil avklare tollsatsene mot Norge
Utenriksdepartementet er i løpende kontakt med amerikanske myndigheter om USAs tollsatser mot Norge, sier utenriksminister Espen Barth Eide til Dagens Næringsliv søndag.
– Vi jobber blant annet med å avklare hvilken tollsats som gjelder for norske varer, og andre spørsmål for avklaring, sier Eide.
– Vårt budskap er fortsatt at slike tollsatser er en dårlig idé. Ingen land er tjent med handelskrig og økte tollmurer. Alle land taper på handelskonflikt. Vi ønsker å redusere toll mot Norge, og derfor vil vi nå koordinere videre oppfølgning med våre nærmeste handelspartnere, understreker Eide.
Kraftige børsfall
Fredag raste Oslo Børs ned 5 prosent, det største fallet siden mars 2020 da pandemien stengte ned landet.
På børsene i New York var det nye kraftige fall fredag, og indeksen S&P 500 stupte 6 prosent. Dax-indeksen i Tyskland og FTSE 100 i London falt begge rundt 5 prosent.
I København stupte indeksen C25 6,2 prosent, og fallet her var det nest største siden indeksen ble etablert i 2017.",Error generating text.,no
30_07_04_2025,Kritikken hagler etter stygg ulykke i Grand National 2025,Jarle Fredagsvik,https://gfx.nrk.no/pGivPywOnEq1r0T1wN19jQtM2GMCgtiLO9OQl0wcA-Gw.png,2025-04-06 20:16:30,https://www.nrk.no/sport/kritikken-hagler-etter-stygg-ulykke-i-grand-national-2025-1.17372109,Sports,"Lørdag falt hesten Broadway Boy stygt etter å ha kollidert med et hinder.
Rytteren ble kastet av hesten og deiset i bakken. Bildene fra løpet viser at den syv år gamle hesten lander med hodet først og blir liggende på gresset.
Ulykken føyer seg til i en lang rekke av stygge hendelser fra Grand National; det prestisjetunge løpet er kjent for å være hardt.
– Man kan ikke tøye grenser i det uendelige. Dette løpet har stor fart, høye hinder og vanskelighetsgrad. Det er for tøft, og burde ha vært forbudt, sier Inger Lise Andersen.
Hun er professor i etologi og dyrevelferd med fokus på gris og hest.
OMSTRIDT: Britiske Grand National har fremdeles sine fans i England, men rittet har også skaffet seg sine motstandere i løpet av sin forholdsvis blodige historie. Foto: Danny Lawson / AP / NTB
– Hester dør hvert år
Ifølge avisen The Guardian skal tilskuere ha beskrevet hendelsen som «grusom».
– Hestene fortjener bedre, sier Ben Newman i organisasjonen Animal Rising til den britiske avisen.
Han mener sporten prioriterer profitt foran dyrevelferd. Vinneren av løpet soper med seg rundt 7 millioner kroner i premie.
Men under halvparten av hestene kom til mål. 34 hester sto på startstreken.
16 kom til mål.
– Det er hårreisende og ikke forsvarlig i det hele tatt, sier Inger Lise Andersen til NRK.
Åshild Roalset er representant for dyrevern hos Dyrebeskyttelsen Norge. Hun mener arrangøren kunne ha bedret sikkerheten for dyrene, dersom det var ønskelig:
– I Grand National venter man vel omtrent at én eller flere hester dør hvert år, det er jo nesten for normalen å regne. Det er veldig mange årsaker til at hestene kan ende opp med å miste livet, sier Roaldset til NRK.
– Grusomt
Det er lagt opp til at det skal være ekstremsport for hestene, med veldig mange og høye hindre. I tillegg foregår det på gress, noe som gjør at underlaget kan være sleipt.
– I sum gjør alt dette at det er normalt at noen hester dør fordi det er lagt opp så ekstremt. Man kunne gjort mye mer for å forebygge at hester blir skadet enn det man har gjort. De verste skadene ender med at hesten blir skutt på banen, sier Roaldset overfor NRK.
Fakta om Grand National
Tross den flengende kritikk blant annet fra fra dyrevernerne, er det fortsatt mange tradisjonsrike briter som trykker Grand National til sitt bryst. Ifølge Wikipedia har hesteveddeløpet et sted mellom 500 og 600 millioner seere årlig. Fram til 2013 hadde BBC rettighetene selv.
Tall fra blant annet Metro og The Telegraph har 66 hester dødd i løpet av Aintree-festivalens tre dager siden 2000. Kun for Grand National-lørdagen har antall døde hester kommet opp i 88 siden den første konkurransen tilbake i 1839.
I 1993 ble rittet avlyst etter en rekke tjuvstarter (30 av 39 jockeyer var involvert i én av dem), mens rittet ble utsatt til en mandag i 1997 på grunn av bombetrussel.
I 2020 ble rittet innstilt på grunn av koronaviruset. Året etter var rittet tilbake, med det resultat at både «The Long Mile» og «Houx Gris» døde underveis.
I 2023 ble starten av Grand National utsatt på grunn av protester fra nettopp dyrevernere.
Kun én jockey har mistet livet i forbindelse med løpet. Det skjedde i 1862, da Joseph Wynne mistet livet i en hendelse der flere andre hester var involvert i forbindelse med passeringer av «The Chair».
Roalset svarer følgende på spørsmål om hva hun synes om Grand National slik det gjennomføres i dag:
– Jeg synes det er grusomt. Vi kan ikke ha en slik hestesport der det er lagt opp til at hestene kan ende opp med å dø. Slike ulykker skjer dessverre ofte, så man kan heller ikke si at det kommer som noen overraskelse.
Hun mener dette aldri kunne skjedd på en vanlig arbeidsplass.
– Da hadde man hatt en HMS-ansvarlig som hadde identifisert farer og risikoer underveis. Med enkle grep kunne man ha redusert antall døde og skadde hester, men man gjør det likevel ikke.
MANGE ULYKKER: Her får hesten «Frazier Island» hard medfart under Grand National i 1999. Hesten «Eduipe» ble senere avlivet i forbindelse med samme hendelse. Foto: IAN HODGSON / Reuters / NTB
88 hester har dødd siden oppstarten
Siden oppstarten i 1839 har 88 hester mistet livet i forbindelse med hesteveddeløpet Grand National, skriver Metro.
Sist uke ble en hest avlivet etter en kollisjon i et løp.
– Galopphestene er avlet for å løpe raskt, men dette løpet innebærer altfor stor belastning og skaderisiko for hestene. Derfor er det uetisk, sier Andersen.
FORTSATT POPULÆRT: Også i 2025 er Grand National en stor greie i England. Rittene foregår ved Aintree Race Course utenfor Liverpool. Foto: Phil Noble / Reuters / NTB
Gjorde flere grep
I fjor tok arrangørene flere grep for å bedre sikkerheten. Et av grepene var å redusere feltet fra 40 til 34.
Da kom man seg unna uten tragiske hendelser.
En talsperson fra Det britiske hesteveddeløpsforbundet (BHA) svarer følgende på kritikken etter lørdagens konkurranse:
– Som ved alle annen sport eller aktivitet som involverer hester, så er det umulig å fjerne risikoen helt. Raten for fatale skader i forbindelse med disse løpene gjelder 0,44 prosent av alle startende. Vi ønsker å være åpne og ærlige om risikoen som er gjeldende, sier en talsperson for BHA ifølge The Guardian.
Fortsatt mener Andersen at dette er langt over streken.
– Mange hopper over samme hinder samtidig, og risikoen for skader på både hest og rytter er ekstremt stor, sier professor Andersen.
– GRUSOMT: Åshild Roaldset i Dyrebeskyttelsen mener arrangøren med enkle grep kunne redusert risikoen for hestene som årlig blir sendt ut for å konkurrere under Grand National. Hun synes konkurransen er grusom å se på. Foto: Dyrebeskyttelsen
Roaldset mener de ansvarlige kunne gjort mye mer for å ivareta dyra:
– Det er også mye man kunne ha gjort med formatet. De kunne blant annet skalert ned hindrene og hatt færre hester på banen. Jeg tror de frykter at det skal bli mer likt en del av de andre konkurransene, og at dermed kan ende opp med ikke å trekke like mange tilskuere, sier Roaldset.",Error generating text.,no
