aid,title,author,image_url,published_date,article_url,category,raw_text,text,is_manipulated
8_07_04_2025,Future-handelen i USA åpner skarpt ned – indikerer globalt børsfall mandag,Janne Johannessen,https://images.dngroup.com/image/eyJ3IjoxMjAwLCJmIjoid2VicCIsImsiOiJlYzBjN2I3NmQ3ZDgxMDVjYmNiNDEzYmE0NGE2ZTg2MyIsImNyb3AiOlswLDIwMCwyNDAwLDEyMDBdLCJyIjoyLCJvIjoiZG4ifQ,2025-04-06 20:12:47,https://www.dn.no/makrookonomi/usa/donald-trump/elon-musk/future-handelen-i-usa-apner-skarpt-ned-indikerer-globalt-borsfall-mandag/2-1-1803318,"Business, Finance, Politics, Economics","Prøv DN i 4 uker for 1 kr
Full tilgang til de viktigste nyhetene om næringslivet.
Bestill
Amerikanske aksjer faller bratt i førhandelen, et tegn på at bunnen langt fra er nådd for børsene.
Oppdatert for 6 minutter siden
Da future-handelen åpnet ved midnatt norsk tid faller de ledende amerikanske børsindeksene med rundt fem prosent. Det gjelder både Dow Jones, S&P 500 og Nasdaq, altså et bredt fall.
Det kan være et varsel om en blytung dag på verdens børser, først i Asia i natt, før børsene i Europa åpner mandag morgen, og Wall Street på ettermiddagen. Dette kommer på toppen av det kraftige børsfallet torsdag og fredag, etter at president Donald Trump la frem sin tollpakke sent onsdag.
Tollstrid i Washington
Samtidig utfordres toll-idyllen i Trump-administrasjonen. To av Donald Trumps topprådgivere, Elon Musk og Peter Navarro, har havnet i åpen konflikt om toll.
Mens president Donald Trump har brukt helgen til å spille golf i Florida, har flere av hans toppfolk på økonomi og toll tatt runden til tv-studioene for å forsvare og forklare etter sist ukes børskollaps.
Trumps trofaste våpendrager, Tesla-sjef Elon Musk, har hele tiden støttet helhjertet opp om presidentens økonomiske politikk, inkludert hans forkjærlighet for toll. Men i helgen gikk Musk ut og sa at det ville være å foretrekke en frihandelssone bestående av Europa og Nord-Amerika (se video).
Musk reagerte også da en bruker på hans sosiale plattform X forsvarte Peter Navarro, Trumps seniorrådgiver på handel og industri, og påpekte at han har en doktorgrad i økonomi fra Harvard.
«En doktorgrad i økonomi fra Harvard er en dårlig ting, ikke en bra ting», meldte Musk, og antydet at Navarro har problemer med sitt ego.
Musk fortsatte i en senere og nå slettet melding med å omtale Navarro som «bullshit».
Mener Musk kun er en bilselger
Navarro regnes blant arkitektene bak Trump-tollen.
Navarro nølte da heller ikke med å gå rett i strupen på Musk, og mer enn antyder at Musk kun er ute etter å mele sin egen kake, altså å selge flere Teslaer. Han mener Musk ikke forstår hvordan toll virker, og hvordan andre land svindler USA.
– Det som jeg mener er viktig å forstå med Elon er at han selger biler, det er det han gjør. Han beskytter bare sine egne interesser, som alle forretningsfolk ville gjøre, sa Navarro, ifølge Axios.
Navarro insisterer på at det ikke er noen uenigheter i Trump-administrasjonen, og at Musk må få si hva han vil.
Det er tidligere kjent gjennom et lydopptak at visepresident J.D. Vance er svært misfornøyd med Musk og den makten han har i administrasjonen.
Men alle ryktene om et snarlig brudd mellom Trump og Musk lar vente på seg, og de to omtaler hverandre i svært fordelaktige ordelag.",Error generating text.,no
18_07_04_2025,Sykepleierkrisen: Natalie hoppet av etter syv måneder,Bjørn Haugan,https://akamai.vgc.no/v2/images/fad0a925-fee2-4942-95ed-307e2fdf0cb3?format=auto&w=1080&s=c7565e064005324a73c6938110ec2ea0baa5c293,2025-04-06 10:26:22,https://www.vg.no/nyheter/i/Avm6rr/natalie-bergan-kjaeraas-23-ga-opp-sykepleieryrket,Health,"På en benk foran Stortinget sitter en 23 år gammel sykepleier og en fagforeningssjef som rister på hodet – og slår alarm.
For 6 minutter siden
Kortversjonen
Nyutdannet sykepleier Natalie Bergan Kjæraas (23) sluttet etter syv måneder på grunn av lav bemanning og høy arbeidsbelastning.
Fagforeningsleder Steffen Handal slår alarm om en økende krise i helsesektoren.
Handal krever bedre bemanning og skroting av Ventetidsløftet.
Kjæraas håper å vende tilbake til yrket om arbeidsforholdene bedres.
Natalie Bergan Kjæraas (23) gledet seg enormt til å bli sykepleier. Det varte ikke lenge. Nå jobber hun i en butikk.
– Jeg skulle så gjerne fortsette som sykepleier og jeg håper inderlig at det skjer igjen, men erfaringene mine hittil tilsier ikke det, sier hun.
Bergan Kjæraas er en nyutdannet sykepleier som sluttet etter syv måneder i yrket.
– Jeg visste at jeg ville bli sykepleier allerede fra jeg var 16 år. Jeg gikk helse- og oppvekst på videregående. Så tok jeg sykepleierutdanningen, hvor jeg jobbet ved siden av i hjemmetjenesten. Jeg begynte å jobbe, først i hjemmetjenesten, så på Ullevål.
– Med et så brennende ungt hjerte for yrket du ville bli i; du må forklare hvorfor du hoppet av etter under ett år?
– Det var ikke nok folk. Man tar på seg veldig mange arbeidsoppgaver, altfor mange. Man kunne alltid ønske at man kunne strekke seg enda lenger. Men så opplever du at du ikke strekker til. Du får ikke gjort det du mener du burde fått tid til å gjøre.
– Konstant dårlig samvittighet
Hun sukker og legger til.
– Du rekker veldig ofte ikke å sette deg ned for å slå av en prat med alle de vi er innom i løpet av en dag. Mange er veldig ensomme, spesielt de som bor alene. Selv om de så gjerne vil prate litt, så må du bare beklage og si at du må dra videre fordi det er andre som venter på meg. Det gir konstant dårlig samvittighet.
– Så er det en tøff jobb, med sykdom og dødsfall og fysisk tøff jobb, fordi vi ofte må løfte beboerne, legger hun til.
Hun sier hun har omtrent samme erfaring fra sykehuset.
– Det er lav bemanning, manglende ressurser og alltid dårlig tid.
23-åringen kom til at hun måtte sette seg ned og ta et valg.
– Er det dette jeg vil gjøre resten av arbeidslivet, spurte jeg meg selv.
– Jeg kom til at jeg måtte innrømme at svaret er nei.
– Da bør alarmen gå
Han ved siden av henne på benken, er leder Steffen Handal i Unio, hvor de fleste sykepleierne i Norge er medlemmer.
– Når unge mennesker som Natalie, som virkelig ønsker å være sykepleier, hopper av, da bør alarmen gå. Da er noe riv ruskende galt:
– Det er krise i helsesektoren og den kommer til å bli verre, fordi det blir mange flere eldre fremover, som vil ha behov for hjelp og pleie. Vi må sørge for at Natalie og hennes kollegaer får nok kollegaer rundt seg.
– Springer beina av seg
Han sier at Norges største problem er mangel på arbeidskraft fremover.
– Vi klarer ikke å bemanne tjenester Norge er helt avhengige av, innen helse- og omsorgssektoren. De må bemannes godt nok. Det skjer ikke i dag, og bidrar til at Natalie og mange andre slutter. Det skjer i en tid hvor det er behov for flere sykepleiere, ikke færre.
– Da kan vi ikke ha valgflesk og urealistisk politikk som Ventetidsløftet.
– Hvorfor er Ventetidsløftet mislykket?
– Våre folk springer beina av seg i dag. Alle vil ha ned ventetidene, men det hjelper ikke på bemanningen at Vestre lover at ventetiden skal bli kortere. Det våre medlemmer opplever som konsekvens, er at de må løpe enda fortere. Det er fullstendig feil medisin og bidra til at flere vil forlate jobbene sine.
Lenger nede i saken blir han motsagt av forbundsleder Lill Sverresdatter i Norsk Sykepleierforbund, som er et forbund i Handals Unio.
– Ventetidsløftet bør skrotes
– Det andre problemet er at det kan flytter arbeidskraft, ikke ut ifra det medisinske behovet, men hvor det politiske ønsket er: Dersom Helseforetakene flytter folk til der de kan ta ned ventelistene, i stedet for der det er medisinske behov, vil det være svært uheldig.
Handal sier det mangler 4300 sykepleiere, spesialsykepleiere og jordmødre. Og at det må utdannes 18.000 nye sykepleiere innen 2030 og 30.000 innen 2040.
Han har ett budskap til Ap:
– Ventetidsløftet bør skrotes. Alle vil ha ned ventetidene, men det kan bare gjøres ved å ha god nok bemanning. Ventetidsløftet bidrar til at folk må løpe enda mer. Det kan godt hende det bidrar til at helseministeren kan skryte av at ventetiden går ned, med det vil bare være på kort sikt.
Han legger til:
– Og det er en politikk som gjør at flere vil slutte, helt det motsatte av det vi trenger. Vi trenger at flere har lyst til å bli sykepleiere. Det som skjer nå bidrar ikke til det, snarere tvert om.
Handal sier at krisen kan bli større.
– Med veksten i antallet eldre i årene fremover, så må det rekrutteres veldig mange flere sykepleiere. Med dagens politikk, kommer ikke det til å gå. Det er en krise for landet.
Vi spør Natalie som må til for at hun skal komme tilbake til sykepleieryrket.
– De må bruke mer penger til å øke grunnlønn, for å få flere til å velge yrket vårt. Men før det må de øke grunnbemanningen, slik at arbeidsbelastningen blir mindre. Du må ha tid til å gjøre en jobb. I dag opplever jeg at vi bare kjører fra hjem til hjem, med evig dårlig samvittighet overfor ensomme mennesker som du får brukt for kort tid på.
Hun ser på oss.
– Det er ingenting jeg mer ønsker enn å komme tilbake til sykepleieryrket. Men da må det bli mye mer attraktivt.
Vestre vil lytte
Helse- og omsorgsminister Vestre ønsker å treffe Natalie.
– Jeg tar utfordringene til Natalie på høyeste alvor og vil gjerne invitere henne til departementet for å høre det direkte fra henne. Gode tiltak for å rekruttere og beholde sykepleiere er helt avgjørende for å sikre vår felles helsetjeneste for fremtiden og her må vi alltid ta oss tid til å lytte til de som har skoene på.
Han sier at Ventetidsløftet er et partnerskap hvor Fagforbundet, Norsk Sykepleierforbund, Legeforeningen, Delta, Psykologforeningen, Spekter, Virke, NHO Geneo og de fire regionale helseforetakene og regjeringen jobber sammen for å få ned ventetidene i helsetjenesten.
– For å få til dette jobber vi med tiltak som å fjerne tidstyver og sikre bedre oppgavedeling; så sykepleiere og andre fagfolk kan bruke tiden sin på pasientene. Ekstra poliklinikk på kveld og helger er kortsiktige tiltak, som gjennomføres i tillegg nå i en periode for å ta unna det ekstraordinære etterslepet etter pandemien. Det skal være hundre prosent basert på frivillighet.
Uenig med sjefen
Norsk Sykepleierforbund (NSF) er en del av partnerskapet til Ventetidsløftet.
Sykepleierforbundet er et av forbundene i hovedsammenslutningen Unio, som Handal leder.
De støtter ikke sjefen, Handal, som altså ber politikerne skrote Ventetidsløftet.
– Her kan det se ut som om Handal ikke er helt oppdatert. NSF er partner i Ventetidsløftet, ikke Unio. NSF er fornøyd med partnerskapet, har bidratt sammen med flere Unio-forbund og støtter intensjonene i løftet. Det er likevel problemer med gjennomføring og involvering i tjenestene. Der har direktørene en jobb å gjøre. Partnerskapet får verdi når det fungerer ute i tjenestene, sier hun.",Error generating text.,no
24_07_04_2025,Kan Kina dra nytte av Trumps nye tollar i Afrika?,Vegard Tjørhom,https://gfx.nrk.no/8LSrO8fQCP-Jfm1zzauwRQpPJ81vy8AUOA1qfiQziRuw.jpg,2025-04-06 11:54:24,https://www.nrk.no/urix/kan-kina-dra-nytte-av-trumps-nye-tollar-i-afrika_-1.17371464,"Politics, Economics, Business","Kvinnene bak symaskinane jobbar så raskt dei kan i eit fabrikklokale utanfor Maseru, hovudstaden i Lesotho.
Investorar frå Taiwan har laga fabrikken der det vert produsert for verdskjente merke som Levi's og Calvin Klein. Og eksporten til USA er stor i det vesle landet som har omfamna Agoa «The African Growth and Opportunity Act».
Agoa er avtalen som skulle få USA tilbake i den afrikanske manesjen etter at Kina i årevis har fått betre og betre fotfeste i Afrika.
Avtalen opnar for tollfri eksport til USA, og har eksistert sidan 2000. Seinast i fjor forlenga Joe Biden avtalen, og lova nye store investeringar.
I bytte får USA betre tilgang til afrikanske marknadar, og råstoff og mineral som amerikanske bedrifter treng for å vinne handelskampen – mellom anna mot Kina.
No står heile Agoa i fare, etter at Trump den siste veka innførte toll mot 20 afrikanske land.
Fleire afrikanske land har i ei rekke år hatt null-toll til USA. Nå innfører Donald Trump skyhøge tollsatsar.
Enorm toll for vesle Lesotho
Og Lesotho kom verst ut av det. For dei har vore gode på å få til eksport til USA.
Dei siste åra har tekstilproduksjonen vakse, og det vesle landet med rundt 2 millionar innbyggjarar eksporterte klede for 2,5 milliardar kroner i 2024. Eksporten til USA utgjer heile 10 prosent av det vesle landets brutto nasjonalprodukt.
Når det gjeld import er Lesotho veldig avhengig av Sør-Afrika, som omringar Lesotho på alle kantar. Dei fleste varer kjem inn via Sør-Afrika, og få amerikanske varer blir importert direkte til Lesotho.
Fleirtalet av de som har jobb i Lesotho jobbar i klesindustrien. Nå fryktar de for Trump sine høge tollsatsar Foto: AFP
Dermed slår Trump-administrasjonens reknemåte veldig dårleg ut for Lesotho.
Trumps tal viser at Lesotho påfører USA 99 prosent toll. Men det heile handlar eigentleg om måten Trump reknar på.
For Lesotho har på papiret langt større eksport til USA, enn import frå USA. Med andre ord er det handelsbalansen mellom landa som Trump synest er problematisk, og ikkje Lesothos tollsatsar. Trump svarar med å innføre 50 prosent toll på alle varer frå Lesotho.
Les også Trump hevdet tollen var et motsvar: – Ingen voksne mennesker mener dette henger på greip
– Me såg aldri dette komme, seier Ricky Chang til Reuters.
Han er direktør ved Nien Hsing, det taiwanske selskapet som står bak ein av fabrikkane som skapar arbeidsplassar i Lesotho.
Det vesle landet førebur no ein delegasjon for å reise til USA og forhandle.
– Eg har fått ei forståing av at president Trump er ein forhandlar, seier handelsminister i Lesotho Mokheti Shelile til Reuters, han kallar den nye tollen «sjokkerande».
Handelskrigen med Kina
Trump har tidlegare antyda at han ønsker handelskrig med Kina.
Stadig mindre tyder på at han i så fall ønsker å vinne den kampen på afrikansk jord, slik hans forgjengarar var mest opptekne av.
Dei har forsøkt å ta ein større del av kaka i Afrika, og dermed få tilgang på råvarer som USA treng for å utvikle eigen økonomi. Difor såg Agoa dagens lys under Bill Clinton i 2000.
Å fjerne handelsbarrierar og tollmurar har blitt sett på som eit tiltak for å stimulere til meir handel med utviklingsland. Noreg er blant landa som har tollfritak for fleire av dei minst utvikla landa i verda.
Trump sender ut heilt motsett signal når han no aukar tollen til tjue afrikanske land.
Donald Trump presenterte sine nye tollsatsar denne veka. Det vil ramme afrikansk næringsliv hardt. Foto: Reuters
Sjølve tollsatsane vil ramme dei tjue landa ulikt. For nokre av landa har lite handel med USA, og handlar meir med andre afrikanske land, men også Europa og Asia.
Men for enkeltbedrifter som har produsert varer for den amerikanske marknaden er den nye tollen krise, og dei langsiktige og indirekte konsekvensane er også ein trugsel for afrikanske økonomiar.
Fleire land i Afrika har mykje utanlandsgjeld, og stor arbeidsløyse. Ein nedkjølt verdsøkonomi og høgare inflasjon, vil difor skape vanskar i fleire land.
Den nye tollen kjem berre på toppen av alle dei massive kutta i bistand frå USA. Dette har ramma spesielt mange av Afrikas fattigaste, mens tollane vil ramme arbeidarklassen og bedriftseigarane hardast.
Les også Veronica fortviler over Afrikas store gjeldsproblem
Kan Kina utnytte situasjonen?
Signalet som Trump sender til Afrika er vanskeleg å tolke som positivt slik det ser ut no.
Difor er det langt meir attraktivt for afrikanarane å vende seg mot meir stabile handelspartnarar som EU, Kina og Russland.
Dette er altså det motsette av det USA har forsøkt å få til gjennom dei 25 åra Agoa har eksistert. Og sannsynlegvis også det motsette av kva fleire amerikanske bedrifter faktisk ønsker.
For dei må framleis ha råvarer og mineral som ikkje finst i USA, men i Afrika – og som no blir langt dyrare å importere til USA.
Les også Trump river ned det internasjonale handelssystemet
Kanskje vil fleire amerikanske bedriftsleiarar som treng å importere frå Afrika få sagt frå tydeleg nok, slik at justeringar og endringar skjer når Trumps administrasjon etterkvart får meir oversikt over kva utslag dei nye tollsatsane får.
I Afrika kan konsekvensane av Donald Trump sine nye tollsatsar bli at Kina får meir kontroll. Foto: Reuters
I mellomtida kan Kina stramme eit ytterlegare stramt grep om afrikansk næringsliv.
– Realiteten er at desse nye tollsatsane i hovudsak gjev det meste av Asia og Afrika til Kina, og USA er ikkje førebudde, seier Cameron Johnson til CNBC.
Han jobbar for konsulentfirmaet Tidalwave Solutions i Shanghai i Kina.
Handelen mellom Afrika og Kina vart i fjor rekna til å vere 3.136 milliardar kroner i fjor. Det er langt meir enn handelen mellom Afrika og USA, som vart målt til 862 milliardar kroner.
Dette er tal frå tenkjetanken Carnegie. Og dei legg til at det er venta endå meir handel med Kina, fordi det er berre fem månader sidan Kina opna for tollfri eksport frå verdas minst utvikla land – slik Noreg har gjort.
Altså, det stikk motsette grepet enn det USA har teke.
Akkurat no står Kina fram som ein langt meir stabil handelspartnar for afrikanske land. Ein partnar dei kjenner godt til, og som det er enklare å forholde seg til.
Fleire meiner også at Kina kan forbetre omdømmet sitt i Afrika endå meir ved å ta over meir av den mjuke makta som USAID stod for.
Kuttene i USAID får katastrofale konsekvenser. Kan det også slå tilbake på amerikanere?
Du trenger javascript for å se video.
Kuttene i USAID får katastrofale konsekvenser. Kan det også slå tilbake på amerikanere?
Satsinga som står for fall
Agoa har fram til i fjor haust blitt omtalt positivt frå USA, og fekk ein ny boost då Joe Biden kom med ein ny stor investeringspakke til Afrika.
Kronjuvelen i USAs Afrika-prosjekt har dei siste åra vore planlegginga av ei jernbanelinje frå dei mineralrike områda i grenseområda mellom Zambia, DR Kongo og Angola. Jernbanen skal etter planen frakte afrikanske mineral ned mot Atlanterhavskysten, i retning av USA og ikkje Kina.
Tanken er at USA treng å trappe opp innsatsen i kampen om afrikanske mineral, som både USA og Kina treng til sitt eige næringsliv.
Sjeldne mineral har også Trump vist interesse for, mellom anna ved å forsøke å få i land ein mineralavtale med Ukraina. Men no er mineralrike land som Angola, DR Kongo og Zambia blant landa som er omfatta av dei nye tollsatsane.
Høgare toll er neppe til hjelp for dei amerikanske diplomatane som skal forsøke å inngå nye handelsavtaler. Slik som faren til Trumps svigerson, og USAs ferske Afrika-utsending, Massad Boulos som forsøker å lande ein mineralavtale med DR Kongo akkurat no.
Den sørafrikanske økonomen Dawie Roodt er ein av dei som meiner «Agoa er død». Til den sørafrikanske avisa The Citizen seier han at det er lite som tyder på at avtalen vil bli fornya i september, slik planen eigentleg var.
Sør-Afrika i djup trøbbel
Og også regjeringa i Sør-Afrika er negative. Dei seier ifølgje Reuters at dei nye tollsatsane nullar ut fordelane som afrikanske land får frå Agoa.
– Dei omfattande tolltiltaka vil påverke fleire sektorar av økonomien vår, inkludert bilindustri, landbruk, mat og drikke, kjemikaliar, metall og andre segment av produksjonen., og dette vil ha følger for arbeidsplassar og vekst, seier Sør-Afrikas utanriks- og finansminister i ei felles utsegn.
For Sør-Afrika – Afrikas nest største økonomi – er dei nye tollsatsane berre toppen av eit stadig meir skummelt isfjell. For landet er i djup økonomisk trøbbel.
Mange skaper sine eigne uformelle jobbar i Sør-Afrika, der arbeidsløysa er stor. Her frå ein frisørsalong i Daveyton. Foto: AFP
Ifølge Renaissance Capital Africa står Sør-Afrika for 37 prosent av all eksport frå Afrika til USA, og er dermed det landet i Afrika med mest eksport til USA. Det gjeld alt frå bildelar til vin.
Dei omfattande USAID-kutta rammer mange, landets ferske og første fleirpartiregjering slit med å bli einige om eit budsjett, og utanlandsgjelda er enorm.
På toppen av alt kjem den store arbeidsløysa på over 40 prosent, og denne kan bli forverra i Sør-Afrika ved at eksport til USA blir dyrare.
Så ringverknadane av tollsatsane kan bli store i Afrika. På kort sikt må enkeltbedrifter og deira tilsette betale prisen for høgare tollar.
Men kanskje endå meir urovekkande er dei langsiktige konsekvensane for verdsøkonomien, og korleis dette vil slå ut på Afrikas svakaste økonomiar – der verktøykassa ofte er for liten når økonomiske tiltak trengst som mest.",Error generating text.,no
2_07_04_2025,Regjeringen gir 61 millioner kroner til bransjeprogram,NTB,https://www.dagsavisen.no/resizer/v2/GVRR676BGNK6VXWVO3WCZ4JQ4M.jpg?smart=true&auth=5222209dbe840de12b91f418adb50eec28a66f8443e22dffe45c8acdc6af4f2f&width=1200&height=630,2025-04-07 05:17:14,https://www.dagsavisen.no/nyheter/innenriks/2025/04/07/regjeringen-gir-61-millioner-kroner-til-bransjeprogram,Politikk,"– Mangelen på kompetent arbeidskraft kan ikke bare løses ved å utdanne flere. Kompetansepåfyll til de som allerede er i jobb, er minst like viktig, sier forskning- og høyere utdanningsminister Sigrun Aasland (Ap) i en pressemelding.
Pengene vil komme folk til gode i industri- og byggenæringen, solkraftbransjen, informasjonstrygghet og IKT-bransjen og finansnæringen, opplyser regjeringen.
I tillegg er det 49 søknader under behandling innenfor helse- og omsorgstjenestene, men de har ikke fått tildelt penger ennå.
Stort spleiselag
Det er partene i arbeidslivet som har foreslått hvilke bransjer som bør ha bransjeprogram.
Programmene innenfor solkraft og helse- og omsorgstjenestene er nye, og får sine første tildelinger i år, heter det.
I alt kom det 140 søknader inn til Direktoratet for høyere utdanning og kompetanse, som forvalter ordningen.
– Bransjeprogrammene er et spleiselag. Staten gir tilskudd til fagskoler, høyskoler, universitet og andre kurstilbydere som utvikler og drifter relevante tilbud, forklarer direktør Sveinung Skule, som sier programmene er populære.
Det er solkraftbransjen og industri- og byggenæringen som får mest penger i den nye bevilgningen. De får over 19 millioner hver. Informasjonstrygghet- og IKT-bransjen får i underkant av 12 millioner, mens finansnæringen er tildelt over 10 millioner. Hva helse- og omsorgstjenestene får, gjenstår å se.
Les også:
Massiv norsk motstand mot Trumps politikk: – Skaper usikkerhet
Skreddersydd
Formålet med programmene er å gi ansatte, permitterte og arbeidsledige i bransjer med særlige behov for endring den nødvendige kompetansen til å mestre nye oppgaver, og dermed bli værende i jobben.
– Samarbeidet med partene i arbeidslivet gjør at vi får utviklet korte og fleksible utdanningstilbud som er skreddersydd til behovet i hver enkelt bransje, sier Skule.
Bransjeprogram er en tilskuddsordning der staten og partene i arbeidslivet samarbeider om å øke deltakelsen i kompetanseutvikling innenfor utvalgte bransjer. På den måten kan ansatte, permitterte og arbeidsledige få gratis kurs og utdanning.
Hvert bransjeprogram får tilskudd i tre år.
Les også:
Eksperten advarer: Ikke gå i denne kredittkort-fella
(+)
Les også:
400.000 vurderer til enhver tid om de orker å stå i arbeid
(+)
Les også: Bernard Minier:
– Det er uendelig mye elendig skit på strømmetjenestene
(+)",Error generating text.,yes
