aid,title,author,image_url,published_date,article_url,category,raw_text,text,is_manipulated
5_07_04_2025,Finanstopp med bønn til Trump,TV 2 AS,https://www.cdn.tv2.no/images?imageId=17625024&panox=0&panoy=0&panow=0&panoh=0&width=1200&height=630,2025-04-07 03:44:31,https://www.tv2.no/nyheter/utenriks/finanstopp-med-bonn-til-trump/17624997,Politikk,"Forrige uke stupte verdens børser etter at USAs president Donald Trump lanserte tollsatser som mange mener kan rasere verdensøkonomien. Dollarkursen sank. Oljekursen sank. Børser verden over stupte. Verdier for milliarder forsvant før stengetid fredag.
Usikkerheten er stor mandag når verdens børser åpner. Det kan komme nye utspill som sender børsene enda brattere nedover – eller det kan komme nyheter som gjør utsiktene litt lysere.
Ber Trump ta seg mer tid
Søndag kveld hadde finansmannen Bill Ackman, som støttet Trump under valgkampen, en bønn og en advarsel til USAs president.
– Presidenten har en mulighet på mandag til å be om timeout og ta seg tid til å reparere det urettferdige tollsystemet. Hvis ikke står vi overfor en selvpåført økonomisk atomvinter, og da må vi gå i dekning, skrev aksjeinvestor og finansmann Bill Ackman søndag kveld på X.
Han ber Trump gripe sjansen til å vente med tollsatsene i 90 dager mens han forhandler, skriver Axios.
Han er ikke alene. Forbes har gjort en undersøkelse blant tungvekterne på Wall Street. Av 50 Wall-street-topper, deriblant milliardærinvestorer, sier 72 % av dem ikke støtter Trumps økonomiske politikk. Mange støttet Trump da han kom til makten.
Trump sa søndag kveld til reportere at han ikke mener å skape uro på børsen, men noen ganger må man ta medisin.
Slik ser det ut på børsene mandag morgen
Japans hovedindeks Nikkei 225 er ned 6,1 prosent halvannen time etter åpning.
I Sør-Korea var Kospi-indeksen ned 4,4 prosent etter en og en halv times handel.
I Singapore falt børsene med 7,4 prosent.
I Hongkong åpnet Hang Seng indeksen med et fall på hele 9,5 prosent.
I Australia falt Sydney-børsens hovedindeks ASX 200 med 6 prosent.
Det er verd å merke seg at i Shanghai var fallet på hovedindeksen på 4,2 prosent, noe som er lavere enn ved de andre børsene.
Hvis Trump likevel følger Ackmans oppfordring senere i uka, vil kanskje de som er aller raskest til å selge seg ut angre. I hvert fall hvis det er nok til at finansmarkedet stabiliserer seg igjen. Hvis …
Usikkerhet er nøkkelordet mandag morgen. Gjennom helgen har Wall Street vært preget av sinne, frykt og frustrasjon, skriver The New York Times. Banker har spilt ut krisescenarioer for å ha strategien klar hvis tunge selskaper bukker under i dominoeffekten. For at pilene peker nedover, er det ingen tvil om. Spørsmålet er hvor hardt dette vil ramme.
Asia åpner med stup: – Spesielt sårbart
Gjennom helgen har analytikere advart om at Asia kan være spesielt sårbart i handelskrigen mellom Kina og USA, ifølge The New York Times. Kina har allerede svart på USAs toll-utspill med egne tollsatser fredag.
Børsene åpner først i Japan. Landets økonomi er tett knyttet til den amerikanske, både med utstrakt handel med USA og tungt eierskap i amerikansk statsgjeld. Ikke overraskende åpner børsen med et stup.
Pilene peker bratt nedover også i Hongkong, Shanghai, Australia og Singapore. Se tallene i faktaboks lenger oppe i saken.
Nasdaq-børsen i USA åpner ikke før klokken 15.30 norsk tid. Fortsatt kan Trump gripe inn og trykke på pause, slik Ackman ba ham om søndag kveld. Tallene i USAs finansmarked så foreløpig ikke like mørke ut som det vi nå ser på de asiatiske børsene.
Men når tunge profiler i finansmiljøet varsler «selvpåført økonomisk atomvinter» og resesjon hvis ikke Trump snur, står vi foran en svært dramatisk uke i verdensøkonomien.
Denne uka er det også ventet at EU kommer til å gi sitt svar på de amerikanske tollsatsene. Det er ikke kjent hvordan de vil svare, og det samme er tilfelle med 50 andre land som har kontaktet Det hvite hus. Donald Trump har lovet å forhandle med alle, men står hittil fast på at tollsatsene kommer til å bli gjennomført som planlagt.",Error generating text.,yes
18_07_04_2025,Sykepleierkrisen: Natalie hoppet av etter syv måneder,Bjørn Haugan,https://akamai.vgc.no/v2/images/fad0a925-fee2-4942-95ed-307e2fdf0cb3?format=auto&w=1080&s=c7565e064005324a73c6938110ec2ea0baa5c293,2025-04-06 10:26:22,https://www.vg.no/nyheter/i/Avm6rr/natalie-bergan-kjaeraas-23-ga-opp-sykepleieryrket,Health,"På en benk foran Stortinget sitter en 23 år gammel sykepleier og en fagforeningssjef som rister på hodet – og slår alarm.
For 6 minutter siden
Kortversjonen
Nyutdannet sykepleier Natalie Bergan Kjæraas (23) sluttet etter syv måneder på grunn av lav bemanning og høy arbeidsbelastning.
Fagforeningsleder Steffen Handal slår alarm om en økende krise i helsesektoren.
Handal krever bedre bemanning og skroting av Ventetidsløftet.
Kjæraas håper å vende tilbake til yrket om arbeidsforholdene bedres.
Natalie Bergan Kjæraas (23) gledet seg enormt til å bli sykepleier. Det varte ikke lenge. Nå jobber hun i en butikk.
– Jeg skulle så gjerne fortsette som sykepleier og jeg håper inderlig at det skjer igjen, men erfaringene mine hittil tilsier ikke det, sier hun.
Bergan Kjæraas er en nyutdannet sykepleier som sluttet etter syv måneder i yrket.
– Jeg visste at jeg ville bli sykepleier allerede fra jeg var 16 år. Jeg gikk helse- og oppvekst på videregående. Så tok jeg sykepleierutdanningen, hvor jeg jobbet ved siden av i hjemmetjenesten. Jeg begynte å jobbe, først i hjemmetjenesten, så på Ullevål.
– Med et så brennende ungt hjerte for yrket du ville bli i; du må forklare hvorfor du hoppet av etter under ett år?
– Det var ikke nok folk. Man tar på seg veldig mange arbeidsoppgaver, altfor mange. Man kunne alltid ønske at man kunne strekke seg enda lenger. Men så opplever du at du ikke strekker til. Du får ikke gjort det du mener du burde fått tid til å gjøre.
– Konstant dårlig samvittighet
Hun sukker og legger til.
– Du rekker veldig ofte ikke å sette deg ned for å slå av en prat med alle de vi er innom i løpet av en dag. Mange er veldig ensomme, spesielt de som bor alene. Selv om de så gjerne vil prate litt, så må du bare beklage og si at du må dra videre fordi det er andre som venter på meg. Det gir konstant dårlig samvittighet.
– Så er det en tøff jobb, med sykdom og dødsfall og fysisk tøff jobb, fordi vi ofte må løfte beboerne, legger hun til.
Hun sier hun har omtrent samme erfaring fra sykehuset.
– Det er lav bemanning, manglende ressurser og alltid dårlig tid.
23-åringen kom til at hun måtte sette seg ned og ta et valg.
– Er det dette jeg vil gjøre resten av arbeidslivet, spurte jeg meg selv.
– Jeg kom til at jeg måtte innrømme at svaret er nei.
– Da bør alarmen gå
Han ved siden av henne på benken, er leder Steffen Handal i Unio, hvor de fleste sykepleierne i Norge er medlemmer.
– Når unge mennesker som Natalie, som virkelig ønsker å være sykepleier, hopper av, da bør alarmen gå. Da er noe riv ruskende galt:
– Det er krise i helsesektoren og den kommer til å bli verre, fordi det blir mange flere eldre fremover, som vil ha behov for hjelp og pleie. Vi må sørge for at Natalie og hennes kollegaer får nok kollegaer rundt seg.
– Springer beina av seg
Han sier at Norges største problem er mangel på arbeidskraft fremover.
– Vi klarer ikke å bemanne tjenester Norge er helt avhengige av, innen helse- og omsorgssektoren. De må bemannes godt nok. Det skjer ikke i dag, og bidrar til at Natalie og mange andre slutter. Det skjer i en tid hvor det er behov for flere sykepleiere, ikke færre.
– Da kan vi ikke ha valgflesk og urealistisk politikk som Ventetidsløftet.
– Hvorfor er Ventetidsløftet mislykket?
– Våre folk springer beina av seg i dag. Alle vil ha ned ventetidene, men det hjelper ikke på bemanningen at Vestre lover at ventetiden skal bli kortere. Det våre medlemmer opplever som konsekvens, er at de må løpe enda fortere. Det er fullstendig feil medisin og bidra til at flere vil forlate jobbene sine.
Lenger nede i saken blir han motsagt av forbundsleder Lill Sverresdatter i Norsk Sykepleierforbund, som er et forbund i Handals Unio.
– Ventetidsløftet bør skrotes
– Det andre problemet er at det kan flytter arbeidskraft, ikke ut ifra det medisinske behovet, men hvor det politiske ønsket er: Dersom Helseforetakene flytter folk til der de kan ta ned ventelistene, i stedet for der det er medisinske behov, vil det være svært uheldig.
Handal sier det mangler 4300 sykepleiere, spesialsykepleiere og jordmødre. Og at det må utdannes 18.000 nye sykepleiere innen 2030 og 30.000 innen 2040.
Han har ett budskap til Ap:
– Ventetidsløftet bør skrotes. Alle vil ha ned ventetidene, men det kan bare gjøres ved å ha god nok bemanning. Ventetidsløftet bidrar til at folk må løpe enda mer. Det kan godt hende det bidrar til at helseministeren kan skryte av at ventetiden går ned, med det vil bare være på kort sikt.
Han legger til:
– Og det er en politikk som gjør at flere vil slutte, helt det motsatte av det vi trenger. Vi trenger at flere har lyst til å bli sykepleiere. Det som skjer nå bidrar ikke til det, snarere tvert om.
Handal sier at krisen kan bli større.
– Med veksten i antallet eldre i årene fremover, så må det rekrutteres veldig mange flere sykepleiere. Med dagens politikk, kommer ikke det til å gå. Det er en krise for landet.
Vi spør Natalie som må til for at hun skal komme tilbake til sykepleieryrket.
– De må bruke mer penger til å øke grunnlønn, for å få flere til å velge yrket vårt. Men før det må de øke grunnbemanningen, slik at arbeidsbelastningen blir mindre. Du må ha tid til å gjøre en jobb. I dag opplever jeg at vi bare kjører fra hjem til hjem, med evig dårlig samvittighet overfor ensomme mennesker som du får brukt for kort tid på.
Hun ser på oss.
– Det er ingenting jeg mer ønsker enn å komme tilbake til sykepleieryrket. Men da må det bli mye mer attraktivt.
Vestre vil lytte
Helse- og omsorgsminister Vestre ønsker å treffe Natalie.
– Jeg tar utfordringene til Natalie på høyeste alvor og vil gjerne invitere henne til departementet for å høre det direkte fra henne. Gode tiltak for å rekruttere og beholde sykepleiere er helt avgjørende for å sikre vår felles helsetjeneste for fremtiden og her må vi alltid ta oss tid til å lytte til de som har skoene på.
Han sier at Ventetidsløftet er et partnerskap hvor Fagforbundet, Norsk Sykepleierforbund, Legeforeningen, Delta, Psykologforeningen, Spekter, Virke, NHO Geneo og de fire regionale helseforetakene og regjeringen jobber sammen for å få ned ventetidene i helsetjenesten.
– For å få til dette jobber vi med tiltak som å fjerne tidstyver og sikre bedre oppgavedeling; så sykepleiere og andre fagfolk kan bruke tiden sin på pasientene. Ekstra poliklinikk på kveld og helger er kortsiktige tiltak, som gjennomføres i tillegg nå i en periode for å ta unna det ekstraordinære etterslepet etter pandemien. Det skal være hundre prosent basert på frivillighet.
Uenig med sjefen
Norsk Sykepleierforbund (NSF) er en del av partnerskapet til Ventetidsløftet.
Sykepleierforbundet er et av forbundene i hovedsammenslutningen Unio, som Handal leder.
De støtter ikke sjefen, Handal, som altså ber politikerne skrote Ventetidsløftet.
– Her kan det se ut som om Handal ikke er helt oppdatert. NSF er partner i Ventetidsløftet, ikke Unio. NSF er fornøyd med partnerskapet, har bidratt sammen med flere Unio-forbund og støtter intensjonene i løftet. Det er likevel problemer med gjennomføring og involvering i tjenestene. Der har direktørene en jobb å gjøre. Partnerskapet får verdi når det fungerer ute i tjenestene, sier hun.",Error generating text.,no
7_07_04_2025,Hardt ut mot Støre og Vedum: –⁠ Viser sitt sanne ansikt,Philippe Bédos Ulvin,https://akamai.vgc.no/v2/images/c7e3013a-9e37-4fa4-af91-a859246773a1?format=auto&w=1080&s=b57e0b13236794631e5eebfd3cbcb86e4dc4e004,2025-04-06 21:38:25,https://www.vg.no/nyheter/i/8qKy51/unge-venstre-leder-omar-yagci-mener-norsk-eu-nei-kan-vaere-putin-vennlig,Politics,"Unge Venstre-leder Omar Svendsen-Yagci er bekymret for at norsk sikkerhet svekkes dersom norsk EU-medlemskap ikke diskuteres.
Kortversjonen
Unge Venstre-leder Omar Svendsen-Yagci frykter svekket sikkerhet uten EU-medlemskap.
Han mener Norge baserer sin trygghet på flaks og advarer mot russisk innflytelse.
EU-medlemskap vil styrke norsk forsvar og beredskap, mener Svendsen-Yagci.
Han avviser kritikk om maktoverføring til EU-eliter som villedende.
Svendsen-Yagci ønsker norsk medlemskap i EU, men med forbehold, spesielt mot euroen.
– Jeg mener at EU-motstanderne løper Putins ærend. All den tid deres nei til EU først og fremst er et nei til Norges trygghet, sier Svendsen-Yagci.
Han reagerer på at statsminister Jonas Gahr Støre har stengt døren for en folkeavstemning om EU, og at Senterpartiet har lovet at «Norge aldri, aldri skal bli medlem av EU»:
– Venstresiden, Frp og ikke minst Senterpartiet burde tenke seg om to ganger. Den som kommer til å juble høyest for et norsk nei til EU, er Putin – ikke det norske folk.
Torsdag lanserte Arbeiderpartiet sitt slagord for valgkampen: « Trygghet for fremtiden ».
– I en urolig tid, vil jeg heller holde Norge samlet – enn å sende oss ut i en ny runde med for eller mot, sa Støre.
Svendsen-Yagci mener slagordet er en «vits».
Han viser til forsvarskommisjonen som har pekt på at EU-samarbeid vil styrke norsk beredskap og forsvarsevne – både gjennom militært samarbeid, mot desinformasjon og ved å bygge opp norsk forsvarsindustri.
– Bygger Norges trygghet på flaks
Unge Venstre -lederen mener Norge ikke har råd til å stå på utsiden av et stadig dypere forsvarssamarbeid i EU. Han er skuffet over at Støre slo ned forslaget fra Oslo Arbeiderparti om å gå inn for EU-medlemskap, «når tiden er rett».
– Der viste Støre sitt sanne ansikt. Han nekter å ta debatten og stå med våre allierte i Europa, samtidig som ukrainske soldater dør for det europeiske fellesskapet, sier Svendsen-Yagci.
– Det bekymrer meg at partier som Senterpartiet og Arbeiderpartiet i praksis bygger Norges trygghet på flaks, sier Svendsen-Yagci.
Til intervjuet med VG har han stilt opp med EU-flagg utenfor Russlands ambassade. Mens han advarer om russisk innflytelse, blir han forsøkt jaget vekk av ambassadens sikkerhetsvakt.
Yagci-Svendsen understreker at han mener EU også vil gi Norge en styrket evne til å stå imot russisk hybridkrigføring og desinformasjon.
Utover forsvarssamarbeidet, kan EU-medlemskap garantere strategiske goder som vaksiner, sier Yagci.
– Pandemien viste at det var flaks at vi fikk vaksiner fra EU. Det kan ikke være grunnlaget for trygghet.
AUF-leder: - Stødige forsvarere
Jonas Gahr Støre har ikke kunnet besvare Svendsen-Yagcis utsagn. AUF-leder Gaute Skjervø sier til VG at han er veldig uenig i kritikken.
– Det er ingenting nytt med at Unge Venstre er ivrige etter å melde Norge inn i EU. Mange er legitimt bekymra for europeisk sikkerhet nå. Men vår sikkerhetsgaranti kommer gjennom Nato, og det må vi verne om, sier Skjervø.
Han mener i likhet med sin partileder at det ikke er rett tidspunkt for «en opprivende norsk folkeavstemning om EU».
– Det kan potensielt sette EØS-avtalen i spill. Det er en dårlig idé i en urolig tid. Jeg er glad Støre og Arbeiderpartiet er stødige forsvarere av EØS og Nato, sier Skjervø.
– Udemokratisk
Under forrige folkeavstemning var Venstre og daværende partileder Odd Einar Dørum mot norsk EU-medlemskap. Grunnen var blant annet at Dørum mente EU-medlemskap strider med norsk selvbestemmelsesrett og grunnlovens paragraf 115.
Siden har gradvis partiet snudd tvert om og under landsmøtet i starten av mars lanserte Venstre folkeavstemning om EU som sin fremste sak.
Unge Venstre-lederen sier at han selv er en ihuga EU-tilhenger, blant annet fordi EUs politikk ender opp med å være gjeldende i Norge gjennom EØS.
– Norge får ikke være med å forme politikken – mens Jonas Gahr Støre må drikke pils i baren mens de andre topplederne bestemmer.
Ungdomspolitikeren ønsker seg norske folkevalgte i EU-parlamentet, plass i EU-kommisjonen og innflytelse i Rådet.
Avviser elitekritikk
Senterparti-leder Vedum har på sin side fastholdt at norsk EU- og EØS-medlemskap overfører makt til «dresskledde eliter i Brussel».
– Det stemmer ikke. Alle i Norge har interesse av et tettere samarbeid med våre allierte. Det handler om trygghet og beredskap. To tredjedeler av befolkningen i EU støtter medlemskapet – det er folkelig forankret. Også i våre naboland har støtten økt, nettopp fordi de ser verdien av fellesskapet, svarer Svendsen-Yagci.
Ønsker forbehold
Selv om ungdomspolitikeren fra Gjøvik ønsker seg inn i EU, er han ikke begeistret for alt statsforbundet har å tilby, som euroen. Han tror også at det vil bli mulig å ivareta interessene til norske landbruk og fiskeri.
– EU er ikke en trussel mot norsk suverenitet. Mange EU-land har forbehold – det kan også Norge ha. Jeg tror for eksempel at vi bør ha forbehold mot euroen. Norsk økonomi er oljeavhengig og trenger fleksibilitet i pengepolitikken. Det kan vi forhandle om, sier Svendsen-Yagci.",Error generating text.,no
30_07_04_2025,Kritikken hagler etter stygg ulykke i Grand National 2025,Jarle Fredagsvik,https://gfx.nrk.no/pGivPywOnEq1r0T1wN19jQtM2GMCgtiLO9OQl0wcA-Gw.png,2025-04-06 20:16:30,https://www.nrk.no/sport/kritikken-hagler-etter-stygg-ulykke-i-grand-national-2025-1.17372109,Sports,"Lørdag falt hesten Broadway Boy stygt etter å ha kollidert med et hinder.
Rytteren ble kastet av hesten og deiset i bakken. Bildene fra løpet viser at den syv år gamle hesten lander med hodet først og blir liggende på gresset.
Ulykken føyer seg til i en lang rekke av stygge hendelser fra Grand National; det prestisjetunge løpet er kjent for å være hardt.
– Man kan ikke tøye grenser i det uendelige. Dette løpet har stor fart, høye hinder og vanskelighetsgrad. Det er for tøft, og burde ha vært forbudt, sier Inger Lise Andersen.
Hun er professor i etologi og dyrevelferd med fokus på gris og hest.
OMSTRIDT: Britiske Grand National har fremdeles sine fans i England, men rittet har også skaffet seg sine motstandere i løpet av sin forholdsvis blodige historie. Foto: Danny Lawson / AP / NTB
– Hester dør hvert år
Ifølge avisen The Guardian skal tilskuere ha beskrevet hendelsen som «grusom».
– Hestene fortjener bedre, sier Ben Newman i organisasjonen Animal Rising til den britiske avisen.
Han mener sporten prioriterer profitt foran dyrevelferd. Vinneren av løpet soper med seg rundt 7 millioner kroner i premie.
Men under halvparten av hestene kom til mål. 34 hester sto på startstreken.
16 kom til mål.
– Det er hårreisende og ikke forsvarlig i det hele tatt, sier Inger Lise Andersen til NRK.
Åshild Roalset er representant for dyrevern hos Dyrebeskyttelsen Norge. Hun mener arrangøren kunne ha bedret sikkerheten for dyrene, dersom det var ønskelig:
– I Grand National venter man vel omtrent at én eller flere hester dør hvert år, det er jo nesten for normalen å regne. Det er veldig mange årsaker til at hestene kan ende opp med å miste livet, sier Roaldset til NRK.
– Grusomt
Det er lagt opp til at det skal være ekstremsport for hestene, med veldig mange og høye hindre. I tillegg foregår det på gress, noe som gjør at underlaget kan være sleipt.
– I sum gjør alt dette at det er normalt at noen hester dør fordi det er lagt opp så ekstremt. Man kunne gjort mye mer for å forebygge at hester blir skadet enn det man har gjort. De verste skadene ender med at hesten blir skutt på banen, sier Roaldset overfor NRK.
Fakta om Grand National
Tross den flengende kritikk blant annet fra fra dyrevernerne, er det fortsatt mange tradisjonsrike briter som trykker Grand National til sitt bryst. Ifølge Wikipedia har hesteveddeløpet et sted mellom 500 og 600 millioner seere årlig. Fram til 2013 hadde BBC rettighetene selv.
Tall fra blant annet Metro og The Telegraph har 66 hester dødd i løpet av Aintree-festivalens tre dager siden 2000. Kun for Grand National-lørdagen har antall døde hester kommet opp i 88 siden den første konkurransen tilbake i 1839.
I 1993 ble rittet avlyst etter en rekke tjuvstarter (30 av 39 jockeyer var involvert i én av dem), mens rittet ble utsatt til en mandag i 1997 på grunn av bombetrussel.
I 2020 ble rittet innstilt på grunn av koronaviruset. Året etter var rittet tilbake, med det resultat at både «The Long Mile» og «Houx Gris» døde underveis.
I 2023 ble starten av Grand National utsatt på grunn av protester fra nettopp dyrevernere.
Kun én jockey har mistet livet i forbindelse med løpet. Det skjedde i 1862, da Joseph Wynne mistet livet i en hendelse der flere andre hester var involvert i forbindelse med passeringer av «The Chair».
Roalset svarer følgende på spørsmål om hva hun synes om Grand National slik det gjennomføres i dag:
– Jeg synes det er grusomt. Vi kan ikke ha en slik hestesport der det er lagt opp til at hestene kan ende opp med å dø. Slike ulykker skjer dessverre ofte, så man kan heller ikke si at det kommer som noen overraskelse.
Hun mener dette aldri kunne skjedd på en vanlig arbeidsplass.
– Da hadde man hatt en HMS-ansvarlig som hadde identifisert farer og risikoer underveis. Med enkle grep kunne man ha redusert antall døde og skadde hester, men man gjør det likevel ikke.
MANGE ULYKKER: Her får hesten «Frazier Island» hard medfart under Grand National i 1999. Hesten «Eduipe» ble senere avlivet i forbindelse med samme hendelse. Foto: IAN HODGSON / Reuters / NTB
88 hester har dødd siden oppstarten
Siden oppstarten i 1839 har 88 hester mistet livet i forbindelse med hesteveddeløpet Grand National, skriver Metro.
Sist uke ble en hest avlivet etter en kollisjon i et løp.
– Galopphestene er avlet for å løpe raskt, men dette løpet innebærer altfor stor belastning og skaderisiko for hestene. Derfor er det uetisk, sier Andersen.
FORTSATT POPULÆRT: Også i 2025 er Grand National en stor greie i England. Rittene foregår ved Aintree Race Course utenfor Liverpool. Foto: Phil Noble / Reuters / NTB
Gjorde flere grep
I fjor tok arrangørene flere grep for å bedre sikkerheten. Et av grepene var å redusere feltet fra 40 til 34.
Da kom man seg unna uten tragiske hendelser.
En talsperson fra Det britiske hesteveddeløpsforbundet (BHA) svarer følgende på kritikken etter lørdagens konkurranse:
– Som ved alle annen sport eller aktivitet som involverer hester, så er det umulig å fjerne risikoen helt. Raten for fatale skader i forbindelse med disse løpene gjelder 0,44 prosent av alle startende. Vi ønsker å være åpne og ærlige om risikoen som er gjeldende, sier en talsperson for BHA ifølge The Guardian.
Fortsatt mener Andersen at dette er langt over streken.
– Mange hopper over samme hinder samtidig, og risikoen for skader på både hest og rytter er ekstremt stor, sier professor Andersen.
– GRUSOMT: Åshild Roaldset i Dyrebeskyttelsen mener arrangøren med enkle grep kunne redusert risikoen for hestene som årlig blir sendt ut for å konkurrere under Grand National. Hun synes konkurransen er grusom å se på. Foto: Dyrebeskyttelsen
Roaldset mener de ansvarlige kunne gjort mye mer for å ivareta dyra:
– Det er også mye man kunne ha gjort med formatet. De kunne blant annet skalert ned hindrene og hatt færre hester på banen. Jeg tror de frykter at det skal bli mer likt en del av de andre konkurransene, og at dermed kan ende opp med ikke å trekke like mange tilskuere, sier Roaldset.",Error generating text.,no
