aid,title,author,image_url,published_date,article_url,category,raw_text,text,is_manipulated
29_19_03_2025,Ny rapport: Disse krefttypene rammer brannmenn oftere enn andre folk,Annabelle Kårvåg Sørensen,https://gfx.nrk.no/dDC5yslXpFN__MhcbXps7gq2gl1GE-83194tYG-heT3g.jpg,2025-03-18 12:00:26,https://www.nrk.no/mr/kreftregisteret_-brannmenn-far-oftere-visse-typer-kreft---arsaken-til-to-av-dem-er-brannslukking-1.17344420,Health,"Saken oppsummert:
En ni år lang forskning utført av Kreftregisteret, Universitetet i Oslo, Center for Kræftforskning og Statens arbeidsmiljøinstitutt har konkludert at brannmenn har større risiko for å få tarmkreft, strupekreft, prostatakreft, urinveiskreft og brysthinnekreft.
4500 brannmenn har deltatt i studien.
Brannslukkingsarbeidet er fastslått som årsak til økt forekomst av urinveiskreft og brysthinnekreft blant brannmenn.
Det er fortsatt usikkerhet rundt årsaken til økt forekomst av tarmkreft, strupekreft og prostatakreft blant brannmenn.
Prosjektgruppen jobber for å inkludere flere brannkonstabler i studien for å kunne gjennomføre nye og større studier.
Det er en pågående debatt om inkludering av flere kreftformer i ""yrkessykdomslista"" for å sikre erstatning for brannkonstabler som blir syke.
Oppsummeringen er laget av en KI-tjeneste fra OpenAI. Innholdet er kvalitetssikret av NRKs journalister før publisering.
I ni år har en prosjektgruppe på syv personer forsket på kreftrisikoen blant brannmenn, og årsakene bak.
4500 brannmenn har deltatt, og prosjektgruppa består av Kreftregisteret, Universitetet i Oslo, Center for Kræftforskning og Statens arbeidsmiljøinstitutt.
Nå er konklusjonen klar og tydelig: Brannmenn får oftere tarmkreft, strupekreft, prostatakreft, urinveiskreft og brysthinnekreft (mesoteliom) enn resten av oss.
«Dette prosjektet har gitt oss verdifull innsikt i spørsmål om yrkesrelatert kreft blant brannkonstabler. Samtidig er det mange spørsmål som gjenstår», skriver de i rapporten.
De har fastslått årsaken til at brannmenn oftere får to typer kreft, men hva som ligger bak de andre typene er ennå usikkert.
Hvorfor bare brannMENN?
I dette prosjektet er det kun menn som er fulgt opp. I rapporten skriver de at begrep har endret seg. Da de startet fikk de penger av Kreftforeningen for å forske på brannmenn, mens i dag bruker man heller begrepet brannkonstabler - for å også inkludere det voksende antallet kvinner i yrket.
«Likevel er fortsatt den store andelen av brannkonstabler menn, og av den grunn er også bare menn inkludert i analysene våre».
De har ikke grunn til å anta at risikoen for kreft er vesentlig annerledes for kvinnelige brannkonstabler sammenlignet med menn.
To typer settes i sammenheng med brannslukking
Det har over lengre tid blitt skrevet at brannkonstabler utsettes for mange kjente og mulige kreftfremkallende stoffer. Det har også blitt gjort en rekke andre studier om kreftrisikoen blant brannkonstabler.
Da forskningsgruppa satte i gang med dette prosjektet, var konklusjonen generelt at resultatene fra andre studier var varierte, og at det derfor var mange åpne spørsmål om årsakssammenheng.
Ifølge gruppa har det ikke vært gjort spesifikke undersøkelser tidligere på norske brannkonstabler sin arbeidshverdag.
De har nå funnet ut at brannslukkingsarbeidet fører til at brannmenn i større grad enn andre får urinveiskreft og brysthinnekreft.
Funnene de har gjort på dette støtter det som IARC konkluderte med i 2022.
Det er også større sannsynlighet for at brannmenn får tarmkreft, strupekreft og prostatakreft, men årsaken til det kan de ikke fastslå.
Foto: Roar Jonny Strøm / NRK
Vil få med flere
Fordi mange spørsmål ennå gjenstår, jobber prosjektgruppa med å få flere brannkonstabler med på studien.
For selv om 4500 brannkonstabler har vært med, er det begrensninger i hvilke analyser de kan gjøre, som da gjør det vanskeligere å slå fast konklusjoner og årsaker.
Med flere deltagere og fornyet oppfølging vil de i fremtidige prosjekt kunne gjennomføre nye og større studier av kreft og andre sykdommer.
«En slik grundig og nøyaktig forståelse av sammenhenger mellom yrkeseksponeringer og kreftrisiko er en forutsetning for bedre forebygging av yrkesrelatert kreft og sykdom hos brannkonstabler».
Yrkessykdomslista
Nylig publiserte NRK en artikkel om at brannkonstabler kjemper for erstatning og trygge brannstasjoner.
For at de skal få erstatning hvis de blir syke, må nemlig sykdommen være nevnt i den såkalte «yrkessykdomslista». Det er en liste over regjeringens oversikt over sykdommer som kan skyldes forhold på jobben.
Den listen har ikke blitt endret siden 50-tallet. Nå har et nytt forslag nylig vært ute på høring, men organisasjonen «Brannmenn mot kreft» var ikke fornøyde med regjeringens forslag.
Årsaken er at flere kreftformer som brannfolk er spesielt utsatt for manglet, ifølge organisasjonen.
– Brannfolk setter sitt liv og helse på spill for å redde andre. Da må en kunne forvente at samfunnet stiller opp når de selv rammes, sa Tommy Kristoffersen, leder i organisasjonen.
Nå er saken under behandling hos Arbeids- og inkluderingsdepartmentet.",Error generating text.,no
20_19_03_2025,Investorene tar profitt i Kongsberggruppen,Jonas Christensen,https://images.dngroup.com/image/eyJ3IjoxMjAwLCJmIjoid2VicCIsImsiOiJkZDUwNDNhMmUzZWQxNDQzZGMwYWM4ZmE3ZDZlNjdiZCIsImNyb3AiOlswLDAsMjQwMCwxMjAwXSwiciI6MiwibyI6ImRuIn0,2025-03-18 08:02:24,https://www.dn.no/bors/oslo-bors/aksjemarkedet/kongsberggruppen/investorene-tar-profitt-i-kongsberggruppen/2-1-1793707,"Finance, Economics, Business","Børs
Oslo Børs slår følge med Europa og sikter mot enda en toppnotering. Kongsberggruppen daler fra rekordnivåer.
Oppdatert for 2 minutter siden
Mens det amerikanske aksjemarkedet har knelt under Trumps andre presidentperiode har Oslo Børs fulgt europeiske og kinesiske aksjer opp.
Mandag steg hovedindeksen til ny toppnotering etter å ha steget rundt syv prosent så langt i år – til tross for lavere oljepriser og gasspriser. Tirsdag fortsetter oppturen, mens USA-futures ligger flatt.
I resten av Europa er det også bred oppgang, med mest optimisme i de tyske markedene.
Nesten alle tungvekterne stiger på Børsen, men med Kongsberggruppen som skiller seg klart ut med en nedgang på mer enn to prosent. Aksjen sluttet mandag til ny rekord.
Etter planen skal USAs president Donald Trump snakke med Russlands president Vladimir Putin tirsdag morgen. Ukraina har allerede gitt tilslutning til et amerikansk forslag om en 30 dager lang våpenhvile i Ukraina-krigen. Russland har så langt ikke gitt et entydig svar.
Oljeprisen stiger en drøy prosent tirsdag og flere oljerelaterte aksjer løftes i formiddagstimene.
Grønnsaker på tallerkenen
Pimcos sjef for offentlig politikk, Libby Cantrill, er sammen med økonom Allison Boxer ute med en fersk vurdering av den økonomiske effekten av Donald Trumps politikk 2.0.
Etter valgseieren spådde de en blanding av det de omtaler som grønnsaker og dessert, der politikk under førstnevnte kategori vil ha en bitter smak for økonomien mens desserten vil kunne støtte veksten.
Deres konklusjon så langt er at investorene har fått en mer grønnsakstung diett, i motsetning til hva de hadde ventet.
– Aksjemarkedet har særlig reagert, skriver Cantrill.
– Koster ikke mye
Pimco-økonomene tror Trumps foreløpige politiske endringer vil føre til økt sannsynlighet for en oppbremsing i økonomien før mer vekstvennlig politikk innføres. De støtter seg til at aktivitetsdata fra januar og februar samsvarer godt med skiftet man har sett i bnp-tallene.
I tillegg har stemningen vært dårlig i det amerikanske aksjemarkedet samtidig som tollusikkerheten vedvarer. Dermed mener de makrodataene rettferdiggjør en nedgradering av vekstutsiktene.
– For mange selskaper koster det ikke mye å utsette ansettelser og investeringer på dette tidspunktet, skriver Cantrill.
Hun gjør også et poeng ut av at det har vært de aller rikeste i USA som har drevet mye av forbruket og inntjeningen blant bedriftene. Disse er mest utsatt for store endringer i formuen, mener hun.
– Dette øker den potensielle nedsiderisikoen knyttet til fallende aksjemarkeder nå, skriver hun.",Error generating text.,no
6_19_03_2025,Massiv norsk motstand mot Trumps politikk,Jonas Bucher,https://www.dagsavisen.no/resizer/v2/WWVOP4NF3BFVJIE224RKPMWVCI.jpg?smart=true&auth=e7ebaebea1d8b879295ad399c6b48178d7fe94469b3cdae4be55432683c55346&width=1200&height=630,2025-03-18 19:01:32,https://www.dagsavisen.no/nyheter/2025/03/18/massiv-norsk-motstand-mot-trumps-politikk-skaper-usikkerhet,Politikk,"Det kommer fram i en spørreundersøkelse gjort av Opinion for Dagsavisen og FriFagbevegelse.
– Det er et klart flertall som mener at Trump tar USA i gal retning. Det er kanskje som forventet, sier rådgiver i Opinion, Maria Rosness, til Dagsavisen.
Spørreundersøkelse om Donald Trumps politikk, levert av Opinion for Dagsavisen og FriFagbevegelse.
(Opinion)
83 prosent av de som svarer, mener at Trump generelt sett tar USA i gal retning. 7 prosent svarer at presidenten leder landet i riktig retning, mens 10 prosent svarte «ingen mening».
– Rent politisk er norske og amerikanske forhold svært forskjellige, og Det republikanske partiet er lengst unna norsk politikk. Men det vi ser nå er veldig normbrytende med hvordan vi er vant med at vestlige land utøver både politikk og demokrati. Sånn sett er det ikke overraskende at 83 prosent mener at Trump tar USA i gal retning, sier Rosness.
Les også:
Ekspert: USA har gitt Israel en boost til å fordrive palestinerne
– Ikke overraskende
Statssekretær ved utenriksdepartementet, Eivind Vad Petersson, peker på flere sider av Trump-administrasjonens politikk.
– USA har fått ny ledelse med en annen stil, mer konfronterende og vanskeligere å forutsi. Det er ikke overraskende at store bevegelser i USAs utenriks-, handels- og sikkerhetspolitikk skaper usikkerhet og reaksjoner, sier han i en uttalelse overfor Dagsavisen.
Statssekretær Eivind Vad Petersson (Ap) i UD.
(Gorm Kallestad/NTB)
Han understreker samtidig viktigheten av et godt norsk-amerikansk forhold og samarbeid.
– I en urolig tid er regjeringen på jobb for Norge, for å sikre norske interesser i møte med partnere og allierte i Europa og USA.
– Vi har god og direkte dialog med USA og snakker åpent med den nye administrasjonen. Vi sier ifra når vi er uenige, men samarbeidet står fast. Regjeringens viktigste oppgave er å ivareta norske interesser. Det er i Norges grunnleggende interesse å bevare et godt og stabilt forhold til USA, legger Vad Petersson til.
Saken fortsetter under videoen.
Les også:
Trump vil satse på «vakkert, rent kull»
– Fremmed fra et norsk perspektiv
USA-ekspert og samfunnsviter Sofie Høgestøl er heller ikke overrasket over den norske Trump-motstanden.
– Det føyer seg inn et bilde om at nordmenn ikke er veldig Trump-vennlige. Sånn sett er det ikke overraskende, sier hun til Dagsavisen.
Sofie ​Høgestøl.
(Terje Pedersen/NTB)
Hun trekker blant annet fram det amerikanske synet på velferdsstaten sammenlignet med det norske.
– Det er en kulturell forskjell. De aller fleste nordmenn vil synes at det er viktig med et sterkt, offentlig helsevesen. Sånn er det ikke i USA. Synet på hva staten skal være og hvilke tjenester staten skal tilby, det har alltid vært en kulturell kløft mellom Europa og USA.
– Da blir mye av det republikanerne gjør når det kommer til å bygge ned staten ganske fremmed fra et norsk perspektiv.
Les også:
Ekspert om mulig fredsavtale: Fem krav blir avgjørende
20 prosent Trump-støtte blant FrP-velgere
Deltakerne fikk i samme spørreundersøkelse spørsmål om hvilket norsk parti man hadde stemt på dersom det var stortingsvalg i morgen.
– Det som trekkes fram er at det er signifikant flere blant FrPs velgere som mener at Trump tar USA i riktig retning med hele 20 prosent, sier Rosness i Opinion.
Maria Rosness, rådgiver i Opinion.
(Opinion)
Til sammenligning mener kun 3 prosent av Høyre-velgere at Trump leder USA i riktig retning. Arbeiderpartiet – 1 prosent, Rødt – 1 prosent og Senterpartiet – 8 prosent.
I tillegg har 18 prosent blant FrP-velgere svart «ingen mening» på om hvorvidt Trump leder USA i riktig eller gal retning. 63-prosent blant FrP-velgere svarte at Trump tar USA i feil retning.
– Det kan han noe med interesse å gjøre og hvordan man følger med på det, tenker jeg. Men det er en ærlig sak å si at man ikke har en mening om det hvis man ikke synes det er interessant å følge med eller har satt seg inn i hva som skjer, sier Rosness.
Les også:
Trump: Kinas Xi kommer snart på besøk
FrP: – Vanskelig for nordmenn å henge med
Fremskrittspartiets Hans Andreas Limi sier følgende om FrP-velgeres resultater i undersøkelsen:
– Fremskrittspartiet er mest opptatt av å føre en trygg og forutsigbar politikk i Norge. Vi registrerer at det er mange forskjellige meninger om Trump og det er vanskelig for nordmenn å henge med på alt som skjer.
– Fremskrittspartiet mener det er viktig å bidra til et så godt samarbeid med USA som mulig, samtidig som det er riktig å si tydelig ifra når Trump kommer med grove feil og unøyaktigheter, slik han for eksempel gjorde om Zelenskyj og krigen i Ukraina.
Dagsavisen har vært i kontakt med den amerikanske ambassaden i Oslo. De skriver følgende i en e-post:
«Den amerikanske ambassaden i Oslo er alltid interessert i å lære mer om nordmenns synspunkter og bekymringer over hele landet, men vi avstår fra å kommentere spesifikk meningsmålingsdata. Vi forblir fokuserte på å fortsette å styrke de robuste bilaterale båndene mellom USA og Norge.»
Les også:
– Nå må vi diskutere om vi bør ha norske atomvåpen
Les også:
Trump sier han var sarkastisk da han lovte å gjøre slutt på Ukraina-krigen på 24 timer
Les også:
Ekspert: – Kan ikke stole på det Trump sier om Nato
(+)",Error generating text.,yes
8_19_03_2025,Høyre-profiler trosser Solberg: Åpner for å la unge stemme om EU,Mats Rønning,https://gfx.nrk.no/FHTTviP_7gzwHT6XQ92ikws6lcKEOzM34yEHMvAn-bmg.jpg,2025-03-18 16:46:29,https://www.nrk.no/norge/hoyre-profiler-trosser-solberg_-apner-for-a-la-unge-stemme-om-eu-1.17340028,Politics,"Høyre vil jobbe for å ta Norge inn i EU, men Høyre-leder Erna Solberg mener tiden ikke er moden. Forrige folkeavstemning var i 1994. Alle som er under 47 år har altså aldri stemt.
Det bør de snart få sjansen til, ifølge partiveteran og stortingsrepresentant Michael Tetzschner (H).
– Det er veldig dumt å låse posisjonene til at vi ikke kan komme ut av vårt utenforskap i løpet av de fire kommende stortingsårene, sier han til NRK, og fortsetter:
DUMT: Høyre-nestor Michael Tetzschner mener det er dumt å låse seg til et nei til EU-avstemming i hele neste periode. Foto: Mats Rønning / NRK
– Vi må forholde oss til at sikkerhetspolitiske situasjonen er forandret. Det har aktualisert et EU-medlemskap. Vi ser også at andre land, for eksempel Island, orienterer seg i retning av EU, sier Tetzschner.
Flere politikere og forskere har argumentert for at Norge bør koble seg tettere på EU fordi forsvarssamarbeidet med USA er blitt langt mer usikkert.
Tør ja-partiet Høyre jobbe for en ny folkeavstemning?
Du trenger javascript for å se video.
Tør ja-partiet Høyre jobbe for en ny folkeavstemning?
– Må starte debatten
Tetzschner får støtte av partifelle på Stortinget, Heidi Nordby Lunde, som har mange år bak seg i Europabevegelsen.
Også stortingsrepresentant Tage Pettersen mener det er helt feil av Høyre å utelukke en folkeavstemning de neste fire årene.
– Nå skal vi starte debatten om EU, og så kan det godt tenkes at vi mot slutten av neste periode kan få en folkeavstemning i Norge, sier han.
ÅPEN: Tage Pettersen mener Høyre bør åpne for en ny EU-avstemming i neste stortingsperiode. Foto: Stian Lysberg Solum / NTB
– Så du mener at man ikke bør utelukke en folkeavstemning i neste stortingsperiode?
– Utgangspunktet mitt for all politikk er å ikke starte med å utelukke noe som helst. Det vil komme når tiden er moden. Skal tiden bli moden, må vi starte debatten nå.
Pettersen viser til ferske målinger som viser at ja-siden har knappet inn på forspranget som neisiden over lang tid har hatt i Norge.
Nordby Lunde sier til NRK at det kan få alvorlige konsekvenser for norske interesser å være «bastant mot en folkeavstemning i en så omskiftelig verden som nå».
Uenig med Erna
I forslaget til nytt partiprogram som skal vedtas på landsmøtet i helgen, står det rett ut:
«Høyre mener norsk velferd, sikkerhet og konkurransekraft blir 50 bedre om Norge blir fullverdig medlem av EU.»
Høyre er det største partiet i opposisjon på Stortinget. Dersom tungvekteren går inn for å få fortgang i en folkeavstemning, øker sannsynligheten for at det faktisk blir noe av innen fire år.
Men da den mulige samarbeidspartneren på borgerlig side, Venstre-leder Guri Melby, slo fast at tiden er inne for en ny folkeavstemning, fikk hun en kald skulder av Solberg.
– Vårt utgangspunkt er at vi i neste stortingsperiode ikke skal ha en folkeavstemning, sa Solberg til NRK. Hun viser til at det fortsatt er flertall mot EU i meningsmålingene.
– Det vil ta tid å overbevise folk og få til en snuoperasjon rundt disse spørsmålene, sa hun.
– Mener du at Erna Solberg har gitt feil signaler ved å avlyse en folkeavstemning allerede nå, Pettersen?
– Jeg tror hun er realistisk i dette, at hun ønsker at det skal være oppslutning i folket over tid. Men den kan kanskje komme raskere enn det hun har trodd, gitt den situasjonen Norge og verden står i, sier Tage Pettersen, som til daglig er nestleder i Stortingets familie- og kulturkomité.
Tetzschner betrakter Solbergs uttalelser som mer av en prognose enn en garanti.
– Det er vel en vurdering ut fra dagens situasjon. Det er jo ingen enkeltperson i et demokratisk parti som kan hindre partiet i å mene at man kan ta det opp når man ser at tiden er inne.
Åpner for EU-kamp
Tetzschner sier helt kategorisk at Høyre ikke bør utelukke en EU-kamp med ny folkeavstemning i neste periode. Han viser til hvor fort opinionen snudde i synet på NATO-medlemskap i Sverige og Finland.
– Ikke utelukke er stikkord her. For det er jo det som gir Stortinget handlefrihet.
– Men er ikke det siste vi trenger nå, i en urolig tid, en polariserende og splittende EU -debatt?
– Hvorfor behøver den å være så splittende og polariserende? Vi er jo allerede tre fjerdedels medlemmer. Det er et stort spørsmål å melde seg inn i EU, men det er ikke et veldig komplisert spørsmål. Denne gangen har vi mer kunnskap på begge sider om hva det vil si å være med i EU, nettopp fordi vi er så godt integrert økonomisk.
Høyre-profilen sier han håper sikkerhetsgarantiene fra USA under Trump vil være like virksomme som før.
– Men som enhver fjellklatrer vet: Det er lurt å ha dobbel sikring.",Error generating text.,no
23_19_03_2025,Handelskrig bremsar investeringar i norske bedrifter – Storvik i Sunndal har fått Trump-toll på røyr,Marius André Jenssen Stenberg,https://gfx.nrk.no/PrQvNEj28Hqx10nEphuziw5Zr2i4EJP589VG7L6Fiwkw.jpg,2025-03-19 04:47:21,https://www.nrk.no/mr/handelskrig-bremsar-investeringar-i-norske-bedrifter-_-storvik-i-sunndal-har-fatt-trump-toll-pa-royr-1.17343534,"Business, Economics, Politics","USAs president Donald Trump innførte nyleg global toll på 25 prosent på stål og aluminium, mens EU har varsla mottiltak. Handelskrigen fører til ein uføreseieleg situasjon for norsk næringsliv.
Industribedrifta Storvik på Nordmøre har fabrikkar i både Noreg og Tsjekkia, og begynte i 2022 ei satsing i USA. Det har Trump sett ein stoppar for.
Allereie har dei fått toll på tapperøyr som dei leverer til aluminiumsindustrien i USA.
– Det han gjer påverkar oss i aller høgste grad. Det skapar masse uføreseielegheit, ikkje minst i forhold til investeringsviljen vår. No må vi avvente og sjå kva som skjer, seier Stein Kjartan Vik, administrerande direktør.
Storvik har fått toll på desse røyra til produksjon av aluminium, som dei leverer til USA. Foto: Marius André Jenssen Stenberg / NRK
Leverer til amerikansk bilproduksjon
På fabrikken held dei på med iherdig testing av den første av fem store støypemaskiner som snart skal pakkast ned og sendast til USA. Den er det ein amerikansk elbilprodusent som har bestilt.
Enno veit dei ikkje om det kan komme toll på desse. I verste fall kan dei risikere at bestillingane blir stansa, og fleire titals millionar går tapt.
Denne store maskina skal til USA for å bli brukt til produksjon av bilkarosseri. Storvik skal levere fire til, men veit ikkje om det kan kome toll på dei. Foto: Marius André Jenssen Stenberg / NRK
– I første omgang lempar vi tollbyrda over på kundane våre. Det blir òg påført ein ulempe på oss i forhold til konkurranse, som gjer at kundane våre må seie om dette blir for dyrt. Som igjen gjør at vi mister inntektsgrunnlag i det amerikanske marknaden, seier Vik.
Mange bremsar ned
Innovasjon Noreg skal gje råd til norske verksemder. Dei har hatt travle dagar den siste tida.
– No får vi mange førespurnader frå verksemder som er usikre. Både her heime, men også våre team i USA møter verksemder som lurer på korleis dei skal forhalde seg til både det som har kome av nye tollreglar, og det som ligg føre oss, seier administrerande direktør Håkon Haugli i Innovasjon Noreg.
Håkon Haugli er direktør i Innovasjon Noreg. Foto: Per-Ivar Kvalsvik / NRK
Dei ser allereie at Trump har hatt ein tydeleg effekt, også her i Noreg.
– Det fører vel til at ein bremsar ned, utsett investeringar. Ikkje gjer aktive framstøyt i marknaden. Så for den enkelte bedrift har det jo store konsekvensar. Men for Noreg også er dette alvorleg, seier Haugli.
Dei høyrer om mange ulike grep som bedriftene gjer.
– Kanskje det viktigaste er å vurdere andre eksportmarknader. Men òg ting som å bygge opp varelager i USA, jobbe med ulike mindre sårbare verdikjeder, og ikkje minst brukar veldig mange ressursar for å følgje med, seier Haugli.
Donald Trump har innført 25 prosent toll på stål og aluminium. Han meiner dette vil hjelpe amerikanske verksemder. Foto: JOE RAEDLE / AFP / NTB
Løner seg ikkje
Økonomiprofessor Ola Grytten trur ikkje det vil løne seg å halde igjen særleg lenge, sjølv i ein økonomi med handelskrig og Trump-toll.
Det er forståeleg at ein ventar med investeringar så lenge det er stor usikkerheit. Samstundes skal verksemder prøve å gå med overskot. Dei har kapital som ein må plassere ein eller annan plass. Så det er forventning om at pengane kan gje avkastning, sjølv om det er stor usikkerheit, seier Grytten.
2. april har Trump annonsert at det kan kome nye avgifter. Han kallar dagen ein frigjeringsdag for USA. Stein Kjartan Vik i Storvik skal følgje nøye med når Trump kjem på talarstolen.
Stein Kjartan Vik (til høgre) i Storvik har fått bekymringsmeldingar frå kundane sine på grunn av toll. Foto: Marius André Jenssen Stenberg / NRK
– Det blir litt sånn, «kor hoppar haren?» I dag må vi vere budde på at det uføresette vil skje om ein månad, om to månader, eigentleg heile den perioden Trump er president, seier Vik.",Error generating text.,no
31_19_03_2025,Ferrari-sjefen innrømmer trøbbel: - Må finne en bedre måte å kommunisere på,Ole Kristian Strøm,https://premium.vgc.no/v2/images/b35e6fe6-c269-4b35-8bd6-671a023a8594?fit=crop&format=auto&h=1471&w=2048&s=839c31ba05548180f4d09914989d8eed1264443b,2025-03-18 12:12:00,https://www.aftenposten.no/sport/i/GygArx/ferrari-sjefen-innroemmer-troebbel-maa-finne-en-bedre-maate-aa-kommunisere-paa,Sport,"Italienske medier er ikke nådige i sin vurdering av Ferraris innsats i Lewis Hamiltons debut i rødt.
Sesongåpningen i Australia endte med 10. plass for syv ganger verdensmester Hamilton. Nok en gang bommet Ferrari på strategien.
«Corriere dello Sport» kaller det «en katastrofe», mens «Gazzetta dello Sport» oppsummerer fansens spott i sosiale medier med en frekk «Lewis, velkommen til Ferrari!».
Formel 1-stjernen beskriver selv sin første Ferrari-opplevelse som en «berg- og dalbane».
Han er samtidig klar på hvor vanskelig bilen var å kjøre:
– Det var veldig vanskelig og gikk mye verre enn jeg trodde det skulle gjøre. Bilen var virkelig, virkelig vanskelig å kjøre, sier han til Sky Sports.
– Jeg er bare takknemlig for at jeg klarte å holde den unna veggen, for det var dit den ville mesteparten av tiden.
Ferrari hadde en tung dag i Melbourne. Charles Leclerc ble nummer åtte.
40-åringen delte sine følelser på Instagram dagen etter det turbulente sesongåpningsløpet og beskrev det som en «berg-og-dalbane».
– Definitivt ikke det vi hadde håpet på, skrev briten.
Kommunikasjonen mellom Hamilton og hans nye racingeniør Riccardo Adami var også anspent. Flere ganger ba Hamilton ingeniøren om å la ham være i fred over teamradioen.
Ferraris teamsjef Frederic Vasseur innrømmer at laget har utfordringer:
– Vi må finne en bedre måte å kommunisere mellom bilen og teamet på, sier han.
Formel 1-VM fortsetter allerede til helgen - nå i Shanghai.
Vil du lese mer om førerne, lagene, banene og duellene i 2025-sesongen? VGs store Formel 1-magasin kan kjøpes i vår nettbutikk (fri frakt!)",Error generating text.,no
